captions,likes,comments,hashtag
prawn fried rice lunch today easy simple let know want recipe ive posted recipe sesame tag give try foodstagram yummy instagood love follow foodblogger foodlover like homemade healthyfood photooftheday picoftheday dinner foodgasm foodie tasty cooking instadaily lunch bhfyp restaurant instagram foodiesinternationalchat,6.0,[],foodie
today marked closing date entry great taste award popularity award capacity entry reached well ahead 12noon cut time bishop fleming delighted sponsoring year great taste award mark head drink fleurannelewis caught john farrand manager director guild fine organiser great taste find award link article bio guildoffinefood greattasteawards guildoffinefood johnfarrand greattaste2021 foodawards foodoscars foodiesofinstagram foodlover accountant bishopfleminguk,1.0,[],foodie
wicked welsh lush shepherd pie one left ordinary takeaway dealdelivers deal_town hairybikers comfortfood foodbloggers,0.0,[],foodie
morning breakfast made baked oat dish filling versatile especially come topping eating like eating dessert breakfast without feeling guiltybakedoats oat chocolate breakfast breakfastideas foodiesofinstagram foodblogger,6.0,[],foodie
shrimp u april 4 take 2 double shrimp bowl genjigo location,0.0,"[""'#genjigo #food #foodie #columbus #columbusrestaurants #columbusrestaurant #hibachi #hibachibowls'""]",foodie
dm consultation exercise nutrition supplementation hyderabadblogger hyderabadpersonaltrainer hyderabadfitness indianfitness missionindiafit indiandiet indianfood indian homeworkout exercisemotivation exerciseinspiration,2.0,[],foodie
weekend photo taken rosemarydirectus look yummy thanks photo hope tasted good look plantbased plantsofinstagram plantbasedfood sauce saucy glutenfree freefromgluten freefromfood veganuk veganism asian asianfood asiansauce sweetchillisauce sweetandsour natural naturalingredients nomsg eatgood glutenfreefood glutenfreedairyfree cooking cookingathome cookingathome glutenfreesauce chinesefood homecooking,2.0,[],foodie
empezando la semana con esta rica completa ensalada de alubias rojas atún canalla huevo cocido cogollos de lechuga aguacate tomates cherry pimiento rojo cebolla morada maíz salad healthylifestyle healthydiet healthyrecipes healthy healthyfood homemadefood health instafoodie recipeoftheday recipe realfood diet yummy yummyfood tastyfood tasty gastronomy foodstagram foodlover foodphoto fitfood foodgasm fitfoodie,3.0,[],foodie
welcoming march authenticfood dessert kraftbox hamper cutepackaging yellowfancy polka yellowfood greatoast_ foodstagram foodism foodinsta foodaesthetic aestheticfood jktinfo jktfoodbang jktfoodies jktfooddestination foodlandfairy wentviral carpediem carpenoctem seizetheday,3.0,[],foodie
healthy avocado toast super easy make make perfect addition breakfast anytime snack avocadotoast instayum instayummy eeeeeats yummy dailyfoodfeed foodinspiration foodlover forkfeed eattheworld deliciousfoods foodblogger taste lefooding burgundy avocado capuccino_lovers cappuccino avocado avocadolover winterinnewengland newengland_igers newenglandphotography newenglandfood newengladnrdlife,4.0,[],foodie
love life life love lovefashionphotoofthedaybeautifularthappypicofthedayphotogram prettydogsofinstagrampartycoolinspirationselfiequeen instafoodartistworkoutfithealthyyummyfoodielikeforfollowblackblackandwhiteholidayhomeseabluepinknightphotography,4.0,[],foodie
need brunch box got featured fry bake waffle fried fish saltfish accra creamy boiled corn cheesy omelette garden salad assorted fruit kebab red velvet cupcake suescatering greattasteineverybite goodfoodgoodmood foodislovefoodislife islandlife foodofinstgram brunch brunchbox birthdaycake wegotyoucovered thankyou cheer chefsue tobago,0.0,[],foodie
holy voodoo rolld fried okra traegergrills meatchurch meatchurchbbqsupply bannerbutteratl traeger traegergrills meatchurch meatchurchbbqsupply traegernation traegerbbq traegeron teamtraeger goodeats traegerfamily foodblogger lobster lobsterroll friedokra woodfiredflavor goodfoodgoodmood eeeeeats smokedmeats smoked bbq okra foodstagram instagood lemon spicy cajun,3.0,[],foodie
classic ham hock terrine tarragon pickle somethings best kept simple tamworth hock trotter caper gherkin mustard little extra help make classic recipe coming soon terrine ham pig trotter french chef cheflife yum monday mondaymotivation deliciousfood pork,4.0,[],foodie
topping doritkemsley rhony rhonj rhobh rhod rhop rhoa rhoc realhousewivesofbeverlyhills beverlyhills housewife doritkemsley lisavanderpump kylerichards brandiglanville pizzahut buffet instadaily picoftheday love pizza pizzatoppings foodinspo tasty beautiful beauty recipe glam,1.0,[],foodie
home made spring roll momos go u chef mom home follow safar_da_swaad amazing content like comment share kanpur kanpurfood chef northindianfood tasty foodstyle kanpurbloggers featured explorepage indiafood homemade bhfyp kanpurinfluencer foodlove kanpurfoodexplorers zingyzest review photography party kanpurfoodexplorers streetfood blogger,3.0,[],foodie
4 dhs law price good quality loveyou loveyourself lover lover catsofinstagram abudhabi alain dubai beautiful beauty cafe café,3.0,[],foodie
mum home made mqarret dessert dessertlover foodphoto,1.0,[],foodie
birthday anniversary everything make celebration whole lot special ferraro caramel drip cake breadily baked ferrarocarameldripcake breadilybaked sweet dessert chembur craving yummy instafoodie ordernow orderonline march2021,0.0,[],foodie
business owner worried social medium following losing follower okay one leave never interested product never going purchase anyway focus stay new potential customer eventually show tantalizingeats latricesweettreats dcbaker cakesofinstagram dcchef cheflife privatechef catering goodeats foodstagram cake,1.0,[],foodie
home cake pie applecake applepie yolo deliciousfood teatime foodlover foodblogger foodstagram foodpic pictureoftheday petitfour poppyseedcake mondaymotivation monday instagay gay gayman gayfollow influencer gaycute gaylove gayhusbands,7.0,[],foodie
water let breakbread loaf available cannishop linkinbio wildyeast baker sourdoughstarter yummy artisanbread naturallyleavened foodstagram homemadebread homebaking sourdough bakery homemade bakingbread baking homebakedbread levain sourdoughbread realbread sourdoughbaking,1.0,[],foodie
beef stew local river watch beef thank supporting local farmer,1.0,"[""'#healthyfood #healthylifestyle #food #healthy #instafood #foodie #fitness #vegan #healthyeating #foodphotography #health #foodblogger #yummy #nutrition #foodstagram #delicious #foodlover #weightloss #diet #bulkit #fit #healthyliving #kansascity #eatclean #veganfood #shawneemission #overlandpark #lenexa #olathe'""]",foodie
cold weather weve sometimes nice sit bowl soup benefit making soup v canned soup homemade soup allows control quality ingredient well sodium content soup filling nutritious make wonderful family meal let know favorite goto soup comment want recipe cabbage soup comment ill shoot message,0.0,"[""'#cabbagesoup #souprecipe #choosewellness #glutenfreerecipes #ketorecipes #healthyrecipes #homemadecooking #glutenfreefoodie #hungrygirl #ketofoodie #eatwellbewell #healthyfoodideas #icookedthis #eatveggies #recipeshare #easyrecipe #healthymeals #healthysnacking #quickdinner #foodie #dinneridea #dinnerideas'""]",foodie
vanilla waffle blueberryufofriesandcorn foodstyling foodstagram foodblogger foodlover fry foodheaven foodheaven foodpic foodiesofinstagram foodie ahmedabad cgroad,1.0,[],foodie
basmati rice taking bulk order example feed 510 upwards yes taste even better look still contemplating havent placed order yet hey foodie send dm order call 07080522898 delivery available foodstagram lagosfoodie lagosfoodieassociation lagosfoodies lagosfoodieassociation lagosfoodvendors explore instablog bbnreunionnight,1.0,[],foodie
blueberry lemon baked oat comin u one fave combo recipe 40 gram oat blended 1 tsp baking powder think forgot lollll 10 gram vanilla protein powder used myvegan vanilla protein blend pinch salt 100 ml plant milk used almond flax chia egg 1 tbsp lemon juice doesnt fresh little bit lemon zest could leave add perfect lemon taste handful blueberry optional chopped walnut highly recommend get healthy fat omega sweetener used myvegan toffee flavdrops could use maple syrup whatever like instruction 1 preheat oven 180c 2 blend oat baking powder plant milk protein powder lemon juice lemon zest sweetener salt together 3 add flaxchia egg walnut blueberry stir together 4 bake 30 minute topped bluebs myvegan maple syrup little bit cinnamon alpro plain yogurt salted caramel protein powder myvegan course drizzle nut butter used almond butter 3 gram grounded flax seed 3 gram chia 23 tbsp warm water let sit 10 minute,3.0,"[""'•\\n•\\n•\\n•\\n#vegan #veganfood #plantbased #plantbasedfood #foodie #goodfood #foodporn #govegan #crueltyfree #veganrecipe #foodfreedom #intuitiveeating #dairyfree #discoverunder2k #discoverunder5k #discoverunder10k #bakedoats #bakedoatmeal #bakedoatsrecipe #veganrecipe #tiktokrecipe #tiktokbakedoats #porridge #proats #oatmeal'""]",foodie
customized belgian chocolate cake nailpolish theme rather love working cardstocks edible add beauty cake fondant feel good aspect health ordered client niece bday nailpolish lover something would excite bday girl merinaa24 beautiful cardstocks cupidarts dm celebration cake menu customising cake theme choice chocolatecake callebautchocolate darkchocolate darkchocolateganache nailpolishtheme customisedcakes personalisedcakes birthdaycakes madewithlove healthyingredients healthyfoodie chennai chennaibaker chennaihomebaker chennaibakersguild annanagar annanagarfoodie annanagarhomebaker,1.0,[],foodie
work hot tbt picture architecture instalike music instapic l4l luxury black fall explore instafashion wedding photo city style pretty lifestyle like4like workout photoshoot tagsforlikes sweet swag summer landscape training,2.0,[],foodie
baingan ka bharta baingan bharta spiced mashed eggplant dish popular indian cuisine baingan eggplant studded garlic green chilli roasted open flame stirfried aromatics smoky flavor baingan bharta recipe simple easy prepare recipe without use many spice recipe going sure shot hit home ingredient eggplantbrinjalbaingan1 250 gram onion 2 medium sliced tomato1 large sliced garlic clove 2 green chilli 2 whole ginger garlic paste 1 tsp coriander leaf 13 cup cumin seed 12 tsp green chilli 2 chopped turmeric powder 12 tsp red chilli powder 12 tsp cumin powder 12 tsp coriander powder 12 tsp garam masala powder 12 tsp salt taste instruction make 23 cut brinjal insert 12 green chilli garlic inside brinjal turn flame put brinjal gas stove roast medium flameflip roast till cooked properly side brinjal roasted properly turn flame let cool completelyremove stem peel properly mash along roasted green chilli garlicheat pan add oil let heat properlyadd cumin seedsfry second medium flameput onion fry 2 min medium flame light brown add ginger garlic paste chopped green chilli mix fry 1 minute medium flamereduce flame low add turmeric powder red chilli powder cumin powder coriander powdermix cook 1 min low flameadd tomato mix fry 5 min lowmedium flame tomato becomes softadd mashed brinjal salt garam masala powder coriander leaf mix properlyincrease flame medium fry minute keep stirringnow low heat cook 3 4 minsturn flame baingan bharta ready servegarnish coriander leaf baingan ka bharta readyserve rotiparatha rice end making amazing recipe dont forget tag happy cooking,2.0,"[""'#homemade #desi #love #easyrecipes #passion #indainblogger #karachifoodbloggers #instagood #yummy #indianstyle'""]",foodie
egg series day 1 place appu_sh8_shop egg chilly starting series visiting legendary place egg carstreet kept finger crossed since place super crowded evening eventually lead lot waiting time luck today egg chilly dry preparation plenty caramelized onion tomato instagram insta instafeed instadaily foodblogger instablogger photography yummyfood mangalorediaries mangalorefood kudla egg chilly spicy spicyfood,25.0,"[""'where is thiss?'""]",foodie
satisfying dish taste bud balistaind soothing ambience comfortable sitting arrangement cleanliness hygiene properly maintained selfservice place bake whole wheat bread pizza base quality serve make really good pocket friendly combo jain option also available tag share friend make drool frame pink pasta price 229 location balista 12a time square arcade 2 sindhu bhavan marg bodakdev ahmedabad follow bhookhadevil follow bhookhadevil follow bhookhadevil turn post notification ahmedabad pinksaucepasta pasta pinkpasta cheesy cheesyfood bhookhadevil,22.0,"[""'this look so delicious '"", ""'#picoftheday #bestoftheday #food #foodoftheday #foodphotography #foodstagram #foodgasm #foodie #pastalover #foodporn #foodblog #foodography #pastalovers #ahmedabadfood #foodblogger #ahmedabadfoodie #italianfood'"", ""'wow so tempting '""]",foodie
take mushroom pie enjoy x chickenandmushroompie photo photography blog blogger foodblogger pie homecooking foodblog cookwithme cooking cook chef healthy foodart aesthetic instagood dinner brunch instadaily instalike tiktok halalfood halalfoodie halal,23.0,"[""'love it '""]",foodie
japanese katsu rosmeryinthekitchen,3.0,"[""'#perth #cityofperth #perthnow #foodie #foodforthought #foodporn #asianfood #japanesefood #chicken #recipe #curry #katsucurry #katsudon #perthisok'""]",foodie
one meal used two meal costeffective eat deliciousfood delicioso foodgram seafood foodblog igfoodie foodblogger foodlove foodgasm yummy roastmeat tainanfood kaohsiungfood,61.0,[],foodie
special thanks vendor bridal bouquet rosyposyflorist catering venue swissbelresidenceskalibatajkt weddingswissbelkalibata decor littlesmiledecoration henna fake nail hennajakarta makeup artist attire kebayavenirahman mc rio_sswnt photography videography kuntjorophotography seserahan tray decor kukashiseserahan wedding consultant yosefienkr wedding organizer newlywedswo,133.0,"[""'#foodie #food #foodblogger #likeforlikes #photography #aesthetic #foodstagram #kawaii #followforfollow #jakarta #jkt #indonesia #foodlover #followme #likeforlike #love #fashion #beautiful #photooftheday #throwback #cute #tbt #happy #likeforspam #comment4comment #c4c #blogger #ootd #explore #travel'""]",foodie
mydinner letseat chixandfries foodieph foodpics foodpictures mobilephotography,1.0,[],foodie
spicy roll spicyfood,1.0,[],foodie
fry express mood happy mode place bythebaeversova fry lover express mood seeing turn post notification classofyum fry burger frenchfries yummy burger foodstagram foodlover fastfood cheese beymd foodblogger foodie foodgasm pizza dinner lunch frieslover wing hamburger cheeseburger tasty friedchicken instagood classofyum,10.0,[],foodie
never say momos momos lover tag friend share spread love post follow food_fasscinated_me mouthwatering dish food_fasscinated_me food_fasscinated_me food_fasscinated_me food_fasscinated_me instagram hungry followforfollowback instadaily foodstagram foodblogger likeforlikes share comment instalove instamood indianfood yummy reelkarofeelkaro instagramreels reelitfeelit foodblogfeed foodstyling foodoftheday foodbeasts mumbaikar,7.0,"[""' too good not to like this post'""]",foodie
home made mix achaar achar pickle indianfood pickle homemade foodlover spicy homecooking foodie yummy india foodstagram foodblogger indian achaar masala aamachar mangopickle bhfyp chillipickles salad chickenbiryani sindhifood bhfyp,3.0,[],foodie
hey everyone nice sunny monday morning enjoying tomato mozerrla gnocchi tossed butter grated cheddar pumpkin seed along fresh salad tomato cucumber freshly squeezed lemon gnocchi italianfood pasta fresh italian homemade italy salad vegetarian eastvillage earth eeeeeats,3.0,[],foodie
sada roti fried carailibitter melonbitter gourd didnt always like caraili love meatlessmonday sadaroti caraili caraille bittermelon bittergourd trinibreakfast breakfast trinidad trinidadfood trini trinifood trinidadfoodie trinifoodie 868 trinidadandtobago westindiancooking islandfood islandlife caribbeanfoodie caribbeanfood instafoodie instadaily platedintnt yummyfood yummy getinmybelly,5.0,[],foodie
turkey bacon bagel healthjourney fitnessjourneyonlinecoachfitnessdiet healthylifestyle workouteatclean macrosloseweightweightlossnutritionmotivatedweightlossjourneyweightlossukhomeworkoutdietjourneyhealthyfood nutrition healthy health healthylifestyle healthyeating cleaneating fitness healthylivinglifestyledietplans,6.0,"[""'collab? dm @kintasin_official'""]",foodie
haldiram v bikanervala one prefer comment find detailed review website link bio like share follow jalpaanindia amazing update follow jalpaanindia follow jalpaanindia follow jalpaanindia amazing awesome bestshot bestpic bestreels instalike instareels love like reel reelkarofeelkaro reelsinstagram indianstreetfood indianfoodblog indianfoodbloggers delhifoodblogger bestshot foodgasm foodpornography fff foodtalkindia foodreview foodblog foodblogger munchymumbai jalpaanindia foodiesofindia cholebhature haldirams,7.0,[],foodie
mushroom puff pastry hot pocket watch channel sure follow update subscribe youtube channel link bio بف بيشتري بالدجاج والفطر لذيذة وسهلة لا تنسون تشتركون بالقناة الرابط على البايو trendingfoodies mushroom puffpastry halalfoods deliciousfood foodart foodstyling foodiesofinstagram دجاج فطر بف_باستري معجنات_مشكله معجنات طعم_لايقاوم شيف_شاهين_دعم_صناع_المحتوى اطيب_وصفة بغداد,3.0,[],foodie
tomorrow podcast talking annapotvin_ health wellness mom baker thing yummy healthy twist yes cake eat cheesecake wellness homechef selfcare family lifestyle podcast,2.0,[],foodie
barbecue bacon sandwich crab rangoon dip wontonsa 12 pack sunfish go sunfishbeer one favorite beer seadognoco north conway nh bostonsfinestfoodie boston bostonfoodies bestofboston bostoneats bostonfoodgram bostonfoodguide bostondining bostoneats beantown newengland newenglandfoodie eastcoastfoodies instagram igers foodlover fortheloveoffood foodgasm foreverafoodie foodsofinstagram eatingfortheinsta foodstagram itsabostonthing,3.0,[],foodie
best platter dont forget tag friend kobee grill shop 33 eros city square sector 49 gurgaon 550 two approx 495 place order zomato call 9870759407 recommended follow u kobeegrill20 follow u kobeegrill20 follow u kobeegrill20 save post collection share post friend tag post kobeegrill kobee gurgaonfoodie turkishfoodrecipes turkishfoodie turkishfoods gurugramkabab zomatodelivery turkishrestaurant bestplacestogo indianfood gurgaonfood turkishcuisine gurgaon gurgaonrestaurants gurgaonfoodblogger gurgaonfood gurgaonfoodie kabab bestoftheday best gurugramkabab,3.0,[],foodie
know yall gonna love new crab melt toastie get back stgeorgesbelfast made local kilkeel crab irish farmhouse cheddar special seafood sauce seafoodlunch crab tasty sarnie cheese shellfish eatlocal tastetheisland ireland irish instagood,3.0,[],foodie
eating energy experience guy fieri lunch wrap experienceanorexiarecover anorexiafighter eatingdisorder recoveryispossible eatingdisorder edrecovery recoveryanorexia recoveryjourney snack yummy tasty lecker sweet happy love motivation behappy nevergiveup instadaily,11.0,[],foodie
latest addition menu rate artwork comment section pizza lovepizza salami happyhour longstreet coachonlong coachcafe cheesy,2.0,[],foodie
nationalpbjday stuffed stuffedcookies cookiesofinstagram cookieporn cookiesofinstagram cookiemonster cookiedough pb pbcookies peanut peanutbutterandjelly peanutbuttercookies peanutbutterlover peanutbutteraddict strawberry strawberrymilkshake milkshake foodiesofinstagram cookieporn cookieaddict foodblogger foodiesofinstagram,7.0,[],foodie
one simplest yet finest matri kulche street vendor outside hdfc bank ansari rd daryaganj new delhi delhi 110002 priced r 25 2 kulchas happen area try enjoy video jhakaas kulche streetfood dilli_ka_foodie thanks reco,2.0,[],foodie
patagonianshrimp shrimp patagonia wildshrimp seafood patagonianseafood langostinos fishing foodpic yummy foodlover healthy foodstagram instafish frozenfood eatography bestfoodworld langostinos langostinos shrimp shrimp squid squidskiing calamar calamares,6.0,[],foodie
would wanna try pizza yummyfood foodpictures nstagram foodstagram straitstimesfood foodpics foodphotoshoot 8dayseat singaporefood singaporefoodie singaporefoodies,4.0,[],foodie
glutenfree pizza plantbased veganfood vegetarian healthyfood crueltyfree organic glutenfree healthy veganlife healthylifestyle govegan vegansofig veganrecipes love veganism vegano natural whatveganseat fitness veganfoodshare health yummy dairyfree homemade pizza,10.0,"[""'collab? dm @kintasin_official'""]",foodie
lumonde sweet potato x smoked fish peanut sauce lunch foodie foodpic foodphotographer foodgram foodblogger foodstagram foodlovers fooddiary africanfood caribbeanfood africanfood african ugandanfood yummy tasty eathealthy dinner lunch breakfast foodpic dessert foodgasm nomnom foodblog africanchef chef londonfoodie ugandan,13.0,[],foodie
fresh afternoon stroll cook chef meal protein fat fat carbs veggie lowfat highprotein macro iifym calorie cakories caloriecounting exercise movement mindset lifestyle makeithappen goal goal coach coaching toogoodnutrition thetalkingwalker recipe pack visit toogoodnutritioncouk,3.0,[],foodie
guilty pleasure chicos_london craving normal order chico smash burger alongside loaded fry drooolll tried new guava fizz time soooo nice hubby went chick n tikka thigh burger absolutely loved kept saying really nice every bite time tried chilli chip new strawberry mist drink let say thoroughly enjoyed always ordered chico peri peri half mild always chicos_london chico burger fry delish takeaway order craving sarisfaction meal scrumptious foodblogger foodism halalfood foodstagram foodlover takeawayfood,4.0,[],foodie
super tasty raj kachori chaat plz try youll thank later place new raj kachori bhandar tilak nagar delhi available zomato update plz follow flavoursjungle flavoursjungle flavoursjungle chaat rajkachori delhifood foodie foodblogger delhiites delhiblogger foodlover loveforfood lovedesifood dilsefoodie foodstagram foodtalkindia biharfoodie bihari foodlove,4.0,[],foodie
seems like smart move start week right tonyboloneys,51.0,"[""'.\\n.\\n.\\n.\\n.\\n.\\n. \\n#food #eeeeeats #devour #infatuation #eats #foodie #foodies #9gag #foodbeast #forkyeah #foood #cheatdayeats #devourpower #cheatday #dailyfoodfeed #insiderfood #thisisinsider #feedfeed #foood #brunch #dinner #lunch'""]",foodie
coco pop healthjourney fitnessjourneyonlinecoachfitnessdiet healthylifestyle workouteatclean macrosloseweightweightlossnutritionmotivatedweightlossjourneyweightlossukhomeworkoutdietjourneyhealthyfood nutrition healthy health healthylifestyle healthyeating cleaneating fitness healthylivinglifestyledietplans,6.0,"[""'dm @fitfamunity'""]",foodie
get half half biscoffblondies jammydodgerblondies grazingboard cheeselovers graze grazer grazebox likeforlike 2021 karaskitchenkk sweetgrazebox savourygrazebox cheesecake cake cakesicles heartcakesicles cakepops essex rochford southendonsea bespoke feasting essexcatering celebration lockdown supportsmallbusiness mothersday mothersdaygrazebox,3.0,[],foodie
waste management project upcycling left something attractive tastier turkey popular must item party table christmas time lot left turkey especially le juicy cutswhat pulled turkey burger one favourite item menu list boxing day left turkey christmas party bbq sauce perfect solution turn turkey juicy tender excellent choice boxing day brunch opening christmas present foodwaste foodwastemanagement upcycling foodforthought tasty pulledturkey burger yummy foodideas bbq foodielife turkey boxingday brunch brunchideas foodiesofinstagram juicy tender idea eat christmas singaporefood sgfoodstagram sgfoodies simpleisbest,6.0,[],foodie
labrew_sa 1010 labrew_sa finally got chance head labrew_sa kiosk located ajdan walk drink dessert takeaway definitely perfect place try cronuts tried chocolate flake pistachio cronuts love cronuts recommend trying place love dark hot chocolate love sweetness diluted without losing chocolate flavor hot chocolate 1010 2200 sr flat white coffee 1010 1800 sr pistachio cronut 1010 1900 sr chocolate cronut 1010 1900 sr ajdan walk labrew_sa اخيرا جت لي الفرصة أروح على labrew_sa المحل عبارة عن كشك بأجدان ووك فيه مشروبات لذيذة و حلويات بخدمة التييك اواي جربت من عندهم كرونات بنكهة الفستق و شكولاتة فليك عجبني الكرونات مراااااا أنصح الكل يجرب الهوت شوكلت طعمه لذيييييذ و ما فيه سكر كثير saudiarabia khobar ksa intsagood instalike instadaily instagood desert cake hotchocolate chocolate photography photo photographer photooftheday explore coffee,10.0,[],foodie
