captions,likes,comments,hashtag
march going meaty affair sourcing cattle product bonsaro doesnt ensure safety quality assure abides hygienic process eliminate every possible threat safety enjoy without worry doubt find u various location mumbai andheri east andheri west chandivali chembur dahisar east goregaon east kharghar mahakali navi mumbai powai santacruz east thane west bonsaro bonsaroindia freshmeat freshseafood seafood fish mutton babyshark bangda promfret bombayduck clam crab shrimp prawn homedelivery doorstep tasty fresh freshfoodmumbai homedeliverymumbai mumbaifooddelivery meatloversindia mumbaifoodlovers freshseafood marchmonth,5.0,[],meat
primerib dryaged foodnetwork foodgasm beef bbq meatcoma grilllife grilling fire lownslow churrasco carne butcher yum butchery butchershop steak steak sirloin sirloinsteak ribeye entrecote meatporn grillporn dryagedbeef,2.0,[],meat
sleep dog cockerspaniel wroclaw love bestfriends warm loveu littlegirl poland dogpolish,13.0,[],meat
foodpicoftheday foodpic foodgasm yummie sauce dish dinner cuisine meal tomato beef lunch spice spaghetti pepper restaurant vegetable herb hot,59.0,[],meat
british banger acquired name sometime around world war 1 scarce filler water added sausage made regular explosion upon cooking day still quite common traditional british banger split cooking due juiciness filling although cooking slowly help prevent sausage fact banger juicy britishbanger kotakinabalu meatlovers freedelivery kksmokehouse,4.0,[],meat
stroganoff see exciting news event subscribe newsletterhttpfarmyardbutcherycoza eatmeatfirst brakpan spring nigel heidelberg raw whatsfordinner whatsforlunch braai biltong braaivleis friend family farm theonlymeattoeat,3.0,[],meat
crumbed schnitzel creamy mushroom homemade crumbling best schnitzel top love mushroom go hand hand schnitzel dinner crumbed crumbedschnitzel creamymushroom mushroom schnitzel homemade yunmy hungry easydinner veges,6.0,[],meat
often dinner hut look like utilising previous hunt venison burger im lucky boy great cook,15.0,"[""'#venison #deer #burger #dinner #notroughingit #eatwhatyoukillco #huntingnz #hunting #hunt #huntingtrip #shehuntress #girlswhohunt #traceable #meat'""]",meat
crispy lime boneless thigh easy quick meal weekday served steamed broccoli asparagus ingredient 3 tablespoon olive oil 14 cup fresh squeezed lime juice juice 2 lime 14 cup fresh chopped cilantro 1 teaspoon red chili pepper flake 4 clove garlic minced 34 teaspoon ground cumin 6 boneless thigh salt pepper taste fresh cilantro leaf serve lime slice wedge serve chickenmeatpicofthedayfoodfoodiefeedfeedketodiethealthhealthymealeatwellproteinhungrycreamhomemadefamilyhomedinnerdinnertimenomnomfoodporninstamoodinstafooddinehomecookingfeedmemyhappyplacefitnessfriendswellness,518.0,"[""'loove this'"", ""'yummy! '"", ""'lovely presentation..'"", ""'literally stunning '"", ""'that look terrific! \\u0001f90c'"", ""'amazing post! i loved your page and i also saw you love the keto community just like me\\ni also gave you a follow because i am an aspiring nutritionist myself\\nlove your post,keep it up'"", ""'hi"", 'eëä is a safe space where i post everyday about positive affirmation', 'how to increase feminine energy and how to manifest your thought into reality', ""is it something that currently resonates with you ?'"", ""'love it dm @fitfamunity'"", ""'love it dm @fitfamunity'"", ""'love it dm @thefitgains'""]",meat
è venerdì ce lo meritiamo hamburger di chianina provola salsa tartara dinner hamburger instaburger burger homemade homecooking homemadefood foodpic foodlover foodblogger eat yummy,22.0,[],meat
welcome brand new month stunning recipe make comfort home youre going love ingredient thigh 1 cup grated parmesan cheese 12 cup butter melted 1 tsp paprika 1 tsp thyme 1 tsp garlic powder salt pepper taste direction 1preheat oven grease baking dish 2in large bowl mix cheese thyme paprika garlic powder salt pepper 3soak melted butter dip mixture make sure evenly covered 4add baking dish skin side 5bake 3545 minute 6serve choice recipe recipe recipeoftheday recipeshare recipesharing recipeshare thebutchersmarket bellville capetown foodlover meatlover foodlife foodie feelgoodfood mouthwatering meatfeast meatlove foodiesgram instagood instagram meateater butchershop freshmeat foodstagram butchery capetownbutchery propermeat mondayrecipe,1.0,[],meat
get taste bud fired amazing recipe sure get new month started great note ingredient breast skinless boneless 1 tsp garlic powder 2 tsp oregano salt pepper taste fresh parsley sauce oil 3 garlic clove minced 1 cup heavywhipping cream drizzle lemon juice 12 cup grated parmesan cheese 23 cup asparagus chopped cooked pasta linguine pasta choice salt pepper taste direction 1flatten breast rolling pin 2season salt pepper garlic powder oregano olive oil 3in large pan cook 5 minute golden remove set aside 4add olive oil minced garlic pan cook second add heavy cream drizzle lemon juice allow simmer 5add chopped asparagus pan cook 45 minute 6add grated cheese season according taste cut thin strip add sauce 7add cooked pasta serve fresh parsley garnish recipe recipe recipeoftheday recipeshare recipesharing recipeshare backtoschoolrecipes thebutchersmarket tokai capetown capetownsouthafrica tokaijunction meatlover foodlife foodie feelgoodfood mouthwatering meatfeast meatlove foodiesgram meateater butchershop freshmeat foodstagram butchery capetownbutchery propermeat mondayrecipe,2.0,[],meat
shop fresh cherry tomato online best priceget day delivery order also explore wide variety favorite fruit grocery fresh dryfruits special discounted price hand pick fresh one get door step hour visit wwwentekartcom explore range product staysafe entekart healthyfood healthy broccoli instadaily healthylifestyle love lettuce fresh grocery homeessentials iceberg nature foodstagram health orange groceryshopping,10.0,[],meat
1st march already nearly picnic time thank u later thank biffalife repost scotch egg lot different theory scotch egg originated london department store fortnum mason claim invented scotch egg 1738 cold traveller snack wherever came make perfect snack starter try adding chorizo black pudding sausage make sure egg runny whats favourite condiment scotch egg feedyoursoull meatloaf meateater meatlover meatpie meatporn meatlovers bbq bbqtime bbqfood bbqmaster bbqbeef bbqbrisket bbqsmoker bbqmeat pork sausage beef biffalife scotchegg egg egg eggsofinstagram chorizo snack snack snacktime snackideas picnic,5.0,[],meat
dydd gwyl dewi hapus happy st david day butchersofinstagram artisanbutcher butcher butchery snowdonia eryri llanrwst pie porkpie sausagerolls local sustainableagriculture,40.0,[],meat
barbarian bunka tomregulastyle chefsknife handforged michelangelofoundation michelangelofoundation experienceexcellence homofaberguide artknife chef cooking bbq grill smoked steak customknives chefsplateform edc foodartproject foodartproject customcutlery art eatingtools eatingtools blademagazine blade_magazine bushcraft outdoors campinglife foraging hunting shooting,15.0,[],meat
new month new recipe nothing say refreshing quite like recipe enjoy making lovely weekend meal ingredient 1 cucumber 2 lemon 12 tsp caster sugar 12 tsp cumin seed 2 tsp paprika 12 tsp harissa chilli pepper paste fresh coriander salt pepper taste cooked rice serve direction 1cut cube season salt pepper paprika 2add oil heated pan toss cumin seed cook lightly toasted 3add pan cook 45 minute high heat 4add harissa chopped coriander pan 5to make salad cut cucumber half lengthways remove seed cut slice 6pour squeezed lemon juice bowl add cucumber caster sugar drizzle oil stir thoroughly place refrigerator 7serve cooked rice cucumber salad recipe recipe recipeoftheday recipeshare recipesharing recipeshare thebutchersmarket mitchellsplain capetown foodlover meatlover foodlife foodie feelgoodfood mouthwatering meatfeast meatlove foodiesgram instagood instagram meateater butchershop freshmeat foodstagram butchery capetownbutchery propermeat mondayrecipe,2.0,[],meat
guaranteed satisfactionbbq barbecue grill bbqlife bbqlovers grilling steak churrasco beef foodstagram rib barbeque brisket yummy carne pork dinner foodlover meatlover,7.0,[],meat
guaranteed satisfactionbbq barbecue grill bbqlife bbqlovers grilling steak churrasco beef foodstagram rib barbeque brisket yummy carne pork dinner foodlover meatlover,7.0,[],meat
guaranteed satisfactionbbq barbecue grill bbqlife bbqlovers grilling steak churrasco beef foodstagram rib barbeque brisket yummy carne pork dinner foodlover meatlover,5.0,[],meat
yakinikukorean bbq lunch part two 2 yakiniku korean koreanfood bbq foodstagram lunch foodpic,10.0,[],meat
monday new york strip steak ft bone marrow monday steak bonemarrow,23.0,"[""'#meats #meatlover #meatmonday #meatmondays #steaks #newyorkstripsteak #newyorkstripsteaks #food #foodie #foodies #foodoftheday #foodstagram #macros #meateater #meateaters #yummy #yum #foodiesofinsta #foodlife #goodfood #goodeats #eatgoodfeelgood'""]",meat
tender juicy easy slicing dalstrong shogun series slicing carving knife,9.0,"[""'#meat #meatlovers #beef #burger #shennsgrills #smokedmeat #fire #grillingmeat #dubai #dubailife #food #mydubai #pitmaster #cooking #yummy #smoke #smoking #bbq #passion #chicken #wings #brisket #lamb #carnivore #ribs #bbqlife #bbqlovers #bbqporn #bbqribs #seafood'"", ""'that look absolutely delicious"", ""shenns :)'"", ""'@texicanabbq_ what do you think?'"", ""'the question is not what do i think but how doe it taste... '"", ""'nicely done!!'""]",meat
yakitori grill bbq grilling barbecue steak beef foodstagram grilled bbqlife bbqloversr barbeque bbqporn r foodblogger chefsalert foodartchefs chefsofinstagram culinaryarts gastronomy foodstarz chefporn,30.0,[],meat
simple lunch plate plain rice mutton curry salad follow aahar_by_aditi aahar_by_aditi aahar_by_aditi aahar_by_aditi aahar_by_aditi mutton muttoncurry muttonlover muttonlove nonveg odisha odiastyle soulfood muttonkosha kolkata kolkatargolpo kolkatafoodie kolkatafood mangsokosha instagram dailypost meatfriday speciallunch delhifoodie meatlover,50.0,"[""'wow delicious food '""]",meat
welcome march wish beautiful month ahead meatsellers meatsellersinlagos meatsharing cowmeat goatmeat beef,5.0,[],meat
easy smile friend dogsofinstagram dog toutou wwf 30millionsdamis toiledejouy hairy animal animaux poi pea nice maltraitanceanimale nonalabandon howmuchisthatdoggyinthewindow doggie,12.0,"[""'please dm u @glamorous.furbabies'"", ""'hi dm @pawbless for collab'""]",meat
need water water essential body check picture know credit kylecoughlan also follow weightloss_ideass daily weight loss related informational post dont know start weight loss check link bio get info keto diet extreamly good healthy way weight loss must check know healthmastery quickmeals healthierchoices foodinspiration thefitnesschef fatlosshelp fatlossdiet fatlosstips halotop eatsmart lowcalorie calorie caloriedeficit caloriecounting losefat diet dieting smartchoices nutritionfacts losebellyfat springblossoms weightwatchersfooddiary pinkblossom losebabyweight,1.0,[],meat
morning light meatsmith_melb st kilda butchersofinstagram cabinet fillingthecase colourequalsflavour butchershop butcher butchery butchersofmelbourne handcrafted craftbutchery butcherlife melbournefood melbourneeats supportlocal australianproduce australianmade meatsmith butchersguide,10.0,[],meat
repost bigc_kitchen ridgefield washington pork belly burnt end ingredient 23lbs pork belly slab spg salt pepper garlic powder spiceology overthefirecooking nashville hot maple bourbon seasoning 12 cup brown sugar 12 cup butter cut 8 piece 1 cup white rice 1 green onion chopped recipe cook rice ahead time dont know cook rice get ride cooker rub whole pork belly spg keep covered fridge overnight wash remaining season pork belly water pat dry cut pork belly 12 cube cover favorite seasoning smoke 250f 25 hour rimmed tray make sure rimmed tray pork render lot fat dont look 25 hour add butter brown sugar mix smoke additional 15 hour toss pork belly remaining juice serve immediately white rice chopped green onion enjoy pork porkbelly smoked smoke meatcandy yummy recipe tasty homechef enjoy rice traegergrills traeger,3.0,[],meat
repost lebanesevegans planet earth injustice wont kept dark anymore veganforjustice vegangortheanimals govegan beef steak meatismurder compassion letmypeoplego peacablekingdom danieldiet compassionoverkilling compassionforall compassionovercruelty fruitofthespirit gen129 christianvegan veganislove veganforthefutureofourchildren veganforanimals veganforhealth veganfortheplanet veganforeverything veganforever fruitsofthespirit christianvegan provemewrong,20.0,[],meat
قصابی_حرفه_ای قصابی butchershop,8.0,[],meat
favourite snack one text away place order via whatsapp meatzandco rawchicken organicchicken farmfresh qualityfood homedelivery shopping qualityproducts guaranteedfresh contaminationfree fish premiumquality chickengrocery opennow ordernow whatsapp placeyourorder,8.0,[],meat
red meth steak,6.0,[],meat
spanish meatball coming soon henryshowtos henryshowtos youtube youtuber youtubecreator chef videorecipe foodgasm foodphoto anaistasteofpersia jazzvehpizza spanish spain meatball meatball spanishfood spanishmeatballs,24.0,[],meat
pork skinning machine adjust thickness removed skin easy operate disassemble clean telwhatsappwechat 86 15221311443 email darren06daruibaocom porkskinningmachine porkskinremovemachine porkmachine meatmachine pork foodmachine daribo daribofoodmachinery,1.0,[],meat
throwback week february finally taste bibim naengmyeon people every korea reality show eating basically cold mixed noodle actually like omg noodle broth light side dish like egg cucumber well balanced taste ordered spicy spicy still like also ordering japchae cannot korean dining without ordered sundubu table pretty much full people hungry photo overall really enjoy eating teehee borngaindonesia pockygurume dinner korean kfood bornga borngaindonesia bornganeosoho kuliner grilledmeat samgyeopsal bibimnaengmyeon japchae sundubujjigae noodle coldmixednoodles eat neosohomall neosoho,4.0,[],meat
welcome monday special experience arugula gourmet hamburg choice 4 hamburger ready enjoyed restaurant delivered home contact chef louis directly contact number 0737884272 bbq cheese hamburger restaurant hamburgergourmet gourmet lunch gastronomia hamburg like welgemoed foodie pub love steak arugula eat cheddar hamburgersa hamburgueriaartesanal panino homemade burgerlovers hamburguergourmet takeaway,10.0,[],meat
new roast video link bio long time made roast video hope enjoy please dont forget give opinion comment section read reply roast meme funny meme sundayroast coffee youtube tiktok roastdinner comedy funnymemes trending beef yummy instagood like bhfyp,72.0,"[""'the poster of the video is already the best '""]",meat
humble rump steak often forgotten behind glamorous sirloin scotch tenderloin brother like little brother often pack surprising punch balanced flavor juiciness incredible tenderness well procured rump something cherish blackopalwagyu rumpsteak beef butcher wagyu rostbiff eyeofrump tender juicy butchersofinstagram qualitymeatsorigin,22.0,[],meat
oh goodness meatporn meatlovers meatlessmeals meateater foodpics foodlover foodstagram steak steakdinner steaklover steaklife,9.0,"[""'whoooooohw.. this is uuurrrgghhh i want this!!!!'""]",meat
chilli con carne perfection using best mince beef town davidslarder butcher place go produce visit store great variety dinner idea lunch dinner meal chef cheffood madeathome mealoptions foodgram instaeats nutrition healthy dinnerserved cookedathome butcher produce cooking homecooking idea scottishbutcher northryde coxsroadmall shoplocal supportsmallbusiness,20.0,[],meat
cake chocolatecake baking sweet port meal lunch breakfast dinner happyeating happyfood love sugar lifestyle kakku suklaa chocolate burger pizza soulfood,15.0,[],meat
supportlocalbusiness купувајдомашно свежо месо секогашсвежо meatlover jabudimeljubovtakonvkusovite delikatesspopovski јабудимељубовтаконвкусовите amazing instagood photooftheday sweet dinner lunch breakfast fresh tasty delish eating foodpics eat hungry food,11.0,[],meat
left crispy salmon taco right al pastor taco topping homemade salsa verde green cilantro pineapple marinated red onion great week everyone new foodstagram yummy instagood love follow street foodlover like homemade healthyfood photooftheday picoftheday dinner foodgasm foodie tasty cooking instadaily lunch bhfyp restaurant healthy trending,45.0,"[""'yummylicious '""]",meat
bringing pizza never seen beef cheese pizza burger bite grill box grilledtoperfection winter grillingseason unitedarabemirates,15.0,[],meat
one really love nature one find beauty everywhere vincent van gogh instagram foodpicoftheday foodpic foodgasm yummie healthy vegetable meal hot dish dinner pepper restaurant cuisine closeup cooking salad oil diet health,9.0,[],meat
variety spice life right well cat agree know raw feed grind blend family cannot still want continue healthiest diet kittieswhich raw always recommended best convenient balanced blend delivered right door darwinspetfood see zaia zilly gia getting choose lamb turkey funny definitely let know like best want something different normal cat want rotate protein darwin make easy know many people feed raw new concept happy answer question basically cat cat obligate carnivore specie appropriate diet like veggie specie appropriate rabbit taurine important diet cat organ especially found organ meat dark meat making sure raw blend balanced sooo important moisture essential cat diet raw provides dry food dehydrate lead kidney issue long term question would like try raw blend kitty darwin right place order darwinspetfood use coupon code leapoffaith additional saving cat cat bengalcat leap_of_faith_bengals darwinspetfood meow rawfedcats kitty carnivore catdiet f1bengal g2bengal,133.0,"[""'zilly look so big now!!! did chickennn win?? '""]",meat
great start week ahead share story u thebutcherboys weloveourcustomers photo credit ta,72.0,"[""'#reels #qualityisntexpensiveitspriceless #highlights #trending #weekend #spitroast #sundaybbq #tomahawksteak #skewers #ribs #rockdale #familyowned #butchers #sydneybbq #sydneyaustralia #deliveryservice #holidays #bbq #open7daysaweek #wagyubeef #steak #lamb #sydneycatering #announcement #newconcept #comingsoon #instagood #meat'""]",meat
48alexx1 usa video realgood cosina grilllife latino grill cocinando amorporlacocina steak latinosenusa parma l4like cooking 48alexx1 enjoylife easyrecipes enjoy ohio clevelandohio parmaohio forlove imissyou iloveyou ineedyou waitingforyou comewithme onlyforyou,10.0,[],meat
buenos días cómo te sientes hoy good morning feel todayinstafoods tastyfoods carne barbacoa bistec foodlovers life catador churrasco kebab costela bbq porco bbqlovers burger picanha cerveja rice,200.0,[],meat
quick sketch made thought id share tell thought critique cow sketch digitalart blackandwhite lineart mouseartist mouse mouseart cow vegetarian simple computerart cartoon cartoonart drawing animal animalart milk blackpen wall,10.0,[],meat
today special 01032021 black pomfret avoli 2990 bd per kg parava 2190 bd per kg indian sardin mathi 1990 bd per kg white modha 2990 bd per kg hamam large 1290 bd per kg vatta 2790 bd per kg sheelav steak 500 gram 1990 bd seabass 2790 bd per kg crab 1290 bd per kg safi 2990 bd per kg sulthan ebrahim 1490 bd per kg sheri small 0990 bd per kg seabream 3490 bd per kg fasker 1390 bd per kg marayoor jaggery 1500 bd per kg raw jackfruit dehydrated 1600 bd per 250gm bq fresh many freshlycaught fish marinated product delivered home call 1740 6237 call whatsapp 3875 1237 fresh catch grab android httpsplaygooglecomstoreappsdetailsidcomappbqfreshhlen io httpswwwappexecutablecommobiledownloadappappide6053c89ea8d online wwwbqfreshcom today special offer jaggery jackfruit steak marinated fresh fish seafood freshfish bh bahrain onlineshopping preservativefree mutton freshseafood homedelivery,1.0,[],meat
bavette steak swiss black angus bavette blackangus beef meatlover steakhouse steak butcherofinstagram foodlover foodblogger foodstagram foodpic photography photooftheday photo zürich zurich switzerland swiss swissblackangus,118.0,[],meat
wishing everyone happy healthy march come get fix month contact ant 27825062610 grant 27722581217 order butcheron44 merrivalebutchery butchery howick kznbutchery bestbutcherykzn bestmeat braai shisanyma biltong southafrica enroutebutchery agrisales farmer southafricanfarmers qualitymeat topquality christmasmeat beef filletspecials meatspecials biltong butchersofinstagram pork lamb foodstagram,10.0,[],meat
تازہصافستھرا گوشت روزانہ صحت مند جانور broiler boneless mince mutton mix mutton raan mutton mince beef boneless beef paya desi fish chachaaborntoserve chachaameatshop freshnhealthy hygenic mutton beef desichicken fish lahore kalarahu lahore lahorecantt lahorecity dhalahore dhalahorephase6 dhalahorephase5 askari10 askari11 divinegarden gulberglahore modeltownlahore johartownlahore wapdatownlahore bahriatownlahore sukhchain canalgarden canalview,2.0,[],meat
picanha über holzkohle gegrillt picanha rodizio churrasco fazenda beef bbq steaklovers foodlovers steak tafelspitz foodblog bbqtilo,61.0,[],meat
jugoso delicioso el ribeye juicy ribeye steak snack gourmet guadalajara jalisco mexico comida cena munchies antojitos dinner meal drink bebidas likeforlike beef rib burger hotdog taco beer cerveza sushi shrimp wing ribeyesteak tomahawk,5.0,[],meat
product real object brand shoe,0.0,"[""'#mensfashion #photography #happy #meat #nature #style #dankmemes #meer #mer #cat #fashion @baraodashashtags #meta #mediterranean #memories #cute #picoftheday #mess #photo #menu #funny #love #travel #memes'""]",meat
coming soon biltong craft soon open popup root44familymarket construction still underway see progress pic root44 highlight well biltongcraftsa biltong droëwors snack foodstagram foodlover eat capetown capetowntourism biltongkings thefutureoftradition market stellenbosch,3.0,[],meat
el lugar de los mejores cortes en chapalaajijic best steakhouse chapalaajijic snack gourmet guadalajara jalisco mexico comida cena munchies antojitos dinner meal drink bebidas likeforlike beef rib burger hotdog taco beer cerveza sushi shrimp wing ribeyesteak tomahawk,5.0,[],meat
coming soon biltong craft soon open popup root44familymarket construction still underway see progress pic root44 highlight well biltongcraftsa biltong droëwors snack foodstagram foodlover eat capetown capetowntourism biltongkings thefutureoftradition market stellenbosch,3.0,[],meat
join u beer bbq bonanza 630pm thursday march 11 social enjoy 3 course banquet delightfully paired local craft beer willietheboatman wonderful head chef anthony prepared menu delight sens course paired matching craft beer lovingly prepared house smoker menu night sure impress even seasoned smoked chef craft beer nerd alike plus enjoy honkytonk western swing rockabilly sound cruisindeuces playing live 630pm night also include giveaway laugh banter opportunity meet brewer chef dont miss view full menu book via link bio win go draw win table 3 guest entering competition link bio,7.0,"[""'#bbq #beer #beers #beerstagram #beerlover #beerlovers #craftbeer #craftbeers #drink #drinks #drinkstagram #drinkup #cheers #beerandbbq #food #foodie #foodstagram #foodanddrink #win #competition #winner #free #freebie #promotion #giveaway #competition #willietheboatman #meat #meatlover #whatsonsydney'""]",meat
coming soon biltong craft soon open popup root44familymarket construction still underway see progress pic root44 highlight well biltongcraftsa biltong droëwors snack foodstagram foodlover eat capetown capetowntourism biltongkings thefutureoftradition market stellenbosch,1.0,[],meat
prime tritip name mhcbbq barbecue bbq grill grilling bbqlife beef steak barbeque bbqlife bbqporn bbqlovers foodstagram meatlover bbqnation foodlover foodblogger meatlovers instagood smoker instabbq meatporn grillgrates reversesear,16.0,[],meat
burger x 100 match chesse bacon photo slowmotionstudio job require inbox slowmotionstudio canonfullframer canon hongkongphotographer foodstylist foodphotographer hkfoodbloger fastfood hk foodphotographyhk,13.0,[],meat
variety take away surrey garcha bros healthy fresh shop surrey supreme quality store 96 ave surrey hygienic shop 96 ave surrey 12825 96 ave surrey bc v3v 6v9 canada sun mon 1000 830 pm tue 1000 800 pm wed thu 1000 830 pm fri sat 1000 900 pm best take away shop surrey wwwgarchameatshopcomstores96ave call 6044982221 garchabros garchabrosmeatshops garchabrosmeatstores surrey canada takeaway meatshops meatsurrey surreymeatshop surreytakeawaymeat newton abbotsford langley kelowna calgary vancouver fleetwood evanston tamarack edmonton brampton jacksonport winnipeg safefood healthyfood hygienicfood supportcommunity keepsocialdistancing,3.0,[],meat
super sunday nice delivery treat 2 amazing friendsclients thank much deer absolutely love venison steak jerky deer venison deerjerky deersteak myfavorite game treat client eattogrow gift evancrosson karrie1979,10.0,[],meat
holstein holsteinbeef artisan meatlover junior juniorcook funcooking cooking pure love,4.0,[],meat
happy new month new month new healthy habit better selfcare routine greenbowl green salad wrap smoothy juice fruit leaf yummy sweet healthy nutrition diet spintex accra ghana community18 tuna delivery event vitamin pie watermelon apple pineapple,31.0,[],meat
fresh cut provides fresh hygienic get online buy fresh click away download ofc app shorturlatepi27 freshcutmeat freshmeat fresh healthy mutton nonvegdishes nonveg nonvegetarian nonvegfood onlinefreshcut ceremony ofc,3.0,[],meat
