captions,likes,comments,hashtag
herb organic nature natural health herbalmedicine healthylifestyle herbal plantbased plant healing healthy love herbalist detox healthyfood flower garden wellness gardening herbalism spice tea holistichealth witch selfcare medicinalherbs bhfyp,6.0,[],vegan
thaimix glass noodle tofu veggie red curry paste topped sweet chili sauce sriracha mayo srirachamayo vegansrirachamayo veganfood veganrecipes veganlife veganskmat tofu veganthai,7.0,[],vegan
beginning today beginning new month beginning new week beginning new life enjoy new beginning refreshed refreshing spread love hope smile best love enough delight beauty butterfly rarely admit change gone achieve beauty maya angelou enough londrelle happymonarching butterfly monarchbutterfly mariposasdeinstagram butterfliesofinstagram gratefulheart isthelittlethingsinlife butterflygarden ahimsa veganlife anotherdayinparadise santosha stopandsmelltheflowers yogaeveryblessedday flowersformymother,3.0,[],vegan
herb organic nature natural health herbalmedicine healthylifestyle herbal plantbased plant healing healthy love herbalist detox healthyfood flower garden wellness gardening herbalism spice tea holistichealth witch selfcare medicinalherbs bhfyp,8.0,[],vegan
pa wootahwootah pa kayo toobeg kasi tubig mga mema jk bye summer like tide got something new crashing autumn szn ask sunday lupaboodlefeast privatedining privatechef lupaprivatedining plantbasedfilipino fermentation veganfilipinofood filipinofood filipinofoodmovementau melbournefood melbournechef melbveganguide sustainability sustainablediets boodlefight,4.0,[],vegan
another happy client goddess gaia sun showcasing stunning eye shape thanks genryan30 love happy client photo brisbanelashtemple eyelashextensionsbrisbane brisbane brisbaneeyelashes lash veganlashes veganlashesbrisbane pride instagay malelashes genderlessbeauty lashextensionshamilton lashextensionsnudgee volumelashes lashextensionsclayfield ascotbrisbane eyelashextensions eyelashextensionsbrisbane crueltyfree lash brisbanecity goddess beauty lashartist lashesonpoint fakelashes banyo nudgee clayfield nundah megavolumelashes,9.0,[],vegan
luke_hauntedbywolves going live stereo 830pm gmt tonight come hang u ask question let get chill vibe big conversation going mentalhealth mindfulness positivity gym personalgrowth motivation gain hauntedbywolves hbw metal metalcore rock bristol bristolmusic nucore,6.0,"[""'we’re coming from the rescue animal clothes firm"", ""we think you’d be the exact person a our brand agent. please message my shift supervisor if you’re interested. come look at my gram.'""]",vegan
moringa powerhouse nutrient fact moringa said provide 7 time vitamin c orange 10 time vitamin carrot 17 time calcium milk 9 time protein yogurt 15 time potassium banana 25 time iron spinach referred numerous time ayurveda benefit moringa spinach green protein dailygreen ayurvedicherbs ayurvedaeveryday brahmi vitaminc healthyfood cleanfood healthyfood organic vegetarian goodeats healthylifestyle healthyliving healthyeating healthybeauty thekiwla thekiwla,2.0,[],vegan
peanut tempeh salad tempeh avocado wild rocket red bell pepper blueberry carrot sesame seed pistachio dressing 1 tbsp peanut butter 1 tbsp chilli sauce 2 tbsp water half tbsp soy sauce 1 tsp whole grain mustard dash lemon juice fry tempeh add little dressing last minute add salad rest dressing peanut tempeh salad nutrition protein plantbased saladbowl avocadorose veganuk veganmeal lunch vegetarian simplerecipes savoury fruit sweet healthbowl rawfood vegansnack nutrition spice veganrecipes veganlife meatfree peanutdressing saladdressing avocado,24.0,"[""'we come from animal right apparel organization"", ""i see ur a great fit to become the brand agent. message to the brand supervisor if you would like. have a peek on our page.'"", ""'love this salad"", ""look so good '""]",vegan
going keto doesnt need hard hard part picking one flavour choose dark white milk vanilla coffee mango matcha acai even better get sample box try lowcarb keto ketodiet ketochocolate sugarfree chocolate glutenfree homemade ketodiet ketolife highfat fitfood weightloss guiltfree sweetless sinfree nosugar sample,4.0,"[""'we are an animal right company"", ""we’re seeing you’d be a perfect candidate to become the company representative. inbox my supervisor to get more information. have a peek on our description on my page.'""]",vegan
potential benefit cbd help reduce acne cbd found help reduce acne complementary benefit antiinflammatory property cannabinoids act directly cell make sebum help balancing oil production reduce inflammation healthy outside start within open wwwthehempsdelightcom link bio cbduk cbd cbdhealth cbdvape cbdcapsules cbdoil cbdedibles cbdeducation thehempsdelight cbdshop cbdskincare cbdvapeoil cbdonlineshop cbdbenefits cbdvalue cbdheals lookgoodfeelgood healthandwellness anxiety workingonabetterme love nature acnetreatment acnecommunity acne acneskincare acneremoval acneremedy acnerelief,6.0,"[""'we’re working with vegan clothing company"", ""i know you would be perfect a our business ambassador. message my brand supervisor to get more information. come look at my account.'""]",vegan
peanut butter paradies smoothie recipe earthyandy rawfood veganfood saladlover fruit rawvegan salat salatlieb veganlife veganfoodie nicecream veganraw obst obstsalat smoothie plant plantbased weightlost rohkost veganfoodshare meatfree govegan healthy eatclean rohvegan recipe rezeptideen fullyraw,4.0,[],vegan
herb organic nature natural health herbalmedicine healthylifestyle herbal plantbased plant healing healthy love herbalist detox healthyfood flower garden wellness gardening herbalism spice tea holistichealth witch selfcare medicinalherbs bhfyp,6.0,"[""'good shot '""]",vegan
pawfect oxo look varsity,10.0,"[""'#knitsbytee #knit #knitstagram #knittersofinstagram #dogjumper #dogboutique #dogaccessories #vegan #crueltyfree #handmade'""]",vegan
finally starting feel little warmer isnt guess safe say spring way tomorrow mark first day national spring cleaning week beagle got covered youve run cleaning item check delphiseco everything b corp certified come 100 recycled plastic bottle made uk check home cleaning bundle link bio dont sell cleaning product sell opportunity sustainable,2.0,"[""'#thebeaglebutton #sniffoutbetter #beagle #zerowaste #everydayactivism #sustainability #sustainableshopping #ecofriendly #greenliving #sustainableliving #vegan #spring #monday'""]",vegan
gorgeous goodforyou homemade sauerkraut available new deli ranelagh opening month,6.0,[],vegan
apple cider vinegar core ingredient within one product coming soon many benefit taking apple cider vinegar apple cider vinegar encourages healthy gut bacteria growth gut microbe help support healthy immune system study shown apple cider vinegar conjunction wellbalanced diet support healthy weight management amino acid apple cider vinegar well potassium enzyme may help relieve postexercise fatigue addition apple cider vinegar support healthy gut turn contributes regulation body energy finally added vitamin b12 help improve energy lacking b12,12.0,"[""'\\u2063\\n.\\u2063\\n.\\u2063\\n.\\u2063\\n.\\u2063\\n.\\u2063\\n#healthylifestyle #ashasupplements #applecidervinegarwithhoney #applecidervinegarpanahi #applecidervinegarhairrinse #applecidervinegarpowder #applecidervinegarrinse #applecidervinegarbath #applecidervinegardiet #applecidervinegarbragg #healthy #applecidervinegarwiththemother #applecidervinegardrink #applecidervinegargummy #weightloss #applecidervinegarbenefits #applecidervinegariscool #applecidervinegarcapsules #vegan #applecidervinegarrecipe #acv #applecidervinegartoner #applecidervinegaruses #applecidervinegarshot #applecidervinegartea #health #applecidervinegarph #applecidervinegarmalang'""]",vegan
beauty plant lunch lunsj poweredbyplants plantebasert friendsnotfood veggie crueltyfree onthego whatveganseat vegannorway veganoslo vegansk veganskoslo vegansknorge takeaway,6.0,[],vegan
march couple novelty menu cannot wait try stop great coffee super healthy meal pastry made finest ingredient 100 plantbased look forward see,8.0,"[""'#mana #managlowfood #berlin #vegan #passionpassport #exclusive_shot #foodphotography #exploretocreate #rundownmagazine #foodies #sourdough #schöneberg #restaurant #togofood'""]",vegan
drsagarchaudhary sarcasticshuggi life relationship love spirtuality dentistry dentalmotivationaltalks gurumantra dentalgreens talklife comedian meme drsirigouri implantologist thatssosiri relationshiptalks minimalist fb youtube instagram twitter anchor wordpressblogger,1.0,[],vegan
drsagarchaudhary sarcasticshuggi life relationship love spirtuality dentistry dentalmotivationaltalks gurumantra dentalgreens talklife comedian meme drsirigouri implantologist thatssosiri relationshiptalks minimalist fb youtube instagram twitter anchor wordpressblogger,4.0,[],vegan
love new candle insightcandlestore thank much perfectly made candle soy soycandles soywaxcandles candlesofinstagram candlelover candlemaking candlesuk candlelight candleaddict candlebusiness candlemagic beutiful handmade handmadewithlove handmadewithcare home homedecor homedecoration homeinspo mirror style styleinspo styleinspiration localbusiness local supportlocal supportlocalbusiness newcastle,18.0,"[""'aww very creative'"", ""'they look beautiful! thank you so much '"", ""'@thebeyholder you are very saucy'""]",vegan
monty puppy dog dog vegancz pejskove tattoo doginstagram doginstagrams doglovers doglovers veganlifestyle happyanimals cutedog cutedogs cute tattoogirl loveanimals animalsofinstagram animal animalslover doggie spaltbiewer terier cuteanimals dogofinstagram lovedogs tattoo loveanimals tattoogirl pet,55.0,[],vegan
fact dietplan keto glutenfree healthyfood fitnessinfluencer obesetobeast coachgregdoucette athleanx,1.0,[],vegan
morning today want share one favourite fruit peel restorative serum amazing resurfaces top layer skin reveal fresh youthfullooking complexion overnight help refine pore promote healthy radiant complexion coconut water hyaluronic acid give boost hydration exfoliates softer smoother skin surface love using serum week leaf face feeling brighter softer found web shop link httpstropicskincarecompagesleannecork skincare fruitpeel resurfacing naturalskincare brightening,0.0,[],vegan
herb organic nature natural health herbalmedicine healthylifestyle herbal plantbased plant healing healthy love herbalist detox healthyfood flower garden wellness gardening herbalism spice tea holistichealth witch selfcare medicinalherbs bhfyp,7.0,[],vegan
come home remedy show simple best way protect illness infection 100 cure manner disease take view page also study home medicine make health wealth offer good health good result example diseasevirus cure herpes simplex virus 12 human papilloma virus hpv gut medicine cancer disease diabetes disease lupus genital herpesvirus infertility fibroid high blood pressure etc message information always active response thank plantmedicine herbalmedicine herbalism herbalist cannabiscommunity healing plantbased cbd cannabis wellness herb holistichealth naturalmedicine nature organic health cannabisculture selfcare ayahuasca plant naturalhealing hemp thc plantmagic herbalremedies medicinalherbs cannabiseducation essentialoils,3.0,[],vegan
yummy sweet breakfast cake chocolate lunch healthyfood yum foodstagram dinner coffee sexy love beautiful photooftheday photography photo meme lol meme instagood picoftheday follow instagram,0.0,[],vegan
saucy rainy monday go get whats favorite new store keep eye youll see white sauce local hannafords dont forget sauce dressing let u help make dinner easy family bringing healthy choice celebrateitalianeveryday hannafordfresh start simmeringsauces grab make dinner easy amazing family make luigi del conte dressing sauce havent tried simmering sauce mouth missing wildblueberrymaplebalsamicvinaigrette pecorinoromanooreganovinaigrette looking next meal luigidelcontesaucescom awesome recipe restaurant quality sauce right home shipping delivering deliciousness getsaucedwithluigi glutenfree kosher vegetarian keto allnatural luigidelcontesauces hannaford wholefoods umainedining specialtyfoods mainefood mainefoodie madeinmaine getrealmaine megrocersfood publix wegmans shoprite acadiaseafood readylobster pricechopper chefsofmaine centralmarket,5.0,[],vegan
fresh custom herb customized unique body custommade fresh herb healthylifestyle healthyliving herbalifenutrition balance mindbodysoul detox weightloss herbalife healthiswealth fitness body natural love herbalmedicine,5.0,[],vegan
herb organic nature natural health herbalmedicine healthylifestyle herbal plantbased plant healing healthy love herbalist detox healthyfood flower garden wellness gardening herbalism spice tea holistichealth witch selfcare medicinalherbs bhfyp,4.0,[],vegan
fresh fruit company aim guarantee client customer product best quality packaging range fruit herb leaf organic fresh cut ffc continuous aim source new product develop range fresh produce every customer first choice come fresh produce ffc_kwt product include limited culinary herb exotic fruit salad mix green conventional organic produce stone fruit citrus berry well tropical fruit freshfruit fruit healthyfood fruit fresh ahaarah_by_daphanie healthy healthylifestyle fruitsalad strawberry yummy freshfood kuwait company followforfollowback organic summer srilankanblogger freshproduce strawberry sofresh foodblogger bhfyp swipe see,7.0,[],vegan
new month new goal smashed 200k february let smash another month march positivity mom mommy twinmom love boy business crueltyfree followme beauty,1.0,[],vegan
thought would try tiktok gosh im obsessed inspired christisteyn took way long figure though hope enjoy tiktok cow yogawithfriends yoga yogapractice yogainspiration yogalife yogaeverywhere yogaprogression yogini yogi yogispiritanimals yogilife yogisofinstagram animallovers animalsofinstagram animal_captures poetry poetsofinstagram poetrylovers,12.0,[],vegan
happy monday everyone starting new week month healthy creamy raspberrydragon fruit smoothie bowl always good idea ingredient 150g raspberry 1 banana 2 tsp dragon fruit powder 1 tsp agave syrup water mix ingredient blender add favorite topping smoothiebowl dragonfruit pataya healthy breakfastideas breakfast brunch fruit viennafoodstories vienna foodblog foodblog_at foodblogger_at recipe monday coconut granola,8.0,"[""'wish i had this right now '""]",vegan
know life duplicate take good care body get late contact get cured completely disease holistichealing holistichealth healthytips healthtips remedy plantbased plantbaseddiet plantbasedfood veganrecipes veganfood medicine herb nipseyhussle plantbased lupuswarrior usa usa drsebi alkaline alkalinediet seamoss arthritis diyremedies detox plant healingfoods herbalremedy chronicillness lupus,4.0,[],vegan
know life duplicate take good care body get late contact get cured completely disease holistichealing holistichealth healthytips healthtips remedy plantbased plantbaseddiet plantbasedfood veganrecipes veganfood medicine herb nipseyhussle plantbased lupuswarrior usa usa drsebi alkaline alkalinediet seamoss arthritis diyremedies detox plant healingfoods herbalremedy chronicillness lupus,2.0,[],vegan
tropicskincare greenbeautyrevolution healthyskin clearskintropicproductaddict tropicskincare tropic tropicambassador conditioning veganskincare vegancertified crueltyfreebeauty crueltyfreemakeup crueltyfreeskincare crueltyfreecosmetics skinconfident glowingskin consistency antiaging eyecream dontforget faceoil naturalskincare beautycare skincaretips facial beautifulskin,2.0,[],vegan
please also visit estheprolabo_official wwwestheprolabolabocom estheprolabo prolaboglobal fastinglife fasting veganlife guthealth gut healthyfood healthylifestyle wellnesslifestyle wellness enzyme fastingforhealth diet,0.0,[],vegan
know life duplicate take good care body get late contact get cured completely disease holistichealing holistichealth healthytips healthtips remedy plantbased plantbaseddiet plantbasedfood veganrecipes veganfood medicine herb nipseyhussle plantbased lupuswarrior usa usa drsebi alkaline alkalinediet seamoss arthritis diyremedies detox plant healingfoods herbalremedy chronicillness lupus,0.0,[],vegan
mothersday beauty giftideas eclipsemagazinehorseracing magazine mother nailit leminimacaron limitededition deluxe gel manicure kit gelpolish naillamp nailfile cuticlestick nailedit funloving earthmother misspatisserieuk taster box rainbow fizzybathdust turkishdelight bathslab peonyandpear sugarscrub showerstreamers available via asos asos_faceandbody mothersday2021 uk 14 march,5.0,[],vegan
first outdoor run lunch today strength yoga exercise colourful lunch possibly go wrong feelgoodwithmrsk eatclean cleanfood eatyourcolors plantbased växtbaserat feelgoodfood måbramat happyfood postworkout klimatsmartmat lunchbox leftoversforlunch dontwastefood restfest,1.0,[],vegan
get new 100 recipe weight loss clearersmoother skin healthier lifestyle link bio veganreprice love stuffed baked potato mushroom spinach share thought comment twospoonsca easy full flavor get recipe recipe 4 russet potato 1 tbsp coconut oil 2 clove garlic finely chopped 4 cup 250g cremini mushroom pinch salt 1 tbsp almond butter 1 tbsp balsamic vinaigrette 1 tbsp lemon juice 4 cup baby spinach approx 2 handful 1 preheat oven 425f215c poke hole around potato using fork help heat escape baking wrap tin foil bake oven 4050 easily poke cooked potato toothpick 2 skillet add coconut oil garlic sliced mushroom pinch salt cook medium heat 510 minute 3 whisk together almond butter balsamic lemon juice pour mushroom continue cooking mushroom browned ready eat toss baby spinach cook wilted 23 minute slice open baked potato fill mushroom spinach medley optional drizzle gravy plantbased veganfood vegetarian healthyfood crueltyfree organic glutenfree healthy veganlife vegan_veganfood veganism vegansofig veganfoodshare veganrecipes veganbreakfast veganlunch veganfoodie veganeats veganvitamin healthylifestyle govegan vegansofig veganrecipes love veganism vegano,7.0,"[""'it look so yummy!! '""]",vegan
decision decision,10.0,"[""'#poké #birmingham #fresh #food #hawaii #deliveroo #ubereats #justeat #açai #smoothiebowl #isupportbirmingham #independentbirmingham #brumindies #takeaway #supportyourlocal #birminghamupdates #vegan #veganeats #vegansofinstagram'""]",vegan
maketheconnection,7.0,"[""'#expressyourvegan #govegan #vegan #veganquotes #animalactivism #animalliberation #veganfortheanimals #veganlifestyle #crueltyfree #loveallanimals #veganism #veganforthem #someonenotsomething'""]",vegan
great way start day week mealwith delish smoothie bowl available delivery takeaway pictured peanut full yummy plantbased protein avobar beautifulsuperfood smoothiebowl mondaymotivation,22.0,"[""'#avobarlondon #plantbased #plantbasedfoodie #peanut #peanutsmoithiebowl #londondelivery #delivery #takeaway #healthyfood #healthyeating #bowlsofgoodness #coconutbowls #sustainable #foodie #londoneats #londonfoodie #vegan #veganeats #whatveganseat'""]",vegan
eat right feel amazing already tried novelty proteinisi_slovenija chocolate wishing nice week ahead,223.0,"[""'#healthyfood #healthylifestyle #food #donut #proteinisi #healthy #foodporn #foodie #instafood #fitness #foodphotography #vegan #healthyeating #yummy #foodblogger #foodstagram #health #healthyliving #foodlover #homemade #delicious #nutrition #weightloss #breakfast #diet #instagood #fit'""]",vegan
journaling therapeutic especially uncertain time outlet mean express efficient way need brainstorm think important give loved one space write thought idea think matter take example fiesta planner perfect people go due compact functional design doesnt sacrifice style store journal also card slot also ideal people like write draw lot youve filled page refill readily available tray similar design well easy store multifunctional hold card pen slot use hold essential key gift box set contains fiesta zippered refillable leather traveler notebook along 3 fiesta refill guhit valet tray send u message youd like customize gift box,3.0,[],vegan
twothirdshoney,37.0,"[""'#fashion #lifestyleblogger #bloggerstyle #vegan #sustainablefashion #art #sunrise #londonfashion #style #wellness #sun #beautyblogger #fashionista #london #sunset #beauty #ootd #fashionblog #adventure #holiday #travel #travelblog #travelphotography #travel #bloggersunder5k #fashioninspo #holidayfashion #spiritualawakening #spiritualjourney'""]",vegan
doesnt want gluten free n plant based crepe morning neerdosa coconut crepe ricecrepes watermelon limejuice mangaloreanfood mangalore selflove selfcare mindfulness wellness eatlocal healthyfood healthylifestyle mumbai healthyeating holisticnutrition youarewhatyoueat goodmorningpost instagood indianfood southindianfood momsrecipe healthy glutenfree steamed plantbased,6.0,[],vegan
everything understood art,64.0,"[""'love your style! dm u '"", ""'great pic '"", ""'#fashion #lifestyleblogger #bloggerstyle #vegan #sustainablefashion #art #sunrise #londonfashion #style #wellness #sun #beautyblogger #fashionista #london #sunset #beauty #ootd #fashionblog #adventure #holiday #travel #travelblog #travelphotography #travel #bloggersunder5k #fashioninspo #holidayfashion #spiritualawakening #spiritualjourney'""]",vegan
worn dress,74.0,"[""'send pic on @empirepromo_'"", ""'#fashion #lifestyleblogger #bloggerstyle #vegan #sustainablefashion #art #sunrise #londonfashion #style #wellness #sun #beautyblogger #fashionista #london #sunset #beauty #ootd #fashionblog #adventure #holiday #travel #travelblog #travelphotography #travel #bloggersunder5k #fashioninspo #holidayfashion #spiritualawakening #spiritualjourney'""]",vegan
distance,63.0,"[""'what a beautiful girl'"", ""'so gorgeous"", ""dm u please '"", ""'such a stunning look so beautiful'"", ""'collab? dm u @brousedfitness'"", ""'send pic on @empirepromo_'"", ""'#fashion #lifestyleblogger #bloggerstyle #vegan #sustainablefashion #art #sunrise #londonfashion #style #wellness #sun #beautyblogger #fashionista #london #sunset #beauty #ootd #fashionblog #adventure #holiday #travel #travelblog #travelphotography #travel #bloggersunder5k #fashioninspo #holidayfashion #spiritualawakening #spiritualjourney'""]",vegan
mirror reflection,52.0,"[""'#fashion #lifestyleblogger #bloggerstyle #vegan #sustainablefashion #art #sunrise #londonfashion #style #wellness #sun #beautyblogger #fashionista #london #sunset #beauty #ootd #fashionblog #adventure #holiday #travel #travelblog #travelphotography #travel #bloggersunder5k #fashioninspo #holidayfashion #spiritualawakening #spiritualjourney'""]",vegan
scrunch swimwear,55.0,"[""'#fashion #lifestyleblogger #bloggerstyle #vegan #sustainablefashion #art #sunrise #londonfashion #style #wellness #sun #beautyblogger #fashionista #london #sunset #beauty #ootd #fashionblog #adventure #holiday #travel #travelblog #travelphotography #travel #bloggersunder5k #fashioninspo #holidayfashion #spiritualawakening #spiritualjourney'""]",vegan
stone everything,36.0,"[""'#fashion #lifestyleblogger #bloggerstyle #vegan #sustainablefashion #art #sunrise #londonfashion #style #wellness #sun #beautyblogger #fashionista #london #sunset #beauty #ootd #fashionblog #adventure #holiday #travel #travelblog #travelphotography #travel #bloggersunder5k #fashioninspo #holidayfashion #spiritualawakening #spiritualjourney'""]",vegan
holidaying thing,43.0,"[""'so pretty and feminine '"", ""'oh wow... this is a nice shot! i like your style! maybe you´r interessted in an professional photoshooting.'"", ""'#fashion #lifestyleblogger #bloggerstyle #vegan #sustainablefashion #art #sunrise #londonfashion #style #wellness #sun #beautyblogger #fashionista #london #sunset #beauty #ootd #fashionblog #adventure #holiday #travel #travelblog #travelphotography #travel #bloggersunder5k #fashioninspo #holidayfashion #spiritualawakening #spiritualjourney'""]",vegan
low calorie eat much want time day give energy rich vitamin fiber low fat sugar salt help increase resistance growersunited goodfoodingoodhands healthy healthyfood tomato cucumber aubergine pepper,15.0,[],vegetables
boiled sautéed miso soup bean curry foodpics vegetalian healthyfood healthyeating wholefood plantbased veganfood vegetalianfood plantbasednutrition plantbasedprotein athlete athletefood foodpix youarewhatyoueat healthyliving healthylife wellness stayhealthy,9.0,[],vegetables
tongue look 01032020 feeling white film clear mucusparasitestoxins start clear allow body focus healing juicingrecipes juicingforhealth juicingpath awakening parasitecleanse juicedetox fruit release natural intermittentfasting healthnotwealth joinme manifestation dowhatyoulove 5starjuicingjourney orange lemon cucumber celery beetroot ginger mctoil livingfoods enzyme tongue toxin meditation,1.0,"[""'@fivestarjuicejourney nice! :) hey i sent u a genuine dm plz check it out? i introduced myself there. truly am real here honestly.'""]",vegetables
guacamole goodmorning monday breakfast vege vegetarian nature photooftheday photography enjoyyourmeal bonappetit tasty haveaniceday smile healthyfood healthylifestyle home,30.0,"[""'that look very nice '"", ""'wow! so healthy '""]",vegetables
tik tok pasta trend finally gave go spin started mylifebio feta cheesetomatoesmushroomsred onionsgarlicmixed herbsdillsaltpepper oil baked felt done gave stir added spinach mylifebio parmesan _simplywize pumpkin gnocchi done taste absolutely amazing even hubby liked he either gluten free plant based tiktokpastagnocchivegetablesvegancheeseplantbasedveganglutenfreegfdairyfreeeggfreehealthyhealthylifestylehealthyfoodhealthylifeglutenfreeperthperthglutenfreeperthglutenfreeeatsperthveganveganperthperthveganeatschefcertifiedchefrawdessertchefperthchefperthwaaustralia,5.0,[],vegetables
