captions,likes,comments,hashtag
mine quarantine like letseatwithiqra,103.0,[],chicken
endfactoryfarming chickensandwich chickenburger nugget meatfree endanimalabuse endanimalcruelty govegan gogreen tryplantbased vegansofig endspeciesism saveallanimals animalprotection animalsarewithusnotforus begood delhi mumbai hyderabad kolkata rajkot ahmedabad jaipur india instadaily instagood pune nagpur jabalpur,5.0,[],chicken
burger chickenburger salad friedchicken coleslaw greensalad dinner sandwich nice bbq sauce tasty iloveit crispy jucy,2.0,[],chicken
cr vid sasittube asmr asmreating asmrfood asmrchicken asmrmukbang asmrnotalking mukbang mukbangasmr re_mukbangasmrfood asmreat mukbangeating mukbangchicken cheesechicken,0.0,[],chicken
lollypop who favourite mei always ready place empress mall court court almost closeddont know hope come something amazing foodbloggers foodblogger foodforlife chickenlovers chickenlover chickenlollypop love loveforfood yummy yummyinmytummy followforfollowback followe follower following follow4followback likesforlikesback likesforlike,18.0,"[""'wow....looks delish'""]",chicken
ayampoultry chicken rooster beautifulbirds beautiful lovebird loveanimals lovechicken longtail photograph photo photography photo instagramjapan instagram japaneseculture japanese japan,2.0,[],chicken
crispy lemon wing served salad foodcomafoodpornindianfoodgourmetsaladsfreshfoodfoodhomefoodbloggerfreshfoodchefsvegetablescoconutfoodiesindiabloggersworldcusinesfreshcurrieschickenfoodsquadindianfoodworldcusineschickenfoodpicturesfoodhubfoodcomafoodpornindianfoodgourmetsaladsfreshfoodfoodhomefoodbloggerfreshfoodchefsvegetablescoconutfoodiesindiabloggersworldcusinesfreshcurrieschickenfoodsquadindianfoodworldcusineschickenfoodpictureswings grilling gurgaon healthyfoodlunchdinnertastyfoodyumhomecooking,8.0,[],chicken
eat satisfy hunger taste explore_with_epicure16 eat_with_epicure16 cook_with_epicure16 style_with_epicure16 _______________________________________ use epicure16 get featured epicure16 epicure16 frame fish amritsari wing fish finger chip location plough sipson _______________________________________ update various restaurant follow zomato zomato epicure16 trell epicure16 snapchat aashisahu follow epicure16 epicure16 epicure16 epicure16 _______________________________________ europe unitedkingdom europefood boxparkwembley wembleystadium lockdownscenes fstmondaymarch gudwillup staysafe eatwithepicure16 epicure16,28.0,"[""'both - 50:50'"", ""'i think both hun'"", ""'both"", ""this look delish '""]",chicken
super tender strip cant go wrong homemade signature dip dm order friedchicken americandining americanfood chickentenders foodstagram reading readingberkshire halalfoodie halalfood readingfood rdg reading_uk,23.0,[],chicken
rice important integral part fitness journey chickenrecipes chickenandrice fitness pump getfit nutrition diet fitnessjourney thejourney frommykitchen eathealthy livelonger,14.0,[],chicken
recipe alert bbq season nearly dont save post give go tavuk shish turkish kebab lavash bread salad grilled halloumi garlic sauce perfect combo bbq weekend ingredient 2 boneless skinless breast 4 5 boneless skinless thigh 1 medium onionfinely chopped grated 2 clove garlicminced 12 cup plain yogurt milk 3 tablespoon vegetable oil 2 tablespoon tomato paste 1 teaspoon ground black pepper 1 teaspoon paprika 1 teaspoon salt optional red colouring garnish oregano sumac paprika simply mix ingredient marinate diced couple hour skewer grill medium heat cooked serve rice salad flat bread grilled halloumi yogurt garlic sauce bbq chef shish kebab lavashbread halloumi pita summerfood bbqfood grill gateshead newcastle newcastlegateshead nefoodies newcastlefoodies tyneside quayside foodstyling foodphoto foodiesofnewcastle newcastlefoosies newcastleupontyne bbqchicken tavukşiş bbqseason thelockdownchef,42.0,"[""'whoop there it is'"", ""'i need this '""]",chicken
taste new month peri peri wrap fry ghc20 order via app dialadeliverygh b ussd 844104 c call line 0550003337339 send u dm flamegrilled galitos cambridge skip uber doordash african piripiri hot mild,2.0,[],chicken
kind mummy like eat hunger hacker hungerhackersgiridih hungerhackersjamnagar hungerhackerbarara hungerhackershisar hungerhackersshahbad fastfood mashhad fastfood yummy breakfast realfastfood foodlover beautiful prettyfood,1.0,[],chicken
frozen food shop grandpas_coldstore stock thigh turkey wing cassava fish sausage strawberry many frozen product dm away accra newtown ajarkoraba street opposite mafia parliament 0203900763 0557392257 delivery free within accra selected area term condition applied coldstore fresh frozen seafood shrimp gd coldchain waterheater uae frozenfood accra refrigeration healthyfood warehouse chickenwings hygiene freezer frozenfoods fish turkey springrolls squid redfish packing coldstorage salmon coldroom delivery grandpas_coldstore,15.0,[],chicken
enjoy complete range indian cuisine symposium order get 15 discount delivery take away booking order call 995336666162 01142184494 naan naanbread dal dalmakhni dwarka sodelhi lolypop chickenlollipops lollipop,2.0,[],chicken
loaded peri peri chip perinaise burger redditch,5.0,[],chicken
ขาวผดตมยำใสเหด ไขดาว เมนมงสวรต vegetarianfood อรอย padmeeangthong yummy yum delivery deliciousfood aroi foodstyling food foodstagram foodblogger thaifood wongnai foodlover foodaholic wongnai lineman grabfood yummyfood thaifoodporn foodgram veganfood,5.0,[],chicken
real need decoration throwing barbecue party let summer garden vibrant luscious splendor speak shubhz_saxena using art marination kbobsindia order premarinated ready tawa fry material kbobs drive road call u 07940081999 07940092320 kbobs kbobsindia timesfoodawardswinner barbeque briyani partyplace partyhard foodblogger tikka marinated dinner ahmedabad nonveg veg tasty tastyfood tasty tastyfood tastymonday indiafightscorona,5.0,[],chicken
bowl happy leftover satay wholesome fulfilling dish cookwithhappiness delightedchef goodfood goodvibes love leftoverchickenrecipe,9.0,[],chicken
fruity delight follow thegingerandgarlick streetfood foodblogger foodstagram foodlover indianfood yummy foodie foodgasm homemade foodtruck tasty foodiesofinstagram instagood streetfoodpakistan bhfyp indianstreetfood healthyfood desifood kuliner pakistanifood foodpics pakistan thegingerandgarlick,8.0,[],chicken
chick update today ventured safety big run first day freeranging big paddock mother hen never far away clap recall training also begun 1010 far bwark bwark chickensofinstagram chicken chick broody hatched freerange freerangechickens happyhens grubbfarmbellarine,4.0,[],chicken
hot cheetos poke burrito follow modernfood__ double tap love tag lover friend like foodagram foodvibes tastethisnext instafoodies delicious_food deliciousfood deliciousandhealthy easyrecipe deliciousdessert deliciousdesserts easyrecipes recipevideo diyfood cookingvideo cookingvideos cookinglight cgookinghealthy easycooking easyfood chocolate chocolatelab chocolatelabsofinstagram cakedecorating cannoli pistachio quesadilla cheesy,46.0,[],chicken
forget spice girlsthe silkie sister poultry chicken backyardchickens chickensofinstagram poultryofinstagram backyardpoultry hen egg farmlife farm crazychickenlady petchickens hensofinstagram spicegirls poultryfarm poultryfarming freerangechickens chickenlife homestead chickensofig chickenlove bird hen chick rooster chickencoop pet happyhens bhfyp,17.0,"[""'they’re adorable! '""]",chicken
welcome march thank everyone great past month couldnt make without recap last month favorite time favorite combo saikoro wagyu sambal matah original caramel custard pudding also enjoy great deal fav pairing reach via dm order directly thru grabfood everyone find u ig donbureeid wa 089531673101 grabfood donburee tokopedia shopee khusus untuk pudding donburee saikoro wagyu sambalmatah wagyubeef saikorosteak saikorosambalmatah donburi gyudon ricebowl japanese japanesefood pudding caramel gyukakupudding caramelcustard gyukaku beef puddinggyukaku caramelpudding truffle truffleoil ayam sambalmatah ayamsambalmatah marieregal biscoff puddingregal puddingbiscoff lotusbiscoff lotusbiscoffpudding,8.0,[],chicken
patty fastfood fastfood kfc mashhad fastfood chip yummy breakfast realfastfood foodlover beautiful prettyfood patty homemade burger yummy foodblogger foodstagram foodie,10.0,[],chicken
come fulfill appetite tastiest yummiest order agha sajji 03218378712 03052122508 menu wwwfbcomaghasajjicornermenu stayhome chickenkarahi staysafe aghasajji chickensajji burnsroad bbq karachi delivery barbecue foody dinner,0.0,[],chicken
changezi sector 78 chickenshawarma chickenlovers gravy roti tandoorichicken indianstreetfood indiancuisine indianblogger mughlaifood foodtalkindia delhifoodie delhiblogger foodblogger likeforlikes follow4followback noidafoodie noida noidadiaries noodle maggi golgappe desikhana desidakaar desi reelsinstagram chefsofinstagram chef love family,43.0,[],chicken
high protein diet morroco bulk time lunch time hummus turkishbread maurice pourtoi magreb,6.0,[],chicken
la livraison se fait avec ubereats chaque jour jusqua 00h00 centre commercial saint maximin halal et sans alcool brasserie grillade burger maison cocktail milkshake smoothie creil saintmaximin frenchcantine myfrenchcantine halal halalfood burger grill steak beef fastfood fastcasual foodstagram restaurant,2.0,[],chicken
curry roastandprep wing soulfood southeastlondon bbq comfortfood mealprep chiiliwings bbqwings homecooked tastyfood macandcheese hotfood sweet chilli lamb roastpotatoes minted mixedveg yorkshirepudding prep herb roast roastdinner coconut opening,5.0,[],chicken
yesterday diner cookecbyiks baklava noodle redpork diner suriname,8.0,[],chicken
combo wing foodislove,3.0,[],chicken
credit the_foodie_bae frame full flavor craving hard follow delhieszaika chickenwaffles chickenlovers foodlover 20likes delhi heydelhi foodtalkindia indianfoodie foodtraveller foodindia foodphoto chennaifoodblogger biryani streetfood buzzfeast foodblogger biryanilove foodblog spicyfood indianfood foodieofchennai delhifood kebab chickenlovers chickenlegs grilledchicken foodofdelhi,203.0,"[""'@modernmealzz follow'""]",chicken
southern fried bite skinnymixers healthy mix v made strip served veggie tasty thermomix skinnymixers dinner,3.0,"[""'you in love with everyone else or what'""]",chicken
chickenfry legfry ramasweethome chickenrecipes starter,0.0,[],chicken
le salade de chez french cantine sont le meilleures centre commercial saint maximin halal et sans alcool brasserie grillade burger maison cocktail milkshake smoothie creil saintmaximin frenchcantine myfrenchcantine halal halalfood burger grill steak beef fastfood fastcasual foodstagram restaurant,3.0,[],chicken
yummy asmreating asmrfood asmrfoodsounds asmrchicken asmrsounds eatingshow eatingsounds eatingwithhands eatingmukbang eatingshows eatingsound muttoncurry mutton chicken65 rice biryanilovers indianfood indianstreetfood pakistanibiryani pakistanifood pakistanistreetstyle pakistanicuisine crunchysounds softsounds,1.0,[],chicken
spoil today kfcphilippines fastfood delivery foodlover yummy spicy foodstagram comida restaurant kfc mushroomsoup foodblogger kentuckyfriedchicken foodie tasty instagood comidarapida lunch love foodgasm bhfyp,5.0,[],chicken
joan photo bombed lily photo shoot happy first month chickensofinstagram happyhens cockeral cockeralsofinstagram cockerals egg egg countrylife countrylifestyle countryliving countryside countryfile nature wildlife wildlifephotography happy animalsofinstagram animal animal animallovers animallover chickenlovers chickenlover,6.0,[],chicken
free range readymade logo logoground right reserved detail please visit logoground page link bio gyalogosdesign affinitydesigner madebyaffinity logoground logo logodesing logoinspiratons logomark logodesigner creativelogo logoexcellent logobrand branding freerange farm egg organic,3.0,"[""'amazing and creative combinations'""]",chicken
got stuck jennnn_aaayy recipe 4 ingredient cheese bacon roll mealprep honey mustard thanks beautiful lady awesome paprika pasta next list mealprep roll cheese bacon cheeseandbaconrolls cheeseandbacon honey mustard dough breaf breadroll,8.0,[],chicken
open taking order thursday 4th call u dm reserve collection slot collection pitlake cr0 3ry free mango lassi order 25 free mango lassi portion roll order 30 jaffnafoodiecurrymuttonchickenfishcutletfoodpornrollscroydontakeawayhomecookeddevilrestaurantmichelin5starmenuopenordercollectioncroydon,14.0,[],chicken
yogurt simple amazingly recipe need couple drumstick yogurt herb garlic salt n pepperand oven keep healthy course end happy customer foodblogger tasty tasteofindia indianfood indianfoodbloggers foodlover weekendchef cooking homecooking recipe yummy restaurant odisha odiafood odishafoodies spicy spicyfood masala curry foodiesofinstagram ilovecooking awesomefood foodgasm foodstagram,23.0,"[""'looks so yummy and delicious '""]",chicken
gourmet thai parcel back made thai lemongrass sweet chili sauce coconut milk lime juice available 700 nambour height butchery,2.0,"[""'#nambourheightsbutchery #thaichickenparcels #parcels #newproduct #butcherlife #homemade #chicken #fresh #food #foodie #foodphotography #localbusiness #knowhow #catering #homedelivery #supplier #nambour #buderim #maroochydoore #montville #sunshinecoast #queensland #australia #photography #nofilterneeded'""]",chicken
sembawang traditional claypot rice jurong point flavour 910 price 810 overall 8510 signature claypot rice dish m1380 fricking amazing make sure u mix well evenly though really good top w soya sauce ordered minced omelette 880 claypot sesame oil 1280 da lu mian l980 really enjoyed da lu mian though noodle tangy springy sauce excellent well overall everything delish place really life hype,8.0,"[""'#food #review #foodreview #cravings #foodie #yummy #tasty #delicious #nom #singapore #singapurafoodie #sgfood #sgfoodies #singaporefood #foodporn #foodblogger #foodlover #foodpics #foodiesofinstagram #foodpic #foodblog #claypotrice #zichar #omelette #claypot #chicken'""]",chicken
chicken corn,24.0,"[""'#childrenofthecorn #childrenofthecorn2020 #cornchildren #horrorfan #childactor #horrormovies #actress #actresslife #australiansinfilm #chicken #moderngamebantam #actor'"", ""'such a kind and beautiful soul miss you already '"", '""chickens of the corn i love it haha and awesome shirt! i\'ll be sure to get my own when available! woot woot ""']",chicken
peepeepoopoo cod codclips codcoldwar callofduty sniper satellite colombia bestplayer triple triplekill oneshot art beautiful catsofinstagram fashion igers nickiminaj nike girl gamergirl gorilla obama explore iloveyou sniperclips cheese fortnite fortniteclips gameplay,7.0,"[""'return the like maybe follow '""]",chicken
2019 acrylic painting art drawing instaillustration artwork illustration comic lowbrowart contemporaryart animal design fantasyart animalart characterarttraditionalart acrylic comic cute artist creature tattoo lowbrow character art color modernart sketch,124.0,"[""'wow"", ""that look cool'"", ""'one of the good profile i’ve seen today. keep it coming!'""]",chicken
foodlover foodstagram love dish dishoftheday passion photography photooftheday cooking cookingathome cook chef cheflife love viral style foodblogger blogger blog chickendinner cucinaitaliana cucina cucinarechepassione milano milan,388.0,"[""'amazingly presented!'"", ""'this look absolutely delicious! bravo chef!'"", ""'you have one of the good profile i’ve seen today '""]",chicken
happy bday ryokun feb 8 2021 toy ww birthdaygift happybiryhday february funnytoys toy cat paratrooper friend february2021,3.0,[],chicken
happy monday chick last one homeschooling foodforkids kidsfoodart kidsfood foodart chick cute love pancake breakfastforkids monday happy mommade mummy happykids funfood foodlovers foodstagram comida comidaparaniños bonito cool mamamexicana england mexico lovely pollitos lunchideas lunchideasforkids,10.0,"[""'oh my gosh this is so cute. it’s the little face!!'"", ""'such a cute breakfast '""]",chicken
batching cody wife away stuffed breast salami baby spinach colby cheese wrapped bacon using grill pinz mvp mine original sweet rub snow corn charred 850navigator mash spud brocolini moist camsq_culinary_bbq_bits meatgraffitibbq grillpinz pitbossgrills camhousie_camsq themvp grillpinz nomoretoothpicks yum tastyasf moist bbqfamily lowandslowbbq stuffedchicken bacon baconlovers smoked bbqlife bbqlovers bbqaustralia chubbygangeats foodlovers instaeats,12.0,"[""'wow that is bangin! '""]",chicken
lamb shawarma biryani shakshuka without egg shawarma lamb biryani basmatirice shakshuka eggplant zucchini toum yogurt family familymeals sundayroast middleeasternfood inspiration,7.0,[],chicken
variety menu offering drool worthy taste shawarma hut shawarma falafel kebab shawarmalovers hummus delivery comidaarabe chickenshawarma yummy foodblogger foodstagram shawarmas comida mediterraneanfood dinner foodlover lebanesefood arabianfood arabe dubaicrush,8.0,[],chicken
janamsebhukhe janamsebhukhe fastfood fastfood kfc mashhad fastfood chip yummy breakfast realfastfood foodlover beautiful prettyfood yum yummy amazing instagood photooftheday sweet dinner lunch breakfast fresh tasty delish eating foodpic foodpics,5.0,[],chicken
next chillibasil crunchysalad,2.0,[],chicken
aliyamanasa sembaruthi semba hothip greensaree sareehot sareehotness serialhot hotserialactress ullu kooku ullumovieapp ulluactress mastram serialhotactress,5.0,[],chicken
shin haesun 2021 plus cf 30 sec original video link kindly watch also youtube 15 second httpsyoutubevxlsimlil2m 30 second httpsyoutube6xavbbf8v4 making httpsyoutubegmvhwj5w shinhaesun shinhyesun ynkentertainment chickenplus mrqueen tvn tvn,21.0,[],chicken
cajun fried burger foodblogger foodblog burger burger friedchicken chickenburger coleslaw slaw cheese burgerbuns yummy scrumptious homemade homecooking foodlovers foody foodpic,6.0,[],chicken
꿀꿀꿀 대게 닭갈비 메밀전병 막국수 음식 푸드 맛 여행 음식스타그램 푸드스타그램 맛스타그램 여행스타그램 crap pancake noodle foodstagram instafoodie travel trip travelgram travelstagram instatravel,11.0,[],chicken
really made crazy met one favorite,10.0,"[""'#dachshund #dachshundpuppy #dachshundoftheday #dachshundlove #dachshund_world #puppy #puppies #cute #cuteness #toy #sweet #love #chicken #dog #dogs #doglover #doglife #doglove #puppyoftheday #dachshunds #dachshundlife #dachshund_world #animal #animals #animallovers #animallover #puppygram #puppydog #play #cutenessoverload'"", ""'? @pawsunitedofficial'""]",chicken
رستوران هندی چینگاری سهروردی fooddiary burger fry foodreview foodaholic dinner steak launch breakfast brunch برگر املت غذا pasta تهران شکموها شکم_پر کباب شام صبحانه بوفه_صبحانه burgerporn omlette pizza pizzalover پاستا,10.0,[],chicken
eggwhites albuman boblamonsg amino rule1 protein egg fish bodybuilder bodybuilding physique fitness,7.0,[],chicken
today morning sahir lodhi yakhni pulao happyserving pickaplatee homemadefood pulao sahirlodhi morningshow chefslife,4.0,[],chicken
ron ronweasley hogwarts ron harrypotter,3.0,[],chicken
happy new month wonderful customer taking order month pack smallchops 800 per pack contains 3 puff 1 samosa 1 spring roll 1 bug cut let celebration abuja smallchopsinabuja yummy art love smallchops smallchopsvendor puffpuff samosa springrolls,11.0,[],chicken
vandaag 1 maart een nieuwe dag en een nieuwe maand hier heb ik een heerlijke causa limeña met kip veeg naar link voor een andere foto volgende week maandag 8 maart staat er online op mijn blog een artikel proefperu met recepten van causa limeña today march 1st new day new month causa limeña swipe left another photo next week monday march 8th read proefperu recipe causa limeña blog stay tuned marilyn_amaterasu marilynamaterasu proefperu causalimena peru peruvianfood colorful creative foodstyling foodart plating artfood foodblogger homemade homecook creativefood foodinspiration colorfulfood foodstyle avocado kip foodlovefollow avocadolover perufood perufoodies,115.0,"[""'wow very beautiful '"", ""'beautiful happy march 1st dear marilyn '"", ""'awesome art on a plate'"", ""'so beautiful'"", ""'nice plating'""]",chicken
happy monday folk spring air kid returning classroom lot look forward keep eye daffodil head u stillorgan let see tempt today fenelonsfood supportyourlocalbutcher,2.0,"[""'#butchersofinstagram #butcher #localbutcher #craftbutchery #farmtofork #butchers #irish #dublin #stillorgan #familybusiness #localbusiness #localfood #shoplocal #supportlocal #local #fresh #fish #seafood #meat #dryagedbeef #steak #beef #pork #lamb #chicken #dinnerideas #delivery'""]",chicken
get order tomorrow people dont let oxtail finish like last week bestinweat oxtail yum getinmybelly explore jamaican brownstew riceandpeas authentic yousawitherefirst tastyyyy,4.0,[],chicken
mood congee dumpling went straight lucha_brisbane sliced breast congee prawn pork chive dumpling black pepper beef asparagus lu cha brisbane city lucha comgee chinese blackpepperbeef dumpling foodstagram foodlover foodblogger blogger yummy yummyfood eatingfortheinsta,16.0,"[""'you just can’t go wrong with some dumpling '""]",chicken
toasted sandwich teriyaki teriyaki teriyakichicken recipe camp iron grilledsandwich campfire cheese cooking sub4sub,2.0,[],chicken
love foodbloggers eat indianfood foodstyling instagram like foodiegram foodoftheday foodart foodpassion yummyfood gastronomia homecooking breakfast gourmet pizza foodphoto foody lovefood goodfood cheflife yum homemadefood cucinaitaliana picoftheday dessert follow photooftheday,14.0,[],chicken
adding little bit cheesy keto goodness health stovetop mac cheese perfectly creamy full cheesy goodness stuffed mac n cheese surely blow taste bud head zest order guiltfree american mac n cheese let u know cheesy review order call u 974 44515916 order talabat zest americanchickenmacncheese american cheese keto ketofood ketodiet ketodoha restaurant ketofriendlyfood cafesinqatar foodinqatar breakfast lunch dinner icecream dessert juice coffee fitness healthydiet diet doha vloggers qatarlife qatar,8.0,[],chicken
shinhs831 chickenplus_official original video link kindly watch also youtube 15 second httpsyoutubevxlsimlil2m 30 second httpsyoutube6xavbbf8v4 making film httpsyoutubegmvhwj5w shinhaesun shinhyesun ynkentertainment chickenplus mrqueen tvn tvn,17.0,[],chicken
make sure freezer fully stocked everything need feed hungry mouth child get back classroom today mince chop corrigans covered much shop online home delivery click collect callintoccorrigans supportyourlocalbutcher,4.0,"[""'#butchersofinstagram #butcher #localbutcher #craftbutchery #farmtofork #butchers #irish #dublin #drumcondra #familybusiness #localbusiness #localfood #shoplocal #supportlocal #local #fresh #fish #seafood #meat #dryagedbeef #steak #beef #pork #lamb #chicken #dinnerideas #delivery'""]",chicken
comment youre favorite hen color start_learning_ start_learning_ amazing fact eye popping fact ᴛᴜʀɴ ᴏɴ ᵖᵒˢᵗ ⁿᵒᵗⁱᶠⁱᶜᵃᵗⁱᵒⁿ unseen amazing stuff brain tester fact start_learning_ start_learning_ start_learning_ fact allfacts factsdaily factsonfacts mindblowingfacts didyouknowfacts newfacts knowledgeispower bigfacts realfacts factsoflife amazingfacts viralfacts dailyfacts factsfortheday india awesomefacts truefacts worldfacts gyan mindblowing fact fact fact school college henna hen color,13.0,[],chicken
love foodbloggers eat indianfood foodstyling instagram like foodiegram foodoftheday foodart foodpassion yummyfood gastronomia homecooking breakfast gourmet pizza foodphoto foody lovefood goodfood cheflife yum homemadefood cucinaitaliana picoftheday dessert follow photooftheday,16.0,[],chicken
yummy thaicurry rice loveit vegetableslover jasminreis aschaffenburg insta follower followme,5.0,[],chicken
curry spinach,0.0,[],chicken
lunch lunchtime chickenbiryani chickencurry muttoncurry nazeer foodblogger chef restaurant taste tasteofindia like4likes likeforlikes monday mondaymood foodlover foodpics picoftheday foodpics photography photo,8.0,[],chicken
one today order smoky bbq strip rice pasta get order today healthy diet keto ketodiet protein mealprep weightloss bodybuilding mealideas nutrition gym lunch dinner beef vegetarian birmingham uk followforfollowback follow4followback followme follow4like comment comment4comment likeforlikes like4likes,16.0,[],chicken
lunch,23.0,"[""'wow that’s amazing '""]",chicken
друзья к пятнице ждем вас на вкусные новинки из этого красавчика bbq barbecue grill bbqlife bbqlovers bbqporn churrasco grilling steak beef rib brisket foodstagram barbeque carne pork yummy dinner burger foodblogger meatlover bhfyp,13.0,[],chicken
bunny chow curry recipe durban south africa courtesy thespruceeats,6.0,"[""'#africa #foods #southafrica #durban #southafrican #africanfoods #bread #foodporn #foodblogger #cuisine #kwazulunatal #chicken #curry #meat #foodie #streetfood'"", ""'#postcard #travel #lifestyle #travelblogger #africancountries'""]",chicken
art kunst искусство arte umění painting canvas acrylicpainting oilpainting illustration drawing contemporaryart abstractart watercolor ceramic artist sketch sketchbook horse instaart rooster masterpiece creative instaartist graphic,38.0,[],chicken
noodle follow mukbang_asmar noodle mukbang mukbangasmr mukbangers mukbangvideo mukbangkorea asmr asmreating asmrfood,1.0,[],chicken
