captions,likes,comments,hashtag
getting feastvoxbox mail time tacotuesday thanks influenster complimentary contest,188.0,"[""'#feastbox #influenster #specialdelivery #foodie #tacotuesday #tacos #delish #delmonte #timtams #cobigelow #teatime #tea #chocolate #dessert #treats #frenchs #coupons #box #gift #subscriptionbox #mail #instafood #foodbloggers #influencer'"", ""'aww cool'"", ""'wow this is a pretty shot"", ""nice work'"", ""'nice page follow me '"", ""'cool!'""]",feastbox
pretty excited new voxbox influenster cant wait dig feast box yummmmmmmmmm free review productreview feast stiffjello,7.0,[],feastbox
cant stay away chinese really love stuff ____ fried rice accompained fried gravy mushroom feast box noida sec 12 taste 455 price rs230 rs160 value money yes worth try yes follow foodoveranything_ part foodstagram family chatoriladki foodism footfetishnation soulfood foodgasm eeeeeats chinesefood foodie_features rushilfoodiesince96 yummyfood comfortfood foodie_munchies foodie_features foodphotography tempo spicyfood streetfood pictureoftheday zingyzest chatoriladki,794.0,"[""'thanks for tagging us...'"", ""'looks very yummy '"", ""'@foodoveranything_ bisi badia pic '""]",feastbox
loving influenster realflavorshavecrunch holidaywithfrenchs french bigelowtea countrycrock whenwebake delmonte delmonte teaproudly timtamus timtamslam arnottstimtambiscuits timtam_us contest complimentary ad,23.0,"[""'ooh,how are those jalapeno french onions?'"", ""'we use half of these product for a long time now'""]",feastbox
thanks influenster awesome got share past thanksgiving friend family cant wait use french crispy jalapeños mac cheese next timtamus holidaywithfrenchs whenwebake delmonte teaproudly,57.0,"['""i haven\'t had tim tam since australia haha""']",feastbox
craving burger try big feast cheese burger satisfy taste bud call place order cheeseburger burger bigfeast feast chinese fastfood foodhaul zomato magicpin sodelhi burgerkill delhi noida nomnom craving foodgasm onlineordering ordernow eatnow,70.0,"[""'u make my mouth wet...follow u for food n laughs! '"", '""now i\'m hungry...""']",feastbox
sunday motivation whats plate weekend chinese eatnow delhirestaurant noida sodelhi magicpin whatsupnoida foodhaul foodgasm fooddelight sunday eattreat chinesecuisine yummy nomnom awesome igers ching soupy ordernow,53.0,[],feastbox
getting ready next weekend big event flower ice block feastboards melbournefoodie,55.0,[],feastbox
thing corn first disappear cooky weird im really sure use jalapeños im mild kind spice girl shall see timtamus delmonte realflavorshavecrunch teaproudly whenwebake free contest,8.0,[],feastbox
need bowl fork treat healthy meal call 9818640011 01204331973 fill belly amazing bowl meal feast box chinese chilli hotgarlic noodle chingchong foodhaul foodgasm nomnom chinesefood noida magicpin sodelhi zomato foodielife bowl meal tasty spicynoodles eatnow ordernow,53.0,"[""'seems good to me'""]",feastbox
life throw burger eat order yummiest burger starting rs48 thefeastbox happy meal yummy burger fry cheeseburger veggie foodhaul foodlover burgerporn burgerbuns goodfood meal feast fastfood foodgasm zomato magicpin noida ifoundawesome nomnom ordernow eatnow,52.0,[],feastbox
saturday call amazing authentic chinese order give rest kitchen chinese saturdaynignt weekend chinesefood authentic noida foodie foodgasm foodhaul goodfood zomato nomnom yummy loveforfood eatme ordernow,51.0,[],feastbox
received one two bigelowtea influenster teaproudly free complimentary contest tea perfect snowy fall daycan even use two word sentence,39.0,"[""'#teaproudly #complimentary #contest #ad @influenster @bigelowtea'""]",feastbox
link bio whats inside free influenster timtam biscuit timtam_us crispy jalapeños french coupon recipe using countrycrock buttery stick sweet whole kernel corn delmonte two bigelow benefirs tea bag bigelowtea feastvoxbox contest timtamus timtamslam realflavorshavecrunch holidaywithfrenchs whenwebake delmonte teaproudly,11.0,[],feastbox
said good burn hole pocket get loved chinese delivered right doorstep noida order zomato claim 15 discount chinese meal yummy chinesefood nomnom noodle dimsums hotnspicy noida zomato magicpin sodelhi foodhaul loveforfood foodgasm foodiebay eatnow chingchong eatnow ordernow,37.0,"[""'@thefeastboxindia thank you for the follow '""]",feastbox
got free voxbox influenster join influenster get free stuff link bio,0.0,[],feastbox
mama friend taught indulgent trick year back thought perfect rainy day share bring timtamslam obtain timtam 2 nibble end 3 put one end coffee drink sip like straw 4 pop remaining biscuit mouth ooey gooey treat influenster timtam_us influenstervoxbox influenster timtamus timtamslam complimentary contest,21.0,[],feastbox
thanksgiving coming soon long wait finally got feast voxbox favorite box bigelow teabags timtam biscuit first voxbox would like thank influenster sending hoping box come way got influenster complimentary influenster feastvoxbox bigelow bigelowtea timtam arnotts french delmonte voxbox freebie sample free biscuit cookie thanksgiving family gettogether donate foodbanks corn pea tea,57.0,[],feastbox
guy im super sad ate last tim tam last night influenstervoxbox need find thing soooooo good influenster timtam,11.0,"[""'because i’m weird and have to do this often for thing i like"", ""i usually find it on the website. i found this:'"", '""tim tam are soo good! i\'ve found them at target and meijer""', ""'you can get them at kroger'""]",feastbox
love chinese brings best chinese call 9818640011 01204331973 place order chinesefood chinese noidafoodie magicpin foodhaul foodgasm loveforfood zomato online feast foodforlife noidagram like followforfollow hungry dinner ordernow,36.0,[],feastbox
anyone else spending holiday season catching supernatural bigelowtea ginger peach herbal tea complimentary influenster tea split husband u enjoyed able drink 3 year old swooped tried teach r2d2 swim mug teaproudly complimentary contest ad,17.0,"[""'#planner #plannercommunity #peopleoverplanners #november #bujo #pilotpens #magpiesoul #supernatural #supernaturalfandom #travelnotebook #goth #gothic #spooky #gothicplanner #skull'""]",feastbox
influenster get life cant wait try free goody influenster feastvoxbox complimentary ilovefood voxbox timtam french delmonte bigelow countrycrock,14.0,"['""that\'s awesome!""']",feastbox
get know interesting chinese fact feast box chinese fact chinesefood feast foodhaul foodgram instafoodie nomnom yummy loveforfood zomato magicpin noida exotic chinesefacts eatnow,43.0,[],feastbox
influensterrealflavorshavecrunch holidaywithfrenchs french influenster whenwebake complimentary countrycrock influensterdelmonte contest complimentary influenster delmonte teaproudly complimentary contest ad influenster bigelowtea timtamus timtamslam complimentary contest timtam_us influenster influenstereats contest influenster jalapeño pretzel dog ingredient refrigerated pizza dough 12 hot dog 3 tbsp baking soda 05 water 5 oz french crispy jalapeños 05 cheddar beer sauce,1.0,[],feastbox
influenstereats contest influenster influenster,0.0,[],feastbox
jalapeño pretzel dog ingredient refrigerated pizza dough 12 hot dog 3 tbsp baking soda 0 water 5 oz french crispy jalapeños 0 cheddar beer sauce influensterrealflavorshavecrunch holidaywithfrenchs french influenster,1.0,[],feastbox
jalapeño pretzel dog ingredient refrigerated pizza dough 12 hot dog 3 tbsp baking soda 0 water 5 oz french crispy jalapeños 0 cheddar beer sauce influenstereats contest influenster influenster,2.0,[],feastbox
teaproudly complimentary contest ad influenster bigelowtea timtamus timtamslam complimentary contest timtam_us influenster influenstereats contest influenster delmonte contest complimentary influenster delmonte influensterwhenwebake complimentary countrycrock influensterrealflavorshavecrunch holidaywithfrenchs french influenster whenwebake complimentary countrycrock influensteri absolutely love amazing brand product love baking wounderful quality product baking ready received product complimentary review purpose,1.0,[],feastbox
realflavorshavecrunch holidaywithfrenchs complimentary contest french influenster whenwebake complimentary countrycrock influenster influensterdelmonte contest complimentary influenster delmonte absolutely love amazing brand product love baking wounderful quality product baking ready received product complimentary review purposesrealflavorshavecrunch holidaywithfrenchs complimentary contest french influenster,4.0,[],feastbox
iced coffee complimentary timtam_us influenster made updating planner little easier today timtamus timtamslam complimentary contest,14.0,[],feastbox
got another influenster free voxbox mail,3.0,"[""'those french’s jalapeños are amazing!'""]",feastbox
excited voxbox influenster finally arrived ive patiently waiting thanksgiving complimentary swag contest influenster influenstervoxbox,14.0,[],feastbox
excited receive box product amazing influenster timtam french delmonte ifollowback f4f review delmonte contest complimentary influenster delmonte,71.0,[],feastbox
received influenster goody lie within stay tuned contest gotitfree influenster foodiegram whatsinthebox,5.0,[],feastbox
mood dim sumptuous call amazing dumpling feast box chinese dimsums momolove dumpling yummy chinesecuisine spicy foodhaul noida zomato chickenlove instafun like follow eatnow ordernow,34.0,"[""'its great to see your love for food... please dm your mail id to get your e-copy of chefoy magazine featuring restaurant"", 'cafe', 'food blogger', ""chef and much more...... follow u & be updated with offer and entry for next edition'""]",feastbox
wonder influenster item free complimentary testing purpose,4.0,[],feastbox
who ready feast got influenster box goody free try ethan already give 10 tim tam yum influenster feastvoxbox thanksgiving dinnertime timtams,15.0,[],feastbox
else thanks influenster cant wait see goody voxbox havent signed follow link httpswwwinfluenstercomnotificationstrackinggoemail_id94671081urlhttps3a2f2fwwwinfluenstercom2fr2f1984644signatureevpydcxi8idgaicr_o0rcnttvuu3d,36.0,"['""just saw some spoiler in others\' post and i\'m so stoked. timtamslam for dayz!""']",feastbox
today lunch place feast box thefeastboxindia location noida sector 12 follow f00ddiggers follow f00ddiggers follow f00ddiggers chinesefood munchies lunchtime foodoftheday photooftheday clubsandwich foodtummy followme followfollow followtrain follownow foodpics redminote4 note4click eats,101.0,"[""'thanks for tagging u '""]",feastbox
diwali feast feast box feedfeed buzzfeast eeeeeats huffposttaste f52grams bhgfood receipe buzzfeedfood instafood foodandwine chinese diwali foodgram foodhaul foodforfoodies magicpin zomato discount soupy tasty eatnow chinese nomnom ordernow,34.0,"[""'i love this! i think you would like my page that combine food and fashion - hope you will check it out! '""]",feastbox
get chinese accompany diwali scene order online zomato get 15off feast chinese chineserestaurant delhi noida foodgasm foodhaul magicpin sodelhi noidagram foodforfoodies ordernow nomnom yummy tasty eatnow zomato,44.0,[],feastbox
check thefeastboxin exciting offer order online website get 20 wohoo chinesefood nomnom yummy foodforthesoul foodhaul foodgasm chinese delhi noida magicpin sodelhi noidagram feast ordernow eatnow,24.0,[],feastbox
delivering pasta feast box style noida order zomato get discount hurry pasta chinese italian delhi noida foodgasm foodhaul sodelhi zomato magicpin feast foodforfoodies homedelivery penne redsauce spice tasty eatnow ordernow noidafoodie noidagram like4like follow eatrepeat,39.0,"[""'it look really delicious! '""]",feastbox
almost turkey time help make planning super easy preorder thanksgiving feast box compliment roast beast seasonal special includes sourdough lot fresh local veg essential perfect thanksgiving meal available october long shopcowansfresh thanksgiving fallvibes eatwell shoplocal supportlocal cowansfreshbox roastbeast,15.0,[],feastbox
navratras go green order best chinese feast box call delivery 9818640011 01204331973 chinese bestfood foodcoma noodle feast vegetarian foodhaul delhi magicpin noida eatnow chineslovers sodelhi zomato gogreen navratras instafood foodiliciousfood veggie tasty delight ordernow,27.0,[],feastbox
sunday plan got sorted call u let u surprise best chinese served hot delivered right doorstep weekend chinese eatnow delhirestaurant noida sodelhi magicpin whatsupnoida foodhaul foodgasm fooddelight sunday eattreat chinesecuisine yummy nomnom awesome igers ching soupy ordernow,27.0,[],feastbox
feast box wrapped ready go like share tag friend kind feast grazingtablesandcheeseboards myfoodontv feastboards antipasto market fresh marketfresh salami cheese sharingfood foodpost wedding engagement birthday babyshower grazingtable melbournefood grazingstation melbourneweddingideas letsdinemelbourne cheeseboard foodstation platter melbourne melbournefoodie melbfoodprn,39.0,[],feastbox
ofcourse extraaa fries wide variety quick fast call extra fry available feast box order zomato get 15off waiting order fry extrafries foodgram frieslover foodlover hungry junkfood yummy nomnom sodelhi magicpin zomato whatsupnoida foodhaul foodcoma chineserestaurant eatnow instafood delhi noida bestchinese ordernow,27.0,[],feastbox
take kanpai melbourne teppanyaki sou vide beef teppanyaki creamy garlic sauce holla know im talking soofeast foodnerd klcatering,70.0,[],feastbox
burger starting r 48 order online zomato avail 15 burger fastfood fry chicken cheese foodgram foodgasm sodelhi magicpic zomato whatsupnoida delhincr ifoundawesome tuesday kickassburgers eatnow ordernow nomnom delhirestaurant noida instafood staysane foodlover cheatday letseat,42.0,[],feastbox
treat lip smacking noodle sunday dinner call place order 9818640011 dinner noodle chinese nomnom ching lipsmacking hotnspicy chineserestaurant eatnow delhi noida sodelhi foodlover chinesecuisine vegetable yummy foodgasm igers noddleslover ordernow,32.0,[],feastbox
thupka lot like family ingredient enhances complete family dinner scene ordering thupka available 2 different style nepal sikkim order thukpa chinese nomnom comfortfood noodle chineserestaurant tibetianfood foodgasm yummy weekend ordernow delhi delhi_foodies sodelhi magicpin whatsupnoida noidafoodie spicy dfordelhi delight,26.0,[],feastbox
say hello sou vide teriyaki chicken soba noodle one dish menu still much work progress component guy think go soofeast foodnerd klcatering,53.0,[],feastbox
luncheon craving dimsums call delivery 9818640011 01204331973 dimsums chinesefood luncheon chinese yummy foodgasm chicken loveforfood tasty noida sodelhi instafoodie foodilicious ordernow fooddelivery bestchinese delhifoodies nomnom cuisine chinesdimsums,22.0,[],feastbox
arrived nocturnal reader box dont fancy havin wee look inside dont swipe nocturnalreadersbox nocturnalreaders constantreader booksubscriptionbox bookworm booknerd bibliophile bookstagram bookoftheday igreads instaread ilovereading myweereads readinglist readingchallenge recommendedreading readoftheday bookoftheday constantreader amreading horrorlover horrorfan horrorbooks edkurtz brackenmacleod nos4a2 silenceofthelambs joehill michaelbroomart jaw vampireprint,30.0,[],feastbox
literally cannot wait lunchtime week exciting new bento box systema bentobox lunchtime makinglunchfun healthylunch lunch healthy healthybody healthymind pickandmix whatshalliputinit weightloss weightlossjourney diet weightlossinspiration dietinspiration weightlossmotivation dietmotivation luckydip fitspo osteoarthritis chroniclife chronicpain painmanagement spoonie hippain dodgyhips weightlossforpain oa,22.0,"['""but are you putting sushi in it @beccarthritis_rex_diets that\'s what they are made for! ""', '""@ruthscammell i quite like some sushi', ""but 'bento' actually just refers to a single portion of food rather than sushi specifically. could be meat"", 'fish', 'rice,veg etc. . i plan on lot of little single portion of food than doesn\'t need to be kept too chilled when i am out and about between school/office/meetings etc.""']",feastbox
carve ham eat ham thanks truely freedompork ham yummiest glaze real kiwisummer dinner kiwikai,45.0,[],feastbox
baste ham ham freedompork kiwisummer kiwikai lookingood pork,32.0,"[""'live the reflection @margotnz'""]",feastbox
peel ham freedompork kiwisummer,23.0,[],feastbox
christmas eve festivity new home familyfeastboxsomearemissing,14.0,"[""'i had a sneaky peak at the new place"", ""it beautiful!! @carlenewilkie must pop up and enjoy a wine with you on that amazing deck '"", ""'looking forward to it @alycerowe'"", ""'pretty nice :)'""]",feastbox
getting christmas ham early thanks margotnz delish free farmed ham glaze easy christmasham happypigs,23.0,[],feastbox
thanks mama margotnz great way get christmas started platter delish,28.0,"[""'that look delicious vj!'"", ""'more please!'""]",feastbox
tucking dessert tonight look good loving summer strawberry goodness raglancoconutyoghurt santayoghi,181.0,"[""'grabbed jar of @raglancoconutyoghurt for christmas brunch... perfect with a fruit platter'"", ""'love this idea"", ""modern tastier version of fondue '"", ""'you guy make the best yoghurt ever '"", ""'thanks dude"", ""appreciate that! @thesurfingvegan'""]",feastbox
whats cookin keepupdated comingsoon,222.0,[],feastbox
many box fit outback quite christmasherewecome nzsmallbusiness makingmemories soldout,75.0,[],feastbox
yum mixed berry coulis making smell like xmas christmas waikato berry,32.0,[],feastbox
long box christmas goodness whisking way across north island lucky customer exciting 10 christmas feastboxes left hurry want one christmas easychristmaslunch nzsmallbusiness supportlocal makingmemories easyentertaining artisanalproduce,35.0,[],feastbox
ne devrait jamais tourner le do à un danger pour tenter de le fuir fashion fahionblogger follow photographer fashionformen fashionstyle malemodels bloggerstyle menwithstreetstyle menwithstyle menfashion mensstyle dapperstyleard menwithclass styleformen menswear mensweardaily instaboy menwithstyle foodspring healthyfood lifestyle hairstyle photographerslife style fashionmen model agadir menfashion menhairstyle hairstyle amazingmorocco,7.0,[],foodspring
sunset fashion fahionblogger follow photographer fashionformen fashionstyle malemodels bloggerstyle menwithstreetstyle menwithstyle menfashion mensstyle dapperstyleard menwithclass styleformen menswear mensweardaily instaboy menwithstyle foodspring healthyfood lifestyle hairstyle photographerslife style fashionmen model agadir menfashion menhairstyle hairstyle amazingmorocco,5.0,[],foodspring
qui se fie aux femmes écrit dans la neige fashion fahionblogger follow photographer fashionformen fashionstyle malemodels bloggerstyle menwithstreetstyle menwithstyle menfashion mensstyle dapperstyleard menwithclass styleformen menswear mensweardaily instaboy menwithstyle foodspring healthyfood lifestyle hairstyle photographerslife style fashionmen model agadir menfashion menhairstyle hairstyle amazingmorocco,4.0,[],foodspring
fashion part daily air change time event even see approaching revolution clothes see feel everything clothes fashion fahionblogger follow photographer fashionformen fashionstyle malemodels bloggerstyle menwithstreetstyle menwithstyle menfashion mensstyle dapperstyleard menwithclass styleformen menswear mensweardaily instaboy menwithstyle foodspring healthyfood lifestyle hairstyle photographerslife style fashionmen model agadir menfashion menhairstyle hairstyle amazingmorocco,256.0,[],foodspring
foodstagram springfeels c4c comment4comment l4l like4like likemyrecent likepost picoftheday instagood foodblogger weekendvibes yummy foodspring foodphotography foodgasm foodlover foodhaven foodoftheday foodpassion springfeels springtime coffee,2.0,[],foodspring
follow jmargeretfitness fitness fitnessmotivation motivation motivationalquotes quote bodybuilding healthy mindset fitnessgirl fitnessmodel motivational squat deadlift benchpress powerlifting powerbuilding aesthetic glute workout hamstring allenamento palestra gym foodspring johngerefitness,16.0,"[""'dm on @insta_promo.ig'""]",foodspring
foodvarietyofficial follow foodvarietyofficial follow foodvarietyofficial foodsgram foodspecials foodscene foodstragram foodshots foodsofinstagram foodslime foodstylish foodspring foodstyleguide foodservice foodscience foodstagrams foodstory foodstreet foodstargram foodstorage foodstarz_official cibi cibinlik cibobuono cibolo cibosanoegustoso alimentacionconsciente lovefoods lovefoodtoomuch lovefoodhatewastebrunei wildfoodlove foodfollowers followfood,27.0,"[""'crisp-fried rolled-rice '""]",foodspring
ℤ homemade adoro foodphotography foodlike foodlover foodstagram foodpic foodshare foodblogger foodbloggers followforfollowback followe follow4followback likesforlike likesforlike selflove cute following beef cucinaitaliana cucinarechepassione cucinare foodspring cucinoperamore telodicocolcibo ilmestolodimanu cucinareeunattodamore,126.0,[],foodspring
today motivation fitness gym workout fitnessmotivation myprotein bodybuilding training myproteinit myproteinru healthylifestyle sport instagram healthy gymlife crossfit personaltrainer myproteinuk muscle diet healthyfood healthydiet bodybuilding motivation workout training goodtraining bulkpowders fit powered yamamotonutrition foodspring healthyrecepes,15.0,[],foodspring
n e w p r u c v e f r foodspring _____________________________________________________________ foodspring healthyfood productphotography productvideo ad anzeige vital proteinballs commercial filmmaker hamburg photography cinematography,46.0,[],foodspring
let get great start week going starting protein shake breakfast todayproteinproteinshaker foodspring mangoshake frozenmango healthyshakemealreplacementshake mealreplacement gettingbetter gettinghealthier loosingweight weightlossjourney weightloss keepingtheweightoffforlife doingmybest mondaygoodmorning goodday march makethismonthcount like comment share,27.0,"[""'love it dm u @weightloss_transformation'"", ""'please check your dm'""]",foodspring
excited share im apart foodspringfamily sampling load product including pancake mix post last week confirm nutrition product incredible guy might noticed havent collaborated nutrition brand yet thats fussy come proteinproducts word one thing really stood brand quality product protein sourced grass fed cow protein creamsspreads contain palm oil excited create cooking baking content using product like look product use code beckyfsg save one favourite apple energy amino im sipping foodspring_uk foodspring ad sponsored,156.0,"[""'wooo go on girl!! smashing it '"", ""'ahh congrats'"", ""'yay congrats my girl '"", ""'omg so happy for you!!! exciting thing ahead '"", ""'how exciting! '"", ""'so exciting girl!!!!'"", ""'gorgeous \\u0001f90d'"", ""'so exciting !!!'"", ""'damn ok girl!! i see you'""]",foodspring
cominciamo il nuovo mese con lolio giusto hello march march marzo puglia pugliagram instagood instafood foodspring foodphotography foodlover foodblogger foodblog foodbloggers foodbloggeritaliani foodstagram foodstylist foodpics foodgasm foodart foodshare foodlove foodlovers foodphoto foodshare foodaddict foodblogfeed foodcoma foodism foodoftheday,21.0,[],foodspring
foodspring ernährungstipps speziell auf dich abgestimmt jetzt body check durchführen wwwfrozenstolichnayacom bei foodspring anklicken ernährung foodlover body bodypositivity bodytransformation bodygoals tattoo ink inked tattooinspiration tattooideas love blessed grateful lifestyle beyourself welcometomyworld,44.0,[],foodspring
monday morning home mondaymorning athome breakfast goodmorning healthyfood healthybreakfast porridge proteinporridge test foodspring foodstagram fitness fruit foodphotography yummyfood porridgebowl,37.0,[],foodspring
pinch punch first month let start march putting best foot forward looking forward achieving month let u know,42.0,"[""'#foodspring #newmonth #newggoals #apinchandapunch #easyrecipes #nutrition #breakfastrecipes #foodspringrecipes'""]",foodspring
fitness gym workout fitnessmotivation myprotein bodybuilding training myproteinit myproteinru healthylifestyle sport instagram healthy gymlife crossfit personaltrainer myproteinuk muscle diet healthyfood healthydiet bodybuilding motivation workout training goodtraining bulkpowders fit powered yamamotonutrition foodspring healthyrecepes,23.0,[],foodspring
always program work matter feel dont progress little thing important actual time work iamsuprfitcrossfitcrossfitlifecrossfitlifestylecrossfitlovercrossfitlovecrossfitterfitfitforlifefitlifefitlifestylefitandhealthyfitnessfitnesslifefitnesslifestylefitnessmotivationfitnessaddictbodyattackhuelfoodspringstrongcoupleendurancethrusterliftheavyenergycakefuckcoronastayfitstaystrongcrossfitcouple,19.0,[],foodspring
short frontsquats conditioning thruster conditioning came prvnfitness friend mine take part 3 rft 108642 4045505560 iamsuprfitcrossfitcrossfitlifecrossfitlifestylecrossfitlovercrossfitlovecrossfitterfitfitforlifefitlifefitlifestylefitandhealthyfitnessfitnesslifefitnesslifestylefitnessmotivationfitnessaddictbodyattackhuelfoodspringstrongcoupleendurancethrusterliftheavyenergycakefuckcoronastayfitstaystrongcrossfitcouple,11.0,[],foodspring
happy belated birthday guido guido lüdecke one customer success manager keep customer engaged happy guido super basketball one passionate people foodspring hope weekend birthday slam dunk go lakers keep passion enthusiasm,16.0,"[""'#foodspring\\xa0#shapeyourcareer #insidefoodspring #celebrateourpeople #happybirthday #shapeyourcareer #customersuccessmanager #greatwork #passionforourbrand #jointhefoodspringfamily #strongertogether #determinedtodeliver #putthecustomerfirst #takeownership #thinkdifferently #basketball'""]",foodspring
