captions,likes,comments,hashtag
fresh juicy salad,9.0,[],allplants
magnify yourselfin solitude mind gain strength learns lean upon ordernow beautiful enduring cycus palm bonsai plantlove dishgardens myhome mygarden giftingideas enduring loveforplants lovelypalm solitude picofday beautifulplants beautifulplants mycreation allaboutgreens houdewarming celebration,35.0,[],allplants
short fact veganism good planet animal agriculture produce greenhouse gas emission car train plane form transportation around world combined plus factory farming responsible 65 percent humanrelated emission nitrous oxidea greenhouse gas 296 time global warming potential carbon dioxide stay atmosphere 200 year study show going cut carbon footprint half,50.0,"[""'#fairtradefashion #plantbasedbabe #veganstreetwear #veganfashion #veganapparel #losangelesvegans #vegansoflosangeles \\n#lavegan #ukvegan #aussievegan #vegancanada #vegansofgermany #vegan #nodairy #dairyfree #nomilk #nocheese #plantfood #vegan #nomeat #allplants #antidairy #lbvegan #longbeachvegan #socalvegan #losangeles #crueltyfree #lbcvegan #santaanavegan #vegansoflosangeles'""]",allplants
put m little white tag gan put 10 huh arr gan every slice one tag everyone know m need put flower cute kan gan goodlife_gan 2nd class bit relax time chit chating teasing yam mousse cake make two layer cake vanilla sponge cake yam mousse recipe included 2day intermediate baking workshop bakeandartisan jakarta 2829 feb youll learn vanilla sponge cake meringue yam cremeux yam mousse basic deco fresh flower see soon jakarta vegansofig workshop jakarta vegansjakarta jakartabakingworkshop bakingclass veganbaking,59.0,"[""' your photo look good! '"", ""'looks delicious. do you have a recipe book for me to purchase? jaren from sabah'""]",allplants
breakfast fit king strawberry peanut butter waffle banana dark chocolate oatmeal green protein shake veganbulking veganbodybuilding sogood vegangains getbigwithplants eatbigtogetbig healthylifestyle organic,7.0,[],allplants
egusi make yet another appearance today lunch pasta never tried seen great combination topped fav fried plantain fresh tomato veganfood blog foodofinstagram foodoftheday plantbaseddiet foodlog foodblogger sweetandsavory veganrecipes vegan veganlife green plantain tomato fresh egusi recipe recipeideas,28.0,[],allplants
rossii chalatea plantsmakepeoplehappy chalateaclub plant aroidsofinstagram plantsofinstagram,22.0,[],allplants
cara cara caracara fruit snack fruitsnack organic rubyred rubyredgrapefruit citrus orange juicy fruity tasty healthy eataplant goodforyou healthfood vegansnack snacktime yum garden homevegan vegantime veganideas dairyfree animalfree crueltyfree theeagervegan,24.0,[],allplants
here first post asian style risotto full green flavour goodness taken boshtv healthy book fromourbowl vegancooking dinner yum asiancooking asianvegan whattheguac,28.0,[],allplants
dinner today yum simple fuss always go back second rather stack plate plantain avocado two thing go back second third andwith ease fortheloveofavocado fortheloveofplantain simplesuppers easymeals easytomake easyrecipes yummyinmytummy,15.0,[],allplants
throwback week ago kfc_uki really well new burger id heard many positive review first couple day released curious try didnt disappoint assumed might little dry actually mayo right 11 herb n spice made flavoursome without sickly could easily another one 910 would genuinely veganuary kfc veg vegetarian glutenfree veganfood whatveganseat wholefood crueltyfree veganrecipes halal vegetarianrecipes burger veganburger uglyvegan veganjunk,36.0,"[""'omg this vegan burger look so delicious. i just made a vegan warm sweetcorn thai salad . i would love to hear your view/comment please. thank you so much \\u200d'""]",allplants
problem pasta cant solve dont think added wild mushroom bunch fresh thyme january blue antidote ingredient serf 4 400g mixed mushroom used mix oyster shiitake portobello enoki 2 tbsp olive oil ½ tsp salt 30g fresh thyme leaf picked 50g white wine 350g fresh pasta storebought tbsp butter method start prepping mushroom avoid washing theyll absorb water become soggy instead use damp towel clean dirt theyre clean slice heat olive oil heavy sat pan medium heat add prepped mushroom let cook untouched important dont move 67 minute heat facing side golden point stir around lightly let continue cooking untouched point add salt fresh thyme white wine let cook 23 minute wine reduced set aside cook pasta boiling salted water pasta cooked reserve ½ cup cooking water set aside drain pasta transfer cooked mushroom turn heat mediumhigh stir reserved cooking water tbsp butter pasta glossy taste salt adjust taste serve topped extra fresh thyme black pepper,540.0,"[""'#pasta #veganpasta #allplants #recipe #italianfood #mushrooms #thyme #herbs #cooking #chefs #vegansofldn #veganfoodshare #vegansofig #januaryblues #plants #eatgreen #plantbased'"", '""looks and sound absolutely delicious i always thought fresh pasta wasn\'t vegan and have been using dried a i believe that is?""', ""'that look delicious!\\ntempted to order but interested in what packaging the meal come in? i’m avoiding any food packaged in plastic so wondering whether this would be something i could use'""]",allplants
feeding time strawberry pecan salad fruit veggie smoothie veganmom vegankids veganfamily veganwithsoul veganfasting withlove fortheanimals forus fortheplanet newvegan dairyfree meatfree mealfreemeal meatfreemonday intermittenfasting breakingfast,13.0,"[""'ooooh strawberry pecan! amazing'""]",allplants
iza izasharmila young beautiful mother full time home baker first malay student yes first 10 year baking industry surprised told baking since 2013 exactly 7 year old wow cant see fancy cake business instagram bakedkl oldfashioned frill simple yet healthy homebaked cakesdesserts grab piece long cny break good time clear reorganize phone album write story spend time loved one plan 2nd halfyear activity still thousand photo clear stay tuned theresa teng background im writing one favourite song throwback workshop veganbaking veganskl veganmalaysia,65.0,"[""'we are so blessed to learnt from you.'"", ""'omg melinda so honored but im so shy now . thank you2"", ""where were you 7 year ago. now you are officially my lao shi.'""]",allplants
answer excuse dont time cook healthy meal amazing healthy meal take time prep instead spending cash unhealthy fast great choice macro information fantastic taste active trainer pilatesyoga teacher body need good fuel meal 20g protein per serving excellent plant base hence get energy well muscle recovery winwin occasional cooking laziness personaltrainer allnatural loveyourself healthylifestyle healthyfood healthyliving fitness fit helpingplanet goodfood namaste fitnessmotivation fitlife,13.0,[],allplants
creamy mushroom risotto good usually cant stop eating pan plate time,13.0,"[""'#vegan #risotto #creamy #mushroom #allplants #whatveganseat #fingerlickinggood #foodlover #love #food #foodporn #instagood'"", ""'need the recipe lol!!'""]",allplants
hi fam introduced farinata 2 year ago cooking cotto_krd ive cravinggggg hard chickpea crispy pancake sitch tomatoesbasil time year hello plus corn cob almost necessity every meal reckon keep ya salad simple youll satisfied use thing garden soz slack ive move,33.0,"[""'i am one lucky goose'"", ""'god damn could you please put up the recipe/ send me it this look insane'"", ""'let’s get that pancake recipe ay'"", ""'sick"", ""recipe please!!'""]",allplants
cressida daniel foodtryb awesome podcast host thank chatted rinse influence veganism role head development whats next incredible company well fave london eatery simplicity_burger woman ellen degeneres listen link bio thanks tryb veganish developmentchef vegcentric vegcentricvegan foodtryb,50.0,"[""'thank you joey! it wa lovely having you on! '"", ""'so lovely to meet and chat with you joey!! x'""]",allplants
there something strangely addictive fermented sourdough teff flatbread paired creamy stew flatbread also mesmerising scattered pocket air misr wat red lentil stew mushroom tib shiro chickpea stew,47.0,"[""'#vegan#plantbased#veganfood#vegetarian#vegetarianfood#foodblogger#veganfoodshares#foodporn#foodpornography#sydneyfoodblog#allplants#sydneyfood#sydneyfoodblog#foodie#foodiesofinstagram#sydneyfoodguide#sydneyfoodporn#fitness#wholefoods#plantpowered#bestofvegan#whatveganseat#ethiopianfood#veganethiopian#injera#vegancurry#stew#veganstew#brunch#veganbrunch'"", ""'love ethiopian food so much '""]",allplants
agreed serving dessert without coffee incomplete dessert made enjoyed caffeine kick dont drink much coffee guess getting coffee machine good idea also make dessert class complete tessa_yeo brought coffee class last week mont blanc gluten free hazelnut joconde whole chestnut vanilla cremeux signature chestnut puree top next dessert class 15 feb check story highlight detail vegansofig veganfood workshop vegandessert montblanc vegankl vegansmalaysia,44.0,"[""'tea over coffee for me! '""]",allplants
plant based enchilada lasagna one please air fryer probably could taken better picture gone ill go ahead tag uglyvegan corn tortilla cut quarter layered tiny skillet used leftover red bean canned red chili sauce aged nut cheese cashew base topped sliced olive set whole oven safe skillet basket air fryer bake 15 minute 370 f easy fast plantbasedwholefood cookforyourself itssogood onepot,35.0,"[""'#allplants #allergylife #happyfoodie #gleganfood #veganrecipes #veganuary #glutenfree #glutenfreerecipes #meatlessmonday #meatlessmeals'"", ""'this look delicious '"", ""'get in my belly!!! '""]",allplants
tried true bread butter 12 punch pain inflammation,15.0,"[""'#pain #inflammation #cbdtopicals #holistichealth #allnatural #sleepwell #bewell #allplants'""]",allplants
make bowl noodz ramen,36.0,"[""'omg they look amazing'"", ""'i want this next week '""]",allplants
pancake breakfast si stopping dal jax phx sevenmilecafehv love place lotsa option menu aside pancake got tofu scramble side black bean salsa guacamole flour tortilla,48.0,"[""'.\\n.\\n.\\n.\\n.\\n #whatveganseat #eatveganfood #veganfoodshare #veganfoodie #veganshare #veganaf #vegans #veganism #vegancommunity #veganlife #vgang #vegansofinstagram #vegansofig #vegansfoodlovers #eatvegan #noanimalsharmed #noanimalingredients #crueltyfree #mindfuleating \\xa0#govegan #allplants #veganpancakes'""]",allplants
top tip treat veggie exactly like meat think dryrubs marinade charring roasting youll always end awesome complex flavour thank dailymail femail featuring today always fun chatting thing veggie vegcentricvegan developmentchef vegancooking vegantoptips vegantips,179.0,"[""'nice one '"", ""'love this '""]",allplants
calathea pink rosy calathea calathealovers calatheaforsale calatheapinkrossy plantshopinginstagram plantmakepeoplehappy plantsofinstagram plantshopjakarta plant plannercommunity jualtanamanhiasmurah indonesiaplantclub houseplantsofinstagram houseplant aroidaddict seller rama_nursery urbanjungle,95.0,[],allplants
happy part healthy cincinnati group surprised delighted win chili cookoff creamy white chili sweet potatoblack bean caribbean green chili wfpbno plantbasedchili rollinbowls rollinbowlstruck cincyeats vegancincinnati vegandelicious cincinnativegan cincinnatifood cincinnatifoodie 365cincinnati vegansofig,84.0,"[""'congrats momma well deserved!!'"", ""'how exciting! congrats!'"", ""'fantastic news! '"", '""that\'s great', 'congrats!""', ""'awesome news monica! congrats '"", ""'awesome!! congratulation monica!!'"", ""'so exciting!! '""]",allplants
oh monday really get without good caffeine kick luckily make cuppa whole lot nutritious 100 calcium velvety goodness meatfreemondays coffeeaddict milkalternative dairyfree vegansunite feedfeedvegan plantbasedvibes ukvegans ocado veganuary2020,58.0,[],allplants
day doughnut denim chocolate sprinkle peanut butter choclate og glazed passionfruit creme maple blueberry fritter doughnut allvegan,52.0,"[""'#vegan#plantbased#veganfood#vegetarian#vegetarianfood#foodblogger#veganfoodshares#foodporn#foodpornography#sydneyfoodblog#allplants#sydneyfood#sydneyfoodblog#foodie#foodiesofinstagram#sydneyfoodguide#sydneyfoodporn#fitness#wholefoods#plantpowered#bestofvegan#donut#doughnut#vegandonut#vegandoughnut#denim#maple#dessertporn#dessert#pastry'"", ""'still need to try it out haha'""]",allplants
crispy flaky soft importantly buttery croissant counter georgeatomanu,22.0,"[""'amazing just amazing. i had one in christchurch last week but not a good a yours!!'""]",allplants
many people asked recently minimum student start class one yes one always arrange 11 session weekday join group class weekend green grape lime tart citrusy twist classic tart filled refreshing lime millet cream topped green grape kokchin6023 3rd class vegansofig vegansinmalaysia veganmalaysia vegankl workshop grape vegandessert,62.0,"['""very refreshing. thanks for last saturday\'s class. my niece enjoyed too.""', ""'sure when is yr next class ?'"", ""'waiting for watermelon cake and macaroons'"", ""'hi melissa"", ""where can i see your class schedule?'"", ""'hi melissa"", ""where can i see your class schedule?'"", ""'this look yummy'""]",allplants
dont need chicken soup soul need game changer jampacked kale rice crispy garlic healthy hearty ingredient 2 tbsp olive oil separated white onion finely diced 400g chestnut mushroom sliced tsp salt 180g white rice preferably short grain litre vegetable stock 200g kale 250g oyster king oyster mushroom top torn apart 10g dill garlic oil make ⅓ cup 6 clove garlic ⅓ cup olive oil method heat olive oil large pot medium heat add diced white onion sauté 68 minute translucent add sliced mushroom let cook untouched 810 minute help develop bite texture flavour stock added add salt stir continue cooking another couple minute add white rice followed vegetable stock simmer 2530 minute rice cooked remove soup heat stir kale soup simmer prepare mushroom chicken chunk heat tbsp olive oil pan add oyster mushroom let cook untouched yes 68 minute heat facing side golden brown turn around continue let cook untouched 34 minute season sprinkle sea salt remove heat serve soup topped oyster mushroom fresh dill garlic oil recipe make garlic oil add oil garlic small sauce pan simmer garlic stirring often golden transfer oil garlic bowl let cool store jar room temperature use top soup salad veg pasta,399.0,"[""'#veganchickensoup #allplants #veganuary #vegansofig #veganfoodshare #veganrecipe #veganuary #healthy\\xa0#healthyeating #teamgamechangers #gamechangers'"", ""'this look like a yummy and healthy and easy soup for u @nickfostermusic'"", ""'sounds and look delish '"", ""'oh wow this look amazing '"", ""'just cooked this for lunch. amazing '""]",allplants
rack rack rack stack stack stack dirtiest fry ever junkitupvegan fricken bomb as cajun wrap fuckin chef kiss mwaaahhh dirtyvegan veganuk ukvegan bombass kickass newcastlevegan vegannewcastle veganfood veganuary dirtyplants,67.0,"[""'eatin good '""]",allplants
carrot apple juice veg vegetarian glutenfree veganfood whatveganseat wholefood crueltyfree veganrecipes halal vegetarianrecipes juice carrot apple veganuary,23.0,[],allplants
cooking mode mushroom stroganof waiting rice cook came meat healthy reason dried porcini mushroom mushroomstroganoff vegetarianrecipes soulfood,1.0,[],allplants
cutie sippin good ol latte oat milk pic leaving country live study abroad today gonna miss mollls cant wait nourish cafe date whenever find time youre back love lady place much sfeats nourishcafe lunchdate buddhabowls nourishbowl eatyourveggies tastetherainbow chimichurririce pickledonions radish avocado psl vegansofig foodstagram prettyfood,70.0,"[""'love you kimmers '""]",allplants
sorry slack ive work much play go first video 2020 western bbq cheeseburger using beyondmeat pretzilla followyourheart alexiafoods smokin good stick figure,40.0,"[""'.\\n.\\n.\\n.\\n.\\n #whatveganseat #eatveganfood #veganfoodshare #veganfoodie #veganshare #veganaf #vegans #veganism #vegancommunity #veganlife #vgang #vegansofinstagram #vegansofig #vegansfoodlovers #eatvegan #noanimalsharmed #noanimalingredients #crueltyfree #mindfuleating \\xa0#govegan #allplants #veganburger'"", ""'jeeez!! yummm! it wa worth the wait'""]",allplants
here sneak peek official recipe booklet designed fun feasting fiesta mind try saying three time cant wait share limited edition copy give away first 10 people comment receive one post,138.0,"[""'#vegans #allplants #plantbased #recipe #vegancooking #veganrecipes #vegansofig #eatyourgreens #eatmoreveg #gogreen #fortheplanet #gamechangers #teamgamechangers'"", ""' i would love one too!!!'"", ""'me please '"", ""' yes please!'"", ""'not in the first 10 but i’ll give you a anyway. loving what you do. x'"", ""'too late for top ten but all plant so much '"", ""' great hearting all you lovely thangs '"", ""' this look so amazing!'""]",allplants
dinner night doesnt love breakfast dinner always somehow bowl organic oatmeal blueberry cashew yogurt freaking yum way ground flax seed omega 3 bunch necessary nutrient blueberry blackberry strawberry dose anthocyanins found deeplycolored fruit veggie whose compound activate antiinflammatory antiviral anticancer pathway back yogurt second good yogurt nearly impossible find cashew milkangles singing cashew cheese ice cream yogurt far superior way dairysupplement there killer brand called forager ive discovered whole food saw trader joes cashew yogurt decided give try excellent cultured yogurty taste nice consistency pick next time youre,31.0,"[""'#govegan #veganuary #veganyogurt #veganuary2020#plantbased #veganpower #plantstagram #veganfoodshare #meatless #dairyfree #ditchdairy #veganfortheanimals #cashewyogurt #veganfoodshare \\n#veganmom #plantbased #veganmomma #vegangirls #allplants'"", ""'this look so refreshing and delicious '""]",allplants
omega 3 important important omega family fat special body need eaten cannot produced fat 2 type omega omega 3 omega 6 oil used structurally body cell membrane well hormone regulation bone health much omega 6 found seed nut vegetable oil sunflower rapeseed etc necessary health excess become inflammatory example omega 6 fat linoleic arachidonic acid omega 3 fat antiinflammatory plant eg flax hemp form eat ala alpha linolenic acid oily fish wild meat epa dha fact brain tissue 60 fat dry weight mostly dha dha epa form human require must convert ala number stage become dha epa straightforward process u problem whilst milled flax seed flaxseed oil raise ala research show go increase dha epa significantly research suggests conversion well 10 mean flaxseed oil supplement may enough support nervous brain tissue problem 2 large number people genetic variation mean higher requirement omega 3 pufa gene solution honestly tricky measured lot people plant based vegetarian diet omega 3 omega 6 ratio result show easy resolve especially people plant base diet eating lot nut seed high omega 6 push ratio 3 solution essential take algal omega 3 form seems far better utilised body flax dha form must 2 people may still choose still take fish oil codliver oil prevent deficiency keep omega 3 omega 6 healthy range 3 use olive avocado coconut cooking avoid processed contain much vegetable oil use flax oil salad supplement,37.0,"[""'#plantbased #powerofplants #vegan #veganuary #plantpower #savetheplanet #allplants #veganforhealth #veganfortheplanet #veganuary2020 #organic #loveyourbody #sustainability #veganfood #veganrecipes #spiceupyourlife #vegannutritiom #eatwell #detoxtime #doitright #eatmoreplants #allplants #veganprotein #vweareveganuary #feed_me_momma'"", ""'great post"", ""knowing about omega 3 is so important!'"", ""'omega 3 change everything! so good'"", ""'love that it’s vegan'"", ""'oh"", ""mega! blessed it!'"", ""'great info - especially for vegans'"", ""'thank you for great and important info'"", ""'awesome post '""]",allplants
last meal week one win take longest cook definitely favourite aubergine moussaka,33.0,"[""'#aubergine #mousaka #veganmoussaka #allplants #plantbased #glutenfree #glutenfreevegan #veggies #eatvegan #eatmoreveggies #vegan #veganedinburgh #veganscotland #veganuk #plantbased #nutrition #nourish #wellness #wellbeing #health #veganhealth #veganuary2020 #mealplan #veganmealplan'"", ""'mind if i ask for a quick version of the recipe?'""]",allplants
see little space top thats air bubble nitrogen keep plant seed oil little capsule fresh capsule also cold sealed ingredient arent damaged sealing process omega blend prepared themoreyouknow omegablend skipthefish nofishoil technology omegas35679 healthhopevitality,4.0,[],allplants
beautiful budeli marinated feta yummy thing taurangafarmersmarket viridis grove breadheadnz,23.0,"[""'do they sell these olive at the markets?! they look so yummy'""]",allplants
ive got exciting news coming way anyone know might write guess comment watch story clue two dont worry youll recipe pasta soon here teaser pasta chickpea creaminess easier way follow recipe veganpasta creamypasta veganblogger creamysauce veganaf chickpeapasta easyrecipe veganrecipes chickpea veganuary2020 vegansofinstagram healthyvegan veganfoodblog nodiet veganfoodporn veganbowls easyrecipes thevegansofig thefeedfeedvegan vegansofig veganrecipeshare pastaholic eatvegan veganitalian veganfoodies veganlifestyle pastalover,677.0,"[""'don’t make u wait too long '"", ""'brand partnership ? this is mouthwatering! so creamy '"", ""'that creaminess literally drooling '"", ""'that creamy sauce is unbelievable '"", ""'so creamy '"", ""'omg creamy dreamy'"", ""'oh my gosh. this look so good '"", ""'wow!! very delicious'"", ""'whoa!!! look so yummy!!'"", ""'it look like an even better version of something i’d get at macaroni grill haha'"", ""'yaya!! i love new and exciting news btw this pasta '"", ""'that creaminess is on point girl!'"", '""excited to hear about the surprise! but in the meantime', 'i\'ll be happy dreaming of this lovely and creamy pasta dish yum!!! ""', ""'oo how delicious '"", ""'i’m so excited!! and wow oh wow this look delish'"", ""'looking good over there! i wonder what your exciting news could be? '"", ""'recipe video or a recipe book?'"", ""'a collaboration? pasta look yummy '"", ""'yumm everything look so good but those lentil in your story i’m thinking video or ebook?'"", ""'filmed step by step recipes!! would love to see them '"", ""'so many amazing flavors! '"", ""'the sauce in that pasta wow '"", ""'so creamy'"", ""'this look irresistible '"", ""'good luck whatever it is!'"", ""'wait what i wanna know '"", ""'this look wonderful anna! so creamy!'"", ""'looks so rich and creamy '"", ""'cashew alfredo?'"", ""'every time i eat pasta i remember you! i think that we are more italian than @aronicaandrea '"", ""'new business idea??'"", ""'are you opening a youtube channel?'"", ""'so creamy '"", ""'i have no idea but i hope you announce it soon'"", ""'creamy dreamy '"", ""'mmm this look divine '"", ""'yummy! this look so creamy'"", ""'yummm soo creammmy'"", ""'looks so creamy !'"", ""'this look so creamy and delicious!'"", ""'starting a partnership w/ a new brand?'"", ""'this look delicious!'"", ""'so creamy '"", ""'that creaminess is unreal!!'""]",allplants
bread butter name iconic duo maybe bread butter pudding favourite custard ice cream full recipe want great recipe like check back u tomorrow something extra sweet ingredient serf 68 base 10 thick slice quality dayold bread 3 tbsp butter 2 tsp cinnamon 2 tbsp sugar ½ tsp salt 150g dark grape smaller better ½ cup flaked almond top 2 tbsp maple syrup top custard 800ml milk 5 tbsp brown sugar maple syrup vanilla pod scraped tsp cinnamon ½ tsp cardamom ¼ tsp nutmeg 2 tbsp arrowroot ¼ tsp salt method preheat oven 180c start making base spread butter evenly onto 10 slice bread small bowl combine cinnamon sugar together mix spread mixture evenly onto buttered bread cut coated slice bread 2inch chunk transfer deep baking dish scatter grape evenly bread tucking bread chunk make custard combine milk brown sugar vanilla cinnamon cardamom nutmeg saucepan simmer reach simmer simmer 56 minute whisk arrowroot salt pour custard bread base top flaked almond let bread pudding sit 20 minute soak bake 3035 minute top golden grape bursting remove pudding oven brush maple syrup still warm let cool 10 minute tucking,246.0,"[""'#vegwithedge #allplants #breadandbutter #blueberries #vegan #vegansofig #veganuary #healthy #fortheplanet #foryourhealth #teamgamechangers #gamechangers'"", ""'i cannot wait to make this!'"", ""'oh my word my favourite pud plasticised - will make this asap'""]",allplants
omg im shook ive wanted try chickpea tuna made first time sorry taste exactly like tuna mayo except even better even flaky texture spot used hellmannsuk mayo lemon juice shredded half nori sheet using hand way would coriander make mum sister taste little lot co good share soz even agreed taste like tuna mayo eat fish meat dairy veg vegetarian glutenfree veganfood whatveganseat wholefood crueltyfree veganrecipes halal vegetarianrecipes chickpeatuna vegantuna nori veganmayo chickpea lemon veganuary,29.0,"[""'how doe it!!?!! i need this lol'""]",allplants
guy think amazing sandwich aubergine avocadobell pepper side healthy salad there sandwich inside first need aubergine cut half season salt splash olive oil pop oven 375 20 min tenderwhen ready remove skin excess water sievetransfer bowl add tbsp tahini paprika ground black peppergarlic powder 12 finely chopped red onion mash together potato masher go eggplant spread sandwichall need assemble sandwich favorite topping enjoy recipe visit facebook page aubergine panini paniniamerica healtyfood healtysnack veganlunch vegansandwich avocadotoast avocadosandwich vegetarianrecipes deliciosos foodfv freshly_vegans,40.0,"[""'delicious'""]",allplants
