captions,likes,comments,hashtag
halloumi gyro tonight sweet potato fry hello fresh menu sort meal id usually tasty filling slimmingworld slimmingworlduk slimmingworldjourney slimmingworldcommunity slimmingworlddinner fooddiary slimmingworlddiary weightloss,69.0,[],hellofresh
added new england clam chowder perfect cozy supper warm soul nationwide shipping free local delivery order loveablefoodcom lovablefood foodthatslovable sendlove infoodwetrust mealkits foodathome dinner dinnerathome chicagoeats charlotteeats nyceats bostoneats baltimoreeats dceats noreservations imsohungry cookmore eatwell fresh clamchowder newengland newenglandclamchowder delivery,26.0,[],hellofresh
last hellofreshuk meal week sweet sour style chicken bulgar wheat seen bulgar wheat thought hell honestly nicest thing ever nice change rice noodle cannot wait use hello fresh future need meal quick easy 624 45g protein,67.0,"[""'#hellofresh #meal #highprotein #chicken #caloriecounting'""]",hellofresh
steakhouse pork chop last night put together another dinner recipe new approach cooking pork chop first time done apartment seasoning great pairing potato green bean made perfect dinner foodiesofinstagram pork porkchop greanbeans potato homecooking cleveland goodeats,20.0,[],hellofresh
orange juice avamax l4l f4f likeforlike followforfollow like4like follow4follow instagood wcw sawg amazing cute instafollow instadaily instalike instamood instapic instapic instagram instafashion stylish liketime liker likesback likestyle instalove avatar photooftheday avamaxfanforever dayoff,54.0,[],hellofresh
halloumi gyro hellofreshuk 5 u freshfood homemade foodie fridaynightdinner foodiegram foodiesofinstagram foodielife foodiesofinsta hungry halloumi gyro,31.0,"[""'that look delicious'"", '""looks so tasty! i accept delivery\'s ""']",hellofresh
last hellofreshuk meal tonight bacon butternut squash risotto totally shouldnt put parsley tasted like earth followed gupuds salted carmal cheesecake risottobutternutsquashbaconhellofreshgusaltedcarmelcheesecake,12.0,[],hellofresh
chicken tikka taco dinner today foodpost instafood nefoodies foodblogger neeats lifestyle foodstagram foodphotography foodlover lfl love amazing ukfoodie ukfoodblogger photography foodiesofinstagram foodblog hellofreshuk taco chickentikka chickentikkatacos tikkatacos tacolover,42.0,"[""'they look great '""]",hellofresh
beef sloppy joes hellofreshuk foodphotography foodstagram foodblogger cooking cookingathome cook kitchen instagood instamood instadaily instagram insta instalike likeforlike likeforlikes love foodiesofinstagram foodblog foodpic art beautiful explore handmade igers inspiration lifestyle,20.0,[],hellofresh
yummy cooking handmade homesweethome decoration picoftheday bestoftheday love life dinner healthyfood instafood instagood instadaily instalike munich photooftheday amazing qualitytime beautiful,10.0,[],hellofresh
hello fresh lazyfitgirlmethode eetswitchen lazyfitgirldiner lazyfitgirl balans bewustgenietmoment,18.0,[],hellofresh
hellofreshuk second dish week sloppy joes hellofreshuk sloppyjoes fresh cooking delish yum foodinstagram ingredient recipe,13.0,[],hellofresh
hello fresh naked cheese burger 600 calorie calorie didnt miss burger bun cheese caramelised onion top yummy loved sweet potato wedge salad balsamic dressing ive really enjoyed week hello fresh recipe glad every rather every week 55 hellofeshuk hellofreshpics hellofreshsnaps hellofreshmeals hellofreshbox hellofreshfoodies hellofreshburger hellofreshcheeseburger nakedcheeseburger cheeseburger beefburger sweetpotatowedges balsamicsalad foodblogger foodbloggers foodstagram foodiesofinstagram ilovefood friday fridaydinner fridayburger pinkfizz dinner dinnertime friyay,201.0,"['""i really am quite sad you don\'t live with me ""', ""'this look divine '"", ""'love this one '""]",hellofresh
hellofreshuk sweet sour style chicken pepper bulgur wheat kept seeing one pop menu didnt really fancy think thought bulgur wheat wouldnt really go sweet sour butactually really glad ordered end really tasty enjoyed bulgur wheat definitely remakereally easy cook great friday night fakeaway youd like give try use discount linkcode bio get 20 1st box get discount thanks use ive found great especially lockdownlove make le supermarket trip also waste hellofreshuk hellofreshpics hellofreshsnaps mealbox fakeaway sweetandsourchicken sweetandsour redonion chicken greenpepper garlic cornflour ricevinegar ketjapmanis springonion vegetablestock bulgur bulgurwheat chinesestylefood easycooking cookingfromscratch mealideas homecooking lockdowncooking discountcode ukfoodie ukfood ukfoodblog fooddiary,288.0,"[""'snap! we’ve had a very similar meal to this tonight! friday fakeaway vibe '"", ""'this look so yummy! '"", ""'we had this last night really enjoyed it and not too sweet'"", ""'that look so good. '"", ""'had this a well"", ""enjoyed it!'"", ""'love a good asian meal'"", ""'looks like the perfect fakeaway'"", ""'great job'"", ""'this look so delish"", ""amazingly done my friend'"", ""'had exactly that meal tonight"", 'but have to admit', ""it wasnt very sweet and sour.... or what i traditionally think of s&s.'"", ""'this is so good '"", ""'this look so good'"", ""'looks really good!'""]",hellofresh
thaistyle pork rice bowl hellofreshuk epic 719 calorie im blue peter due camera user malfunction picture saveso here one made earlierin journey hellofreshuk hellofreshsnaps hellofreshpics hellofreshmeals fat fattofit fit fitfam fitness fitnessfamily fitnessjourney goal target ontrack weightloss weightlossjourney weightlossaccount weightlossmotivation weightlossgoals healthy healthyeating losingweight losingweightmyway cc caloriecounting caloriecountinguk caloriedeficit caloriecountingfooddiary myfitnesspaluk,38.0,"[""'gorgeous '"", ""'haha here one i made earlier this look so tasty '"", '""looks lush but i\'d want two portion ""', ""'this look so so good! '"", '""another\'s meal better than the photo ""']",hellofresh
tonight fakeaway hellofreshuk sweet sour chicken bulgar wheat yummy fakeaway healthyfood healthyeating lowcalorie weightlossjourney pregnant pregnancyfood slimmingworldpregnancy slimmingworld slimmingworlduk slimmingworldsupport slimmingworldjourney slimmingworldfood slimmingworlddiary slimmingworldrecipes slimmingworldfamily slimmingworldfollowers slimmingworldinspiration slimmingworldinsta slimmingworldmeals slimmingworldmafia slimmingworldlife slimmingworldmotivation,26.0,"[""'delicious '""]",hellofresh
aubergine uit de oven met casarecce tomaat oude kaas en salade made mila_de_ruyter_ aubergine casarecce tomaat oudekaas salade nomnom foodisalwaysgood mydaughteristhebest,8.0,[],hellofresh
hello fresh 4 lamb linguine courgette nice change beef mince 200g 15 lamb mince come 6 syns 3 per portion rest ingredient completely syn free left parmesan also added mushroom extra speed ive syns today happy using 3 tea going treat dairy free pudding happy friday swuk weightlossjourney diet dieting slimmingworldworks healthyeating loosingweight slimmingworldfamily foodoptimising weightloss lifestylechange eatwell eathealthy swfollow swuk slimmingworldjourney slimmingworldmeals slimmingworldlife slimmingworldmums swbreastfeeding postpartumdieting,20.0,[],hellofresh
hello cream cheese one 3 reviewed meal blog subscription hellofreshca_fr hellofreshca link bio,18.0,"[""'#mealplan #mealplans #mealplanmagic #mealprep #unboxing #unboxingfood #hellofresh #hellofreshpics #hellofreshlife #laviehellofresh #mealprepsubscription #vegetarianmealprep #veggiemealplan #veggieburger #veggieburgers #veggieburgerday #mushroomburger #mushroomburgers'"", ""'that burger look so good'""]",hellofresh
prawn pasta chargrilled courgette pasta finish week favourite indulgence,135.0,"[""'#hellofresh #hellofreshsnaps #hellofreshuk #pasta #pastalover #pastarecipe #pastaoftheday #foodie #foodblogger #seafood #seafoodpasta #prawns #shrimp #prawnpasta #foodiesofinstagram #linguine #italian #italianfood #fridaynight #fridayfeeling #fridaynightdinner #weekendmode #yum #foodiegram #pastaporn #foodporn #pastarecipes'""]",hellofresh
wwcommunity wwblueplan wweasymeal wwukrecipes wwfresh wwsuccessstories wwuk wwsupport wwsisterhood wwdinners wwbreakfasts wwlunches wwfamily wwonline wwfooddiary wwlifestyle weightlossjourney weightloss weightwatchersblue weightwatchers weightlossmotivation looseweight healthy motivation followforfollowback follower follow4followback followe follow4like,56.0,"[""'welcome back (in advance!) '""]",hellofresh
first week trying hello fresh pick wide range option including vegetarian easy throw everything together everything premeasured dish come instruction card youre fed old dish give try here 20 discount copy paste browser httpswwwhellofreshcoukpagesraf_lp11 code work worldwide sponsored every time code used get heavily discounted box 3 meal 2 611 discount moneysaving dinner tea saving discount deal offer shopping grocery diet healthy avocado salad coupon,14.0,[],hellofresh
e gibt wieder fisch freitag heute fischfilet seehecht nach art bordelaise mit kartoffelstampf und gurkensalat und jogurtdip ich wünsche euch ein schönes wochenende morgen gibt e mal wieder vom grill there fish friday today fish fillet hake style bordelaise mashed potato cucumber salad yogurt dip wish nice weekend tomorrow something grill lecker yummy tasty foodblogger foodpictures foodlover foodlove instafood fisch frisch seehecht freitaggibtsfisch cooking homecooking kochen wochenende weekend goodfood gutenappetit bonappétit dinner unbezahlte werbungwegenmarkennennung stayathomeandcook bleibtgesund,178.0,"[""'that look absolutely delicious for fish friday’s and a nice touch with cucumber salad'""]",hellofresh
crispy chicken breast mushroom vin sauce roasted carrot garlic mash super tasty weightloss hellofreshuk weightlossjourney weightlossdiary losingweight losingweightjourney losingweightfeelinggreat,16.0,"[""'wow all those veggie '"", ""'ohhh inspired!!! '""]",hellofresh
cheesy chorizo crusted cod roast potato asparagus aioli check bio discount code hellofreshuk hellofreshdiscount homecooking,4.0,[],hellofresh
chicken tikka taco im glad saved meal friday night dinner also cant believe havent thought make mix together tikka paste ff yoghurt chicken thigh piece putting grill meanwhile fry verylazyfooduk garlic spring onion tikka paste add kidney bean splash water chicken stock powder leave simmer slightly mash heat tortilla layering mix lettuce chicken tikka piece yoghurt 740cals per portion served extra treat halloumi cheshirefarm potato cube pr product dinnertime fakeaway caloriecounting healthylifestyle healthyfood chicken dinnerideas taco chickentacos foodphotography caloriedeficit weekend fridaynightdinner homemade caloriecountinguk carbs cheese chickentikka chickenideas taco takeaway weightlossjourney mealideas familymeals easymeals,290.0,"[""'just wiping my drool up '"", ""'omg these look sooo good '"", ""'ultimate friday night dinner '"", ""'wow this look beaut '"", ""'saved this one so i can make it next weekend '"", ""'such a lush idea '"", ""'gorgeous '"", ""'lovely stuff '"", ""'this is incredible"", ""i want to eat in your house'""]",hellofresh
glo always bringing freshness send u dm well hook organicproducedelivery organic greenlite greenliteorganics charlestonsc chs charlestondaily producedelivery freshveggies veggie lowcountryliving eatfresh vegetablesofinstagram charleston charlestonlife farmersmarkets thingstodoincharleston chucktown chucktownfoodie charlestonfitness,0.0,[],hellofresh
feeling inspired friend mj made file recipe tried tested even made little section front recipe week cooking laminated wipeable love new folder recipe laminated,0.0,[],hellofresh
refried bean halloumi taco chipotle mayo check bio discount code hellofreshuk hellofreshdiscount homecooking,6.0,[],hellofresh
today hellofreshuk offering tasty stir fry pork green bean,10.0,[],hellofresh
indian spiced lamb naan tomato salad yoghurt sauce crispy chip check bio discount code hellofreshuk hellofreshdiscount homecooking,3.0,[],hellofresh
thanks neighbour care packageit deeeeelicious firsttime verytasty highlyrecommended,83.0,[],hellofresh
goat cheese walnut caramelised onion filo parcel asparagus herby sweet potato creamed spinach check bio discount code hellofreshdiscount hellofreshuk homecooking,4.0,[],hellofresh
speedy sausage pasta,3.0,[],hellofresh
creamy garlic chilli prawn pasta bloody divine say first marinated prawn olive oil paprika chilli powder garlic powder onion powder salt pepper fried chopped onion mushroom little bit oil translucent meanwhile boil choice pasta cooked used spaghetti add chilli garlic frying pan fry minute add prawn cook minute theyre pink add one tablespoon philadelphia_uki lightest garlic herb soft cheese tablespoon double cream tablespoon pasta water loosen mix parmesan simmer couple minute pasta ready add sauce mix together season well salt pepper parsley served mine watercress spinach rocket balsamic glaze topped crispy onion ____________________________________________________________ caloriecounting caloriecountinguk weightlossjourney fitnessmotivation trainedbycb courtneyblackapp courtneyblack selflove instagood progress transformation healthyliving determination fitnessjourney inspire february fitbit 2021 mfp myfitnesspal slimmingworld weightwatchers ww sw swuk barefootwine hellofreshuk,31.0,[],hellofresh
wait youve never done,52.0,"[""'#vegantravel #plasticfree #toastporn #avocado #avocadotoast #avocadolove #avocadoporn #fig #eatyourfruits #eatfruits #fruityourself #eatyourcolors #eattherainbow #eatvegan #eatplants #ieatplants #foodstyle #edibleart #inspiremyinstagram #beautifulcuisines #sorrynotsorry #hellofresh #worldveganmonth #vegansofinstagram #whyvegan #vegan #hotforfood #govegan #veganmeal #vegansofig'"", ""'i’m sorry"", ""is this a vegan page or a political page ? cuz a girl need to know'"", '""why the vegan hashtags i\'m so confused ""']",hellofresh
chili cheese smoky sausage bacon jam fry slaw check bio discount code hellofreshdiscount hellofreshuk homecooking,3.0,[],hellofresh
bulgogli tofu bok choi spring onion sesame seed favourite tofu dinner date hellofreshuk honestly cannot wait recreate veganism veganstudent vegandinner hellofreshvegan veganuk veganfood veganfooduk veganrecipes veganlife veganinstaclub vegansofig,83.0,[],hellofresh
honey glazed chicken flatbread sweet potato feta wedge harissa veg check bio discount code hellofreshdiscount hellofreshuk homecooking,4.0,[],hellofresh
smokey bbq chicken black bean loaded wedge hellofreshuk 664 calorie oknot one would order hurry hellofreshuk hellofreshpics hellofreshlife caloriecounting caloriecountinguk caloriedeficit weightloss weightlossjourney weightlossmotivation,8.0,[],hellofresh
chicken fajita taco bowl street corn feta potato wedgescheck bio discount code homecooking hellofreshuk hellofreshdiscount,4.0,[],hellofresh
lamb linguine courgette quick easy tasty foodlover meal hellofreshpics hellofreshuk,5.0,[],hellofresh
halloumi pepper sweetcorn taco chipotle mayo check bio discount code hellofreshdiscount hellofreshuk homecooking,5.0,[],hellofresh
teriyaki chicken rice foodlover happyfriday lovecooking,3.0,[],hellofresh
well le light close tasty foodlove tortelli pasta spinach freshpepper foodbox,10.0,[],hellofresh
creamy goat cheese risotto roasted asparagus crispy sage toasted pine nut check bio discount code hellofreshdiscount hellofreshuk homecooking,4.0,[],hellofresh
another amazing meal last night hellofreshuk terriyaki tofu rice bowl pickled radish sesame cucumber amazing havent given little box heaven go waiting super yummy super convenient veggie vegetarian yummy easypeasy terriyaki ricebowl,7.0,[],hellofresh
friyay helloweekend fridaydinner fisch fishfordinner gemuse lecker yum deliciousfood foodpic instadaily picoftheday kochen inmeinerkuche aufmeinemteller healthyfood healthy,44.0,[],hellofresh
lamb kofta kebab garlicky naan zahtar sweet potato friescheck bio discount code hellofreshdiscount hellofreshuk homecooking,3.0,[],hellofresh
weightloss heathlyeating weightlossjourney weightlossmotivation weightlossinspiration hellofreshpics foodpics motivation selflove mumsofinstagramuk mum mumlife toddlermum mumssupportingmums,24.0,[],hellofresh
roasted veg lentil jumble feta toasted almond herby drizzle check bio discount code hellofreshdiscount hellofreshuk homecooking,1.0,[],hellofresh
seehecht mit senfkruste gurkensalat dilldipp und kartoffelstampf seehecht ist toll fisch seehecht dill foodlover foodblogger foodphotography kochen,7.0,[],hellofresh
triple tier chorizo three cheese taco stack avocado tomato salsa zesty soured cream check bio discount code hellofreshuk homecooking hellofreshdiscount,2.0,[],hellofresh
friday night dinner sloppy joes guacamole lawofattraction perfecteddesire creator recoverhappy mindset love health manifestation worthy beauty pinkhairdontcare 40club friendship positivevibes home kineticbelief happy appreciation gratitude yes motivation abundantlife,9.0,[],hellofresh
looking forward lunch,4.0,[],hellofresh
da wochenende startet ganz lecker schweinefilet mit basilikumpesto bohnen kartoffel und senfsahnesoße soulfood foodlover foodphotography foodstagram footinsparation cooking homemade foodblogger foodpics essen leckeressen healthyfood taste cookidoo cookingathome cookwithlove baking basic deutschland frankfurt onlyhobby eathealthy eatrealfood eatfresh dinner pork attention unpaid advertising recommendation link account brand device place person etc pic katjes_kirsche_ffm,77.0,[],hellofresh
middle eastern steak rice pilaf tzatziki sauce smokey roasted veggie 30 minute meal tossed sliced carrot zucchini l l large drizzle olive oil salt 2 tsp smoked paprika roasted 22 minute 425 used 2 zucchini 6 large carrot 30minutemeal whatsfordinner steak middlessternflavour eat yummy ctfoodie foodiesofinstagram nytimescooking foodnetwork gobaleats foodloverheaven1 foodlovers buzzfeedfood thewoodenspoontable,260.0,"[""'wow..sooo delicious '"", ""'those flavor sound great!'"", ""'this look so tempting'"", ""'wow this is awesome '"", ""'wow this is so amazing'"", ""'it look fabulous '"", ""'wow..this is so tempting '"", ""'this is absolutely delicious and tempting'"", ""'looks delicious gorgeous shot'"", '""that\'s really so amazing""', ""'this look so awesome spread '"", ""'this look amazing '"", ""'i would dig right into that!!! '"", ""'this is so good'"", ""'looking so delicious and tasty'"", ""' this look really delicious'"", ""'soo delicious nd sound awesome'"", ""'this seems so delicious!'"", '""wow that\'s really good""', ""'it look so delicious '"", ""'wow very very awesome'"", ""'perfect'"", ""'looks so perfect'"", ""'arey wah.. this look so good captured perfectly'"", ""'wow.. look soo delicious'"", ""'this is too good'"", ""'it look so delicious '"", ""'yes"", ""please '"", ""'looks absolutely delicious'"", ""'the addition of tzatziki and almond bringing those rich"", 'earthy', ""smoky flavor together...divine!! '"", ""'this is so amazing'"", ""'looks wonderful! love the almond on top too '"", ""'this look amazing '"", ""'ohh this plate of food look so good!'"", ""'nice check out my page too and follow if you like it'"", ""'this is really good'""]",hellofresh
chicken fajita,6.0,[],hellofresh
last hello fresh meal week 817 calorie meal slightly higher calorie rest went u favourite absolutely really recommend anyone hellofreshpics hellofreshsnaps caloriecounting caloriedeficit caloriedeficitdiet,16.0,[],hellofresh
szechuan pork green bean stir fry candied peanut jasmine rice hit spot winter meal warmed u right cold night healthycookingtogether wintermeals dinnerlastnight whatsfordinner newrecipe asianrecipes savoryfood realfood meatandveggies,2.0,[],hellofresh
käsespätzle spinach bacon bear onion cookingwithlove cookingathome selfmadefood,5.0,[],hellofresh
heute kocht sofiahellofresh,26.0,[],hellofresh
hello fresh thaifood pork spicy,13.0,"[""'looks lovely that xx'""]",hellofresh
spicy korean meatball molly made last night absolutely,15.0,"[""'#sony #sonyphotography #sonyalpha #sonya6100 #a6100 #foodphotography #food #meatballs #hellofresh #hellofreshpics #dinner #foodstagram'"", ""'this is in my box this week!!!'""]",hellofresh
linguine bacon creamsaucebroccoli tomato parmesan hellofreshde pasta linguine tomato broccoli noodle nudeln eatfesh easymeal tasty yumm foodhism homemadefood homecook dinner quickandeasyfood chef foodblog foodgasm syllovescooking hausgemacht healthyfood foodpic blogger,153.0,"[""'delicious '""]",hellofresh
surprise new episode one test hello fresh discus feeling matthew broderick give life lesson click link bio,19.0,"[""'#drunk #drunkchef #hellofresh #food #cook #cooking #cookingathome #meatballs #chef #cheflife #chefsofinstagram #chefs #cookingvideos #cookingwithlove'"", ""'love that screenshot lol'""]",hellofresh
tried hello fresh week taste bud disappointed swipe good eats order pictured italian veggie soup bruschetta chicken thai coconut curry chicken apricot chickpea tagine foodiefriday weeklyeats foodiesofinstagram goodfood fridayfeeling friyay fridayvibes fridaymood foodphotography foodstagram yummyfood neweats healthyfood nourish eatgoodfeelgood raleighnc foodlover hellofreshpics getinmybelly,13.0,"[""'yummy! these look like restaurant-quality dish '"", ""'we love hello fresh! a huge hit in our home!'""]",hellofresh
day 26 unit utility room started bridetobe weddingdiet omad intermittentfasting wedding diet slimmingworld weightloss sw sheddingforthewedding shreddingforthewedding bride august2021 coronabride posponedwedding mealideas recipe foodphotography homecook kitchen homedecor newkitchen wickeskitchen hometransformation kitchentransformation,23.0,[],hellofresh
tonight menue 3 5 hellofreshdanmark cajun chicken mashed sweet potato foodspam instafood readysetgo yummy yummyfood yummyinmytummy goodfoods goodfood goodfoodlover foodphotography,29.0,[],hellofresh
werbung da markennennung maxitortelli mit ricottafüllung käsespinatsoße mit champignons hellofreshde hellofreshdeutschland hellofreshpics healthy healthyfood gesundekuche foodphotography foodlover foodstagram foodblogger foodpic foodpics,26.0,[],hellofresh
rote beete tarte und feldsalat hellofreshyummytasty,16.0,[],hellofresh
north texas bank distribute 25000 meal kit truckloads meal kit ready distributed ntfb hungry north texan grappling pandemic historic winter weather thanks donation delivery arm grand husky logistics north texas bank received one significant donation year 150 pallet hello fresh box equivalent approximately 25000 meal kit coming critical moment north texas nearly 900000 north texan insecurity winter storm exacerbated issue family working keep table heat home grapple plumbing issue due intense cold north texas bank feeding network member agency distribute saturday february 20 via ntfb mobile pantry program someone know need ntfb added two distribution scheduled saturday february 20 help provide community muchneeded relief saturday february 20 unt dallas 3 pm 7300 university hill blvd dallas tx 75241 grace church plano 24 pm 3301 preston road plano tx 75093 ntfb recruiting volunteer help momentous effort contact wwwntfborgvolunteer texascoldfront texascrisis foodpantry texasfoodpantries northtexasfoodbank unt gracechurch northtexas ntfb pandemic urbanartistmarket,4.0,[],hellofresh
louisianastyle tilapia wslaw potato wedgie topped remoulade nom nomnom tilapia fish getinmybelly,7.0,[],hellofresh
pasta nach carbonara art mit bacon brokkoli und kirschtomaten pastacarbonara bacon brokkoli cookgirl kirschtomaten healthyfood croatiangirlingermanworld cookgirl like yummy yummytomytummy,8.0,[],hellofresh
mexikanischer hahnchensalat mit avocado instagood instafood foodstagram foodphotography foodgasm follow yummy picoftheday photooftheday foodblogger love hahnchen thermomix thermomixrezepte chicken mexicanfood essen mahlzeit leckeressen superfood superfoods salat hellofreshpics,13.0,[],hellofresh
piripiri chicken oven roasted potato salad recipe hellofreshnl hellofreshnl yummy dinnertime easydinner,86.0,"[""'looks so much better than the picture!! your food always look amazing '""]",hellofresh
ne manquez pa no ventes du weekend sur lesventesca dont miss sale weekend allsalesca allsales lesventes weekend shop shopping deal sale discount lenfantillon patpat montval lequipeur truculture sarahpacini bonprixelectromenagers fragrancex nhsalvage guessfactory lacoste megaventedentrepot acer jigsawjungle,5.0,"[""'collab dm @vootty.official '""]",hellofresh
late lunch quesadilla side salad hellofreshlife hellofreshsnapsveggie,13.0,[],hellofresh
know 2020 2021 tough lot people wanted share product service really made daytoday past year enjoyable link video bio linked many product could video description box quarantinelife quarantinefavorites masterclass fabfitfun makeuperaser tulaeyebalm builtbar imbuilt traderjoes miopod heatingpad whitneysimmons emkfit livingproof paulaschoice sarahjmaas splice origin,44.0,"[""'i trully support their bar for this.'"", ""'gorgeous'""]",hellofresh
lil guy made proud last night cooked amazing cheese burger u helped clean kitchen even packed lunch today lovemyboy parenting,43.0,"[""' cutie! but seriously"", ""those burger were good! '""]",hellofresh
vietnamesische fleischbällchen mit limettenreis und sweet chili salat hellofreshde meatball teriyaki sweetchili carrot cucumber rice lime limerice beef meat vegetable chili sesame vietnamese asian cooking homecook foodstagram instafood goodfood ginger freshcooking homemade homemadefood quarantine,34.0,[],hellofresh
came duuuuuuliiish herb parsley chive greatid added basil hand otherwise change bon appétit,24.0,"[""'this look delicious.'""]",hellofresh
