captions,likes,comments,hashtag
banging brunch kick new year could better get ingredient ready get ready enjoy here need potato rostis 4 large potato around 600g yellow onion ½ tsp salt tsp cumin ¼ tsp pepper 3 tbsp olive oil fry green cannellinibean dip 400g cooked cannellini bean tin ½ cup cooked pea tbsp olive oil tbsp tahini ½ tsp salt lemon juiced 25g mixed herb used coriander mint ¼ cup water dressing 2 tbsp yoghurt ½ tsp grainy mustard tsp apple cider vinegar tbsp maple syrup 2 tbsp olive oil ¼ tsp salt serve 2 avocado 1015 cherry tomato 4 slice rye bread method make potato rostis grate potato onion box grater colander placed bowl season salt let sit 15 minute squeeze potato onion excess liquid transfer bowl add cumin pepper mix heat oil nonstick pan medium heat heat use hand form small patty grated potato transfer pan cook around 4 time letting cook around 10 minute time golden side transfer dish lined kitchen roll repeat rest rostis make cannellini bean dip add cannellini bean pea olive oil tahini salt lemon juice herb water processor blender blend high 23 minute smooth creamy taste salt adjust taste make dressing add yoghurt mustard apple cider vinegar maple syrup olive oil salt small bowl mix fully combined taste saltaciditysweetness adjust taste slice avocado quarter toast bread slice cherry tomato build dish starting dip followed 2 potato rostis avocado bread cherry tomato dressing sprinkle zataar favourite seedsnutsspices note dish also make great savoury sandwich put filling crusty bread breakfast sandwich actually want eat,221.0,"[""'#allplants #brunch #veganbrunch #veganswhobrunch #tasty #foodies #veganrecipe #vegannewyear #veganuary #vegeasy #plantbased #tryvegan #teamgamechangers #gamechangers'"", ""'@thebeautyloungeoakley'"", ""'that dish look and sound banging! '"", ""'i need to make these '"", ""'@makingmagicmomentz can we do this at the weekend?'"", ""'need to try '"", ""'@catmaher84 you should follow! this look insane!'"", ""'need to try this !!'""]",allplants
christmas trifle layered agar agar rasberry jelly almond milk custard home made vanilla sponge sherry fresh cherry topped coconut cream fresh raspberry roasted hazelnut veganchristmasdinner govegan kindchristmas loveanimals gogreen,28.0,[],allplants
top 9 2019 africanbiomineralbalance drsebi alkalineeclectic rawalkalineeclectic plantonlylifestyle topnine topnine2019 thankyouforallthelikes,86.0,"[""'love the squash bread and walnut tuna'"", ""'hi do you have the pepperoni recipe listed anywhere'""]",allplants
bowl full goodness corn tomato salad red orange pepper broccoli kale parsley black bean spicy hummus bed quinoa healthyeats omnomnom wfpb somuchfiber,16.0,[],allplants
goody shirt christmas arrived brother family california thank juni_eagle lynntek ageeeeling jilllovespans,28.0,"[""'.\\n.\\n.\\n.\\n.\\n #whatveganseat #eatveganfood #veganfoodshare #veganfoodie #veganshare #veganaf #vegans #veganism #vegancommunity #veganlife #vgang #vegansofinstagram #vegansofig #vegansfoodlovers #eatvegan #noanimalsharmed #noanimalingredients #crueltyfree #mindfuleating \\xa0#govegan #allplants #vegantreats #sustainability'"", ""' nice i mailed mine today .'""]",allplants
chicken hell yeah plant based nandos disclaimer make skinny may missing luxury life nandos bag quorn cooked bag red pepper 30 min hellman mayo spinach tomato jalepeno cheese melted fresh lemon fresh lime squeezed inside whole wrap sweet potato roasted paprika chilli flavour taste sensatiooooon vegannandos nandos nandosperiperi notchicken veganmealprep eatingin plantpower poweredbyplants powerupwithplants nutrition nutritioncoach nutritioncoaching onlinecoaching tastyfood instafood instafood veganmealprep veganrecipes plantbaseddinner diet 2019 instagram picoftheday pic foodpornography plantbaseddiet,37.0,"[""'i follow a vegetarian meal plan from time to time so i’m curious what is a nando?'""]",allplants
incredibly creative cuisine dirtcandynyc vegansofig vegannewyear govegan eatmoreplants eatyourcolors eatmoreveg veganfood vegancreation veganpower plantfueled veggie dirtcandy nyc manhattan vegannight vegancuisine whatveganseat eatvegan crueltyfree vegannyc moistplants spreadthemoisture,45.0,"[""'that all look amazing '"", ""'looks pretty good!!! '""]",allplants
bún salad ginger tofu five river coffee co vermicelli noodle salad pickled veg cucumber mint coriander spring onion crispy shallot black sesame seed nuoc cham dressing served ginger tofu veganeatssheffieldvegansheffieldveganeatsveganveganfoodveganfoodsharesheffieldvegansheffieldveganfoodwhatveganseatyesitsveganplantbasedallplantssheffieldissuperhealthiswealth fiveriversvietnameseveganveganvietnamesevermicellivermicellinoodlesbunsaladtofugingertofuvegansaladnuocchamnamsongpickledvegnoodlesaladfeedfeedveganwholefoodplantbasedwfpb,171.0,"[""'delicious'"", '""that\'s the color of health ""']",allplants
tamanu balm used reduce scarring wow look difference lord alan sugar scar amazing mum us rodent ulcer scar use dry winter lip many beneficial us wwwtropicskincarecomgaynorcamacho lord_sugar tamanuoil reducescars naturalremedies skincare carbonneutral lovetropic,2.0,[],allplants
beautiful thiccc homemade biang biang noodle diet basically consisted holiday period mushroom black bean sauce chilli garlic oil splash flavoured,34.0,"[""'that look awesome! '""]",allplants
longing cup kelava goodness travel thanks gerai malaysian urban eatery get departure hall subang skypark terminal sultan abdul aziz shah airport,29.0,"[""'#kelavamy #klv #icecream #homemade #coconuticecream #plantbased #dairyfree #nondairy #allplants #vegan #veganicecream #consciousliving #subangairport'"", ""'so exciting - to see vegan good in many place ... spread the love -'""]",allplants
christmas2019 christmastree naturalchristmasdecor wowfeeling travelwithsoni,5.0,[],allplants
curious psychedelic plant yes pretty neat yet ever imagined working common plant multidimensional way ever felt drawn specific plant knowing ever found talking flower tree find wondering medicinal property plant wonder develop intuition exploring plant world ive spent life wondering thing discovered ability truly listen connect plant kingdom take time listen many plant waiting whole life u start talking help u help thrive relationship plant cocreative beautiful partnership restores harmony within u help planet beyond measure used think psychotropic plant could take higher level consciousness ha ha started developing relationship common plant journeying realized ordinary plant incredibly psychedelic incredible being mentorship im offering 2020 container deepen intuition working plant meet 2 day month dive deeply spirit realm plant group atmosphere classroom outside fireside day amongst 75 acre carolinian forest next year third year running folk herbalism gaian mentorship gaia hive near dundas ontario hour toronto check wwwjuliegaiaca year outline join living school plant connection wisdom 7 space left weekday group foto 2019 student connecting sacred tobacco amongst late tulsi pawpaw patch grow first people land honour flourish teach plant medicine connect first people may work rainbow bridge much love dundas ontario canada evolve herbalism,51.0,"[""'#allplants are #teachers'"", ""'awesome post. when i started learning about plant"", 'everything became very abundant. there are so many thing growing in my own backyard or the wood near my house that i never knew were edible or medicinal. i started with learning about mushroom', 'and finding plant wa the next natural step. they are both amazing and all mushroom (even the non psychedelic kinds) have a very clarifying energy. even the way they grow (reminiscent of the neural network) implies they are amazing medicine for all being love what you are offering in your program', ""i wish i wa closer to canada!'""]",allplants
living food first hot noodle next dish like pair probiotic bean burrito dehydrated green pea tortilla cultured nut cheese jalapeño purée followed sautéed rice noodle sausage baked garlic clove,305.0,"[""'#macadamia #greenpeas #probiotic #livingfoods #hotnoodles #allplants #egan #plantbased #restaurant #losangeleseats #tryvegan'"", ""'we love the ito burrito"", 'cali roll', 'raw soup', 'salad', 'raw pizza', 'durian', ""and all the raw dish '"", ""'i miss you guy so much! this made me hungry and happy. definitely need to remedy this and visit soon '"", ""'can you make the burrito without hot peppers?'""]",allplants
yummy deliciousness coconut spiced lentil spinach chickpea spicy herby potato slaw glutenfree happytummy meatfree fitfood,9.0,"[""'where are those recipe from'""]",allplants
pretty untypical sunday even went gym morning skipping beyond burger avocado toast instead using ezekiel 49 bread amyskitchen lentil soup good feel good healthyvegan vegan2020,48.0,"[""'.\\n.\\n.\\n.\\n.\\n #whatveganseat #eatveganfood #veganfoodshare #veganfoodie #veganshare #veganaf #vegans #veganism #vegancommunity #veganlife #vgang #vegansofinstagram #vegansofig #vegansfoodlovers #eatvegan #noanimalsharmed #noanimalingredients #crueltyfree #mindfuleating \\xa0#govegan #allplants #avocadotoast lentilsoup #vegan'"", ""'looks so yummy '"", ""'i hear yah about cleanin it back up. this holiday i ate so much (delicious) vegan junk food that i think i might turn into a block of soy cheese '""]",allplants
bringing discipline back 2020 better choice ezekiel bread foodforlifebaking bread ate back 2012 went slew bread hit shelf irresponsible ingredient like sugar believe ive capitalized know im consuming regular basis think time push reset bring 2012 whole plant based forksoverknives engine2 kinda living bread job definitely gotta toast usually dont announce goal believe always move silence speak time say check mate post epic let bring health sexy back 2020 ezekiel 49 take also unto thee wheat barley bean lentil millet spelt put one vessel make bread govegan healthyvegan,44.0,"[""'.\\n.\\n.\\n.\\n.\\n #whatveganseat #eatveganfood #veganfoodshare #veganfoodie #veganshare #veganaf #vegans #veganism #vegancommunity #veganlife #vgang #vegansofinstagram #vegansofig #vegansfoodlovers #eatvegan #noanimalsharmed #noanimalingredients #crueltyfree #mindfuleating \\xa0#govegan #allplants #veganbread #ezekielbread'"", ""'if you can find it"", ""alvarado street bakery’s sprouted wheat is really good.'"", ""'right there with you!! gardein and morning star better chill this year '""]",allplants
health planet tastebud take veganuary twist challenge pure plant throughout january two day week even going two day week massively help reduce carbon footprint thinking giving go let u know,113.0,"[""'#allplants #allplantschallenge #veganuary #plantbased #tryvegan #eatyourgreens #vegans #veganish #vegansofldn #vegansofig #fortheplanet #tackleclimatechange #teamgamechangers #gamechangers'"", ""'@allplants could you please provide macro breakdown of all your meals'"", ""'@allplants hi"", 'is there a possibility for ordering le than 6 meal ? i would really love ordering from you but 6 is too much for me..! why couldn’t we choose to have between 4 to 6 meal for example ? it would be more appropriate to everyone. well', ""just to let you know that i love what you do but this is the only issue i have before ordering from you. '"", ""'started on my vegan journey today '""]",allplants
sister bought microwave holiday able keep one coming house since move last july thought bit influencenope cost 200 idea microwave cost much moved equipment would convenient roommate use le le interested preparing 2 separate meal sister eats standard diet im minding business focusing everyday choice nothing else africanbiomineralbalance drsebi nomicrowave plantonly rawfood dissapointment alkalineeclectic ihavenoinfluence,208.0,"[""'@successismyfather is your sister ok just wait untill she get sick then you can guide her most peopel have to get sick before they wise up '"", ""'not today satan. lol since 2013 #toasterovergang'"", ""'i sometimes can’t believe people still use a microwave \\u200d'"", ""'can’t save them all'"", ""'i just got rid of mine and replaced with air fryer/toaster oven for same amount of money. my son gave it to me '"", '""love that you posted. it\'s not easy to beat your own drum when others are playing a different rhythm. ""', '""i feel u. that\'s where i\'m at now. they always complaining about their different health issues. i try to help', 'educate', 'show', 'research', 'and prepare thing for them to feel better. to let them know they are in control', 'and their problem are fixable but it\'s all just wasted time and energy on my part. so i\'m done. i\'m do me and what\'s best for me and let them continue on their own ways.""', ""'well all you can do is help when they ask for it. in the meantime save $$ and look for a private space of your own.'"", ""'i understand this girl all you can do is take care of yourself and educate the best you can \\u200d'"", '""do what you have to love. in my country there is a old saying that say you can take a horse to the well but you cant force it to drink water. just ensure your not in the kitchen when they are using it. that\'s the best you can do.""', ""'as u should. also they should be very careful with a microwave on a metal rack. just doesn’t seem safe with an already comprising choice of using said microwave'"", ""'that’s called harmony and every cell in your body will be in sync with that harmony '"", ""' it take a whole nother level of mindset to stay focused when other people are apathetic towards their diet and may never change..'"", ""'there’s nothing left to do besides remain peaceful within yourself. i know how disappointing it can be to be such a great example to others and watch them reject it.'"", ""'i feel the same way about my 89 yr old grandmother. i tried i even included her in my alkaline dinners. she us the microwave daily and eats crap all day long so i gave up. i told her if she would just try for 30 day she would feel better and could reverse her parkensons diease. you cant help those who dont want to be helped....'"", '""you are so correct. no matter how great the result are it\'s challenging for others to get onboard. it\'s challenging for those who are still trying to eat alkaline when around those who do not .""', ""'#fuckmicrowaves'"", ""'you should move your water we don’t know... u know \\u200d'"", ""' good for you!! we out here support your choice to be and eat alkaline!!'"", ""'@successismyfather do not be discouraged"", ""we do have influence. it take time but my son and mother are slowly picking it up some good eating habit from me.. it get lonely at the top for a bit but they do come around. thank you for posting.'""]",allplants
alocassia reginae alocasia alocasiareginae aroidaddictindonesia aroidadicts houseplantsofinstagram houseplantclub houseplant jualtanamanhiasmurah tanamankekinian tanamanbikinhepi seller plantshopinginstagram plantmakepeoplehappy plantseller rama_nursery,56.0,[],allplants
cutie definitely know enjoy sunday,34.0,"[""'#kelavamy #rgbcoffee #klv #icecream #coconuticecream #plantbased #dairyfree #nondairy #allplants #homemade #vegan #veganicecream #madeinmalaysia #cafekl'""]",allplants
open excited launch new year flavor coming week stay tuned veganuary allreal allgood,372.0,"[""' the best flavor '"", ""'@sammyyvieiraa yeaaaaah so next time you stop in to nh i’ll need to to bring some ice cream... '""]",allplants
2 day everything better way kick gt plantbasedmag glasgow come minibreak gin inflightentertainment glasgow glasgowvegan,16.0,[],allplants
cheese onion toastie crunchy cali slaw bosh,13.0,[],allplants
weekend waffle aka new hangover cure master new year day thank later oh p theyre gluten free use batter pancake here need waffle 300g silken tofu 100ml plant milk 3 tbsp olive oil 130g gluten free flour tbsp sugar tsp baking powder 14 tsp salt vanilla cashew cream 12 cup raw cashew soaked 23 hour 100 ml water 2 tbsp maple syrup 2 vanilla bean scraped pinch salt method make waffle start combining tofu milk olive oil blender blend high around 30 second smooth creamy transfer mixture bowl add flour sugar baking powder salt mix lightly combined heat waffle iron according instruction brush little olive coconut oil onto pour ladlefull batter waffle iron around 34 way full cook waffle golden 34 minute repeat rest batter make cashew cream combined soaked cashew water maple syrup vanilla salt blender mix high 34 minute completely smooth serve waffle topped couple spoonful cashew cream maple syrup fruit,225.0,"[""'#allplants #waffles #pancakes #glutenfree #glutenfreebaking #glutenfreecooking #veganrecipes #glutenfreevegan #vegansofig #recipes #foodies #veganwaffles #veganfoodshare #teamgamechangers #gamechangers'""]",allplants
raining la shout daikokuya_ramen bomb option noods lol sendnoods ramenlover veganramen daikokuya arigatogozaimasu laeats montereypark raininginla slurpingnoodles hotandsteamy vegansofig datenight christmastime happyholidays ramenislife veganramen noodsnoodsnoods,49.0,"[""'hey leanbeanmakingmachine"", ""just had a quick question if you don’t mind. would you dm our main account @bohoseventy thanks!'""]",allplants
much one roll lunchyumhealthyallplantsveganfetaavacadolettucecucumbertomatopurpleoniontastylunchtimefoodpornfooddeliciouscleanfresh,14.0,[],allplants
tomorrow lunch prep yummy lunchprep sabbathlunch foodthatgiveslife gratitude,5.0,[],allplants
starwars comingsoon vegansofinstagram somersetvegans cafe vegancafe plantside,8.0,"[""'love that! (see you next wednesday!)'""]",allplants
christmas dinner vegancooking veganism irishvegan veganfoodporn veganchristmas veganchristmasdinner vegansofinstagram vegansofireland vegansofinsta vegansofig veganfood ieatvegan itsvegan yesitsvegan plantbaseddiet ieatplants nourishyourself noanimalproducts vegetable christmascooking christmasdinner whatveganseat irishveganlady healthyfood veganfood,42.0,"[""'looks wonderful! merry christmas!!'""]",allplants
due family scheduling fact cooked awful lot roast dinner recently today beetroot rosemary roast roast potato parsnip sprout carrot roasted shallot stuffing lot gravy didnt save room mainly lafauxmagerie sneaking fromnatureuk cheese course jeavonstoffee stuffed relaxing late christmas style veganchristmas veganchristmasfood stuffed present cheese christmasdinner toffee,28.0,"[""'looks wonderful! merry christmas!!'""]",allplants
go winter wood grilled broccolini smoked onion dashi melted cipollini tofu tamago vedgephiladelphia winterflavors japaneseflavours dashi kombu onionsarevegetables dirtlist vedge smokethatshit,143.0,"[""'looks great! - i smoked some sun dried tomato last night and it’s quite the umami ..'"", ""'@chefrichardlandau it wa fantastic!! the entire meal- extraordinary '""]",allplants
somebody say sticky spicy smoked tofu sesame gridled pak choi gomasio broccoli bosh,10.0,[],allplants
tv keep eye peeled festive period first ever ad cant wait long dont blame here peek hope enjoy,243.0,"[""'#allplants #tvad #vegans #vegansofig #plantbased #foodies #veganish #vegeasy #veganuary #allplantschallenge #gogreen #fortheplanet'"", ""'greeeat food porn '"", ""'congrats guys!'"", ""'looks epic guys.'"", ""'this is amazing! well done '"", ""'well done! reminds u of that super epic lurpak ad from awhile back? wa that you #inspiration '""]",allplants
weekend stock last 50 plant sale specialoffer 50off flower plant earlwood waratahflorist florist moneyoff orchid succulent tropical outdoors,18.0,[],allplants
philodendron epipremnum pinnatum variegata philodendron epipremnumpinnatumvariegata forsale aroidmania aroidsofinstagram aroidaddict aroidlovers urbanjungle urbanjungleblogger plantmakepeoplehappy plantlover plantclubindonesia likeforlikes rama_nursery jualtanamanhiasmurah tanamanbikinhepi followforfollowback,52.0,[],allplants
succulentsingeelong echeveriacreamberry succulentaddictionecheveria succulentsofinstagramcalmingplants hoarderofsucculents26degreestoday aeoniumsallplantssucculentssedum birdsfruittreescherrysyuminstagram backyardgardenerfrontyardgardener echeveriacalmingplants,127.0,[],allplants
calathea ping rossi calathea calatheapinkrossy calathealovers jualtanamanmurah plantshopinginstagram plantshopjakarta tanamanunik tanamanbikinhepi jualcalathea seller plantseller rama_nursery,60.0,"[""'brp'""]",allplants
philodendron pigskin philodendron philodendronpigskin forsale plantshopinginstagram plantclubindonesia plantlover plantseller aroidaddictindonesia aroidaddicts plantmakepeoplehappy jualtanamanmurah plantshopjakarta rama_nursery,46.0,[],allplants
feast allwhats favourite festive iamsofullrightnow eatlikekingsandqueens kindcook veganchristmas,15.0,[],allplants
philodendron burlemark variegata philodendron philodendronburlemarxvariegated plantseller plantshopinginstagram plantclubindonesia aroidaddictindonesia planstagram jualtanamanmurah plantshopjakarta rama_nursery,52.0,[],allplants
little update one new acquisition guy merry christmas philodendron philodendronspcostarica philodendroncostarica plant youngplant amazingleaves swordleaves merrychristmas merryxmas holiday happyholidays familymoments,31.0,"[""'i love all of your plants!!! merry christmas '"", ""'merry christmas! always enjoy your post '""]",allplants
yo personally broccoli one yummiest vegetable stir fry used oil marinate artichoke heart buy costco might well add artichoke simply add soy sauce reduce charred turn good easy plant bomb fried rice,38.0,"[""'.\\n.\\n.\\n.\\n.\\n #whatveganseat #eatveganfood #veganfoodshare #veganfoodie #veganshare #veganaf #vegans #veganism #vegancommunity #veganlife #vgang #vegansofinstagram #vegansofig #vegansfoodlovers #eatvegan #noanimalsharmed #noanimalingredients #crueltyfree #mindfuleating \\xa0#govegan #allplants #friedrice #veganfriedrice #artichoke'""]",allplants
calathea medalion wa 085691028535 calathea jualcalathea calatheamedallion calathealovers jualtanahmurah jualtanamanhias plantclubindonesia plantshopinginstagram tanamanbikinhepi seller rama_nursery,61.0,"[""'brp'""]",allplants
family hope great christmas day thankyou support business year great year cant wait 2020 enjoy day beach going hot one apothecary beautyfood organic perthfood perthsmallbusiness perthgirlboss supplement naturalsupplements nutrition exercise smoothie healthy wellness herbalmedicine herb tonic superfoods superfoods perthisok perthpop theperthcollective perthcreatives beautysupplement adaptogens melbournefoodie sydneyfoodie botanical,25.0,"[""'merry christmas @inner_ego '""]",allplants
banana walnut pancake go breakfast treat fluffy pancake taste great loaded fresh berry maple syrup yum essential 2 cup gf oat flour blend gf oat 15 cup gf purpose flour ½ cup almond flour 15 tbsp baking powder tsp sea salt 15 tsp ground cinnamon ¼ tsp ground nutmeg 2 med ripe banana 3 tbsp melted coconut oil plus cooking 15 tbsp vanilla extract 25 tbsp maple syrup 2 ¼ cup nondairy milk like use oat coconut ¾ cup chopped walnut ¼ cup gf rolled oat top blend hand full berry add frozen wild blueberry andor top fresh berry step large bowl add oat flour gf purpose flour almond flour baking powder salt cinnamon nutmeg whisk together separate bowl mash banana add coconut oil vanilla extract maple syrup nondairy milk whisk together may microwave minute coconut oil begin harden add wet ingredient dry fold together fold chopped walnut oat berry wish add optional heat large skilletgriddle medium heat rub coconut oil hot spoon batter onto skillet cook bubble begin appear flip roughly 2 min side continue cooking amount pancake desired cooked batter refrigerated top favorite topping enjoy recipe make 15 large pancake 2530 small pancake glutenfree soyfree canolaoilfree dairyfree productivefoods healthy treat gaia healingfoods yoga wellness haolekitchen cleaneating recipe yum comfortfood bananapancakes breakfast,17.0,[],allplants
xmas eve madness upon u first opportunity eat today sourdough perfect avo tomato beautiful olive oil friend brought back marbella earlier year crushed tiny dried bird eye chilli top avocado avocadotoast sourdough avocadoandtomato veganfoodporn birdseyechilli spicyvegan wfpb fermentedfoods meatfreemeals veganlunch,30.0,[],allplants
christmas poem german thank much laura llikeliberation viola z veggie vegano peta2streetteam veganfortheanimals veganforanimals peace love karma vegetarian veggieworld veganboy vegangirl friendsnotfood veganforfit compassion happy crueltyfree liberationstuttgart veganfortheanimals earthling anonymousforthevoiceless veganstuttgart veganköln veganworld poem christmas festderliebe veganwerdenwaslosdigga peace love karma,21.0,[],allplants
another beautiful creation dolceveganfirenze last meal florence lasagna vegantravel lasagna poweredbyplants veganpower authenticfood italianfood veganitalian florenceitaly eatinginflorence,33.0,[],allplants
christmas nut roast wreath ready roasting christmas day lovely recipe jamieoliver subbed egg freeandeasyfoods egg replacer used sainsburys free form cheddar block instead cheese porcini risotto base toasted crushed almond pistachio bit breadcrumb flavoured sage thyme rosemary fresh chilli lemon zest generous glass wine bottom roasting dish fresh cranberry cooked little sugar cant wait see turn big day chris best ever gravy he competing title best gravy christmas day leah01925 know money veganfoodshare veganfoodporn veganchristmas veganchristmasfood plantbasedchristmas plantbasedchristmasdinner cantwait oneyearvegan merryveganchristmas allplantschristmas cookingwithmylove vegangravy gravyoff whosegonnawin gravycompetition whomakesthebestgravy,15.0,[],allplants
